PDV,SKU,SKU_PARA,DESCRIÇÃO,ESTOQUE ATUAL,FASES DO PRODUTO,MARCA
22543,87108,-,INSTANCE SAB BARR MORAN/IRRES 4x80g,0,Descontinuado,EUD
22543,87109,-,INSTANCE CREM MASS CPO MORAN/IRRES 180ml,61,Descontinuado,EUD
22543,87217,-,SCH INSTANCE LOC D H CPO BAUN VDA V3 7ml,0,Descontinuado,EUD
22543,87218,-,INSTANCE LOC DES HID CPO BAUN V2 75ml,5,Descontinuado,EUD
22543,87285,-,DEM CBEM DES COL BDY SPL DC/PESSEGUR 4ml,1,Descontinuado,BOT
22543,87372,-,COMB SIAGE HID MICELAR 02,0,Descontinuado,EUD
22543,87408,-,ESTJ LILY MAES/25,0,Descontinuado,BOT
22543,87409,-,ESTJ ELYSEE MAES/25,0,Descontinuado,BOT
22543,87410,-,ESTJ FLORATTA RED MAES/25,4,Descontinuado,BOT
22543,87411,-,ESTJ COFFEE WOMAN SEDUCTION MAES/25,0,Descontinuado,BOT
22543,87412,-,ESTJ LILY LEAU DE MAES/25,0,Descontinuado,BOT
22543,87413,-,ESTJ LIZ MAES/25,0,Descontinuado,BOT
22543,87414,-,ESTJ GLAMOUR SECRETS BLACK MAES/25,0,Descontinuado,BOT
22543,87415,-,ESTJ LINDA MAES/25,1,Descontinuado,BOT
22543,87416,-,ESTJ EGEO CHOC MAES/25,0,Descontinuado,BOT
22543,87418,-,ESTJ LILY CUIDADOS MAES/25,0,Descontinuado,BOT
22543,87419,-,ESTJ EGEO DOLCE MAES/25,1,Descontinuado,BOT
22543,87420,-,ESTJ LIZ SUBLIME MAES/25,0,Descontinuado,BOT
22543,87421,-,ESTJ NSPA AMEIXA MAES/25,1,Descontinuado,BOT
22543,87422,-,ESTJ CELEBRE FEM MAES/25,0,Descontinuado,BOT
22543,87423,-,ESTJ CBEM PESSEGURA MAES/25,1,Descontinuado,BOT
22543,87424,-,ESTJ CBEM DELEITE MAES/25,0,Descontinuado,BOT
22543,87998,-,COMB SIAGE REGENERACAO POS QUIMICA 03,0,Descontinuado,EUD
22543,88149,-,COMB CHIC RETRO MAES/25,0,Descontinuado,EUD
22543,88151,-,COMB AURIEN GOLD MAES/25,0,Descontinuado,EUD
22543,88153,-,COMB MAGNIFIC AUD  MAES/25,0,Descontinuado,EUD
22543,88154,-,COMB EUD K/M ROSA MARCANTE MAES/25,0,Descontinuado,EUD
22543,88160,-,COMB NIINA SECRETS MAES/25,0,Descontinuado,EUD
22543,88161,-,COMB LA VICTORIE MAES/25,0,Descontinuado,EUD
22543,88162,-,COMB LA PIEL AMBAR DOURADO MAES/25,0,Descontinuado,EUD
22543,88163,-,COMB LA PIEL AMBAR DOURADO 02 MAES/25,0,Descontinuado,EUD
22543,88166,-,COMB DIVA ARIANA GRANDE MAES/25,0,Descontinuado,EUD
22543,88167,-,COMB INSTANCE ROSA ABSOLUTA MAES/25,0,Descontinuado,EUD
22543,88169,-,COMB NIINA SECRETS 03 MAES/25,0,Descontinuado,EUD
22543,88170,-,COMB EUD BABY MAES/25,0,Descontinuado,EUD
22543,88171,-,COMB NIINA SKIN MAES/25,0,Descontinuado,EUD
22543,88172,-,COMB EUD BABY MAES/25,0,Descontinuado,EUD
22543,88173,-,COMB INSTANCE ROSA ABSOLUTA 02 MAES/25,0,Descontinuado,EUD
22543,88174,-,COMB INSTANCE ROSA ABSOLUTA 03 MAES/25,0,Descontinuado,EUD
22543,88175,-,COMB INSTANCE ROSA ABSOLUTA 04 MAES/25,0,Descontinuado,EUD
22543,88194,-,COMB DIVA ARIANA GRANDE 02 MAES/25,0,Descontinuado,EUD
22543,88195,-,COMB DIVA ARIANA GRANDE 03 MAES/25,0,Descontinuado,EUD
22543,88196,-,COMB GLAM AMULIPS MAES/25,0,Descontinuado,EUD
22543,88324,-,CATALOGO OUI EDIC 02/25 C5 A C7,1,Descontinuado,BOT
22543,88341,-,COMB SIAGE ACELERA/CRESCIMENTO 04,0,Descontinuado,EUD
22543,88352,-,COMB DIVA ESPLENDIDA AMOR/25,0,Descontinuado,EUD
22543,88646,-,CBEM DES COL BDY SPLSH M/LEIT V2 200ml,0,Descontinuado,BOT
22543,88715,87256,INSTANCE SAB LIQ MAOS BAUNILHA V2 400ml,0,Descontinuado,EUD
22543,89072,-,COMB NEO DERMO ACTIVE PRO 06,0,Descontinuado,EUD
22543,89078,-,COMB NEO DERMO PURIFIC 04,0,Descontinuado,EUD
22543,89079,-,COMB NEO DERMO PURIFIC 03,0,Descontinuado,EUD
22543,89090,-,COMB NIINA SKIN 08,0,Descontinuado,EUD
22543,89119,-,COMB FLORATTA ROSE NAM/25,0,Descontinuado,BOT
22543,89121,-,COMB EGEO BLUE  NAM/25,0,Descontinuado,BOT
22543,89122,-,COMB BOTICA 214 SEV/DOR NAM/25,0,Descontinuado,BOT
22543,89131,-,COMB LILY LUMIERE NAM/25,0,Descontinuado,BOT
22543,89132,-,COMB ELYSEE NUIT NAM/25,0,Descontinuado,BOT
22543,89149,-,COMB SIAGE NUTRI ACID COMPLX,0,Descontinuado,EUD
22543,89151,-,COMB SIAGE NUTRI ACID COMPLEX,0,Descontinuado,EUD
22543,89225,-,GUIA EUDORA CICLO 08 2025 PRM,1,Descontinuado,EUD
22543,89426,-,COMB IMP PAI/25,0,Descontinuado,EUD
22543,89427,-,COMB EUD K/M CABERNET PAIS/25,0,Descontinuado,EUD
22543,89500,-,COMB NIINA SKIN 09,0,Descontinuado,EUD
22543,89504,-,COMB NIINA SKIN 10,0,Descontinuado,EUD
22543,89505,-,COMB NEO DERMO ACTIVE PRO 07,0,Descontinuado,EUD
22543,89506,-,COMB N/DERMO PRO AGE 03,0,Descontinuado,EUD
22543,89507,-,COMB NEO DERMO PRO AGE 04,0,Descontinuado,EUD
22543,89509,-,COMB EUD BABY 03,0,Descontinuado,EUD
22543,89510,-,COMB EUD BABY 04,0,Descontinuado,EUD
22543,89511,-,COMB NEO DERMO ACTIVE PRO 08,0,Descontinuado,EUD
22543,89667,-,COMB IMPRESSION PAIS/25,0,Descontinuado,EUD
22543,89670,-,COMB CLUB 6 FLANKER 2025 PAIS/25,0,Descontinuado,EUD
22543,89673,-,COMB INSTANCE F/VER,0,Descontinuado,EUD
22543,89674,-,COMB INSTANCE BAUNILHA,0,Descontinuado,EUD
22543,89676,-,COMB ZAAD NAM/25,0,Descontinuado,BOT
22543,89727,-,COMB NSPA AMEI/NEG NAM/25,0,Descontinuado,BOT
22543,90036,-,COMB EUD MAKE SKIN PERFECTION,0,Descontinuado,EUD
22543,90039,-,COMB LILY LEAU/LILY BLANCHE MAES/25,0,Descontinuado,BOT
22543,90041,-,COMB NEO DERMO ACTIVE PRO 09,0,Descontinuado,EUD
22543,90045,-,COMB INSTANCE AMEIXA/PRALINE,0,Descontinuado,EUD
22543,90192,-,COMB CBEM NUVEM 02 NAM/25,0,Descontinuado,BOT
22543,90193,-,COMB BOTICOLLECTION NAM/25,0,Descontinuado,BOT
22543,90194,-,COMB MALBEC BLACK 02 NAM/25,0,Descontinuado,BOT
22543,90198,-,COMB CBEM CER/LIV NAM/25 02,0,Descontinuado,BOT
22543,90246,-,COMB QUASAR RUSH NAM/25,0,Descontinuado,BOT
22543,90385,-,COMB SIAGE MEN ESTIMULA/CRESCIMENTO,0,Descontinuado,EUD
22543,90386,-,COMB SIAGE MEN,0,Descontinuado,EUD
22543,90482,-,COMB SIAGE RECONST/FIOS 07,0,Descontinuado,EUD
22543,90483,-,COMB SIAGE NUTRI ROSE 07,0,Descontinuado,EUD
22543,90487,-,COMB NIINA SKIN 12,0,Descontinuado,EUD
22543,90488,-,COMB NIINA SKIN 13,0,Descontinuado,EUD
22543,90489,-,COMB NIINA SKIN 14,0,Descontinuado,EUD
22543,90490,-,COMB NIINA SKIN 15,0,Descontinuado,EUD
22543,90491,-,COMB NIINA SKIN 16,0,Descontinuado,EUD
22543,90492,-,COMB EUD KIDS CRIANC/25,0,Descontinuado,EUD
22543,91584,-,SOUL LAPIS RETR OLHOS PRETO 350mg,2,Descontinuado,EUD
22543,91715,87453,LYRA DES COL 75ml,5,Descontinuado,EUD
22543,92550,53519,SIAGE SHAMP RECONST OS FIOS 250ml RPCK,18,Descontinuado,EUD
22543,92551,53520,SIAGE COND RECONST/FIOS 200ml RPCK,0,Descontinuado,EUD
22543,92557,-,SIAGE SHAMP NUTRI DIAMOND 250ml RPCK,0,Descontinuado,EUD
22543,92558,-,SIAGE MASC CAP NUTRI DIAMOND 250g RPCK,0,Descontinuado,EUD
22543,92560,-,SIAGE COND NUTRI DIAMOND 200ml RPCK,0,Descontinuado,EUD
22543,92561,-,SIAGE OL CAP NUTRI DIAMOND 110ml RPCK,0,Descontinuado,EUD
22543,92604,53504,SIAGE SHAMP LISO INTENSO 250ml RPCK,0,Descontinuado,EUD
22543,92608,53471,SIAGE SHAMP MATIZ LOIRO EXPERT 250ml,0,Descontinuado,EUD
22543,92685,50274,EUD K/M LOC DES HID CPO NUD/CARAM 100ml,12,Descontinuado,EUD
22543,92762,57022,GLAM LAPIS RETR P/SOBRANC DEFIN PERF MED,0,Descontinuado,EUD
22543,92913,-,INSTANCE DES COL 50ml,0,Descontinuado,EUD
22543,93149,-,NEO PROT FAC FPS 50 DERMO ETG 50g,0,Descontinuado,EUD
22543,93150,-,NEO PROT FAC FPS 70 DERMO ETG 50g,0,Descontinuado,EUD
22543,93611,-,GLAM ESMALTE CREM LARANJA VERAO 7ml,4,Descontinuado,EUD
22543,93702,-,SCRT BLUSH/GO AMORA SEGREDO 5g,4,Descontinuado,EUD
22543,93703,-,SCRT BLUSH/GO PESSEGO SECRETO 5g,7,Descontinuado,EUD
22543,93744,-,LA PIEL OL DES HID CPO LOT/ORIENTE 200ml,3,Descontinuado,EUD
22543,93773,-,IMPRESSION EDP AUDAZ 100ml,1,Descontinuado,EUD
22543,93845,84946,SOUL MASC CILIO TRB 10g,0,Descontinuado,EUD
22543,93900,84908,"SOUL BAT LIQ EF NAT T/MOOD ROS EN 5,5ml",0,Descontinuado,EUD
22543,93910,54478,EUDORA H BALM POS BARBA 75g,1,Descontinuado,EUD
22543,9401,-,NIINA SECRETS GLOSS CRYSTAL TOPAZIO 7ml,2,Descontinuado,EUD
22543,94061,-,EUD LOC DES HID CPO VELV CRIST 150ml,0,Descontinuado,EUD
22543,94096,53141,IMENSI LOC DES HID CPO ALIVE 200ml,2,Descontinuado,EUD
22543,94097,53142,IMENSI DES COL ALIVE 100ml,33,Descontinuado,EUD
