PDV,SKU,SKU_PARA,DESCRIÇÃO,ESTOQUE ATUAL,FASES DO PRODUTO,MARCA
22543,56365,-,EUD K/M DES COL DELICIOUS 50ml,34,Descontinuado,EUD
22543,56404,-,COFFEE LOC DES HID CPO WOM ADDICT 200ml,0,Descontinuado,BOT
22543,56417,84878,"GLAM BAT LIQ DUO/CLIN CAN/SUBLIM V2 3,5g",0,Descontinuado,EUD
22543,56419,84881,"GLAM BAT LIQ DUO/CLIN ROSADO/ESS V2 3,5g",0,Descontinuado,EUD
22543,56421,84879,"GLAM BAT LIQ DUO/CLIN MAG/ENIG V2 3,5g",0,Descontinuado,EUD
22543,56422,84880,"GLAM BAT LIQ DUO/CLIN MASC/IRRES V2 3,5g",0,Descontinuado,EUD
22543,56423,84882,"GLAM BAT LIQ DUO/CLIN VERM/MAGNF V2 3,5g",0,Descontinuado,EUD
22543,56496,-,NIINA SECRETS PLT MULTIF CELEBRATION 52g,0,Descontinuado,EUD
22543,56529,-,NSPA SAB BARRA CPO ORQUIDEA NOIRE 90g,5,Descontinuado,BOT
22543,56530,-,FLORATTA LOC DES HID CPO ROM/VERAO 200ml,2,Descontinuado,BOT
22543,56541,-,PRIV EDP LA COLL AUX LEG PETIT POIS 75ml,0,Descontinuado,BOT
22543,56542,-,PRIV EDP LA COLL AUX LEG CAROTTE 75ml,0,Descontinuado,BOT
22543,56572,85268,EUD EDP ROSE 75ml,43,Descontinuado,EUD
22543,56573,-,DEM EUD EDP ROSE 4ml,0,Descontinuado,EUD
22543,56575,-,CJ FLAC EUD EDP ROSE 3x1ml,0,Descontinuado,EUD
22543,56613,-,ESTJ CLUB 6 VOYAGE NAM/24,0,Descontinuado,EUD
22543,56614,-,ESTJ PULSE NAM/24,0,Descontinuado,EUD
22543,56616,-,ESTJ EUD EDP NAM/24,0,Descontinuado,EUD
22543,56617,-,ESTJ DIVA ESPLENDIDA NAM/24,0,Descontinuado,EUD
22543,56623,84946,SOUL MASC CILIO TURBO V2 10g,16,Descontinuado,EUD
22543,56633,-,CJ FLAC OUI EDP LOR/LA MEDITER FEM 3x1ml,44,Descontinuado,BOT
22543,56648,-,ESTJ GLAM,7,Descontinuado,EUD
22543,56660,-,PMPCK NIINA SECRETS QUERIDINHOS,0,Descontinuado,EUD
22543,56665,-,EUD NECESS COLLECTION P PU,2,Descontinuado,EUD
22543,56666,-,EUD NECESS COLLECTION M PU,0,Descontinuado,EUD
22543,56668,-,EUD NECESS COLLECTION G PU,0,Descontinuado,EUD
22543,56669,-,EUD NECESS COLLECTION MASC PU,2,Descontinuado,EUD
22543,56677,-,EUD NECESS COLECAO 5 PU,0,Descontinuado,EUD
22543,56679,-,NIINA SCRT MASSAGEADOR FACIAL ALUM,0,Descontinuado,EUD
22543,56692,-,CJ AMOST GLAM BASE LIQ SK/PERF 3x2ml,20,Descontinuado,EUD
22543,56742,-,LA VICTORIE SAB BARRA INTENSE 2x90g,3,Descontinuado,EUD
22543,56761,-,"GLAM BAT LIQ DUO/CLIN VERM/IMPRESC 3,5g",17,Descontinuado,EUD
22543,56767,-,EUD PINC ESPECIAL MAQ ALUM,0,Descontinuado,EUD
22543,56770,-,EUD PORTA BATOM PAPEL,0,Descontinuado,EUD
22543,56774,-,EUD CURVADOR CILIOS ACO CARBONO,0,Descontinuado,EUD
22543,56801,-,ESTJ EUD SAB VELV CRISTAL 3x85g MAES/24,0,Descontinuado,EUD
22543,56810,88007,MATCH COND SCIENCE CRESCIMENTO V2 280ml,0,Descontinuado,BOT
22543,56813,-,ESTJ IMENSI ALIVE MAES/24,0,Descontinuado,EUD
22543,56814,-,ESTJ NIINA SECRETS MINI/24,0,Descontinuado,EUD
22543,56936,-,GLAMOUR DES COL SCRT BLACK MAES/24 30ml,0,Descontinuado,BOT
22543,56956,87477,QDB BAT LIQ CR DOS SONHOS VERMELITE 4ml,0,Descontinuado,QDB
22543,56957,87605,QDB BAT LIQ CREM DOS SONHOS ROSITE 4ml,0,Descontinuado,QDB
22543,56958,87606,QDB BAT LIQ CREM DOS SONHOS ROXITE 4ml,0,Descontinuado,QDB
22543,56959,87476,QDB BAT LIQ CREM DOS SONHOS MARRONZ 4ml,0,Descontinuado,QDB
22543,56990,-,CBEM SHAMP ABACAXI FEIRA BRASIL 230ml,47,Descontinuado,BOT
22543,56991,-,CBEM COND MANGA FEIRA BRASIL 170ml,17,Descontinuado,BOT
22543,57025,-,NIINA SECRETS LOC DES HID CPO ILUM 100ml,0,Descontinuado,EUD
22543,57044,-,CBEM SRUM CPO UNIF PESSEGUR/DEPIL 30ml,11,Descontinuado,BOT
22543,57057,-,EUD CX PRESENTEAVEL MAES/24,0,Descontinuado,EUD
22543,57231,-,ESTJ EUDORA H PAIS/24,0,Descontinuado,EUD
22543,57232,-,ESTJ PULSE ACTION PAIS/24,0,Descontinuado,EUD
22543,57234,-,OUI SHW GEL CAB/CPO LOR DE MEDIT 200g,3,Descontinuado,BOT
22543,57235,-,OUI LOC DES HID CPO LOR DE MEDIT 200ml,6,Descontinuado,BOT
22543,57390,86751,EUD CREM DES HID CPO ROSE 250g,38,Descontinuado,EUD
22543,57444,-,MAKE B BAT LIQ VELV/SBLM ONE DEEP/CAR 2g,3,Descontinuado,BOT
22543,57445,-,MAKE B BAT LIQ VELV/SBLM ONE FREN/ROS 2g,3,Descontinuado,BOT
22543,57446,-,QDB AGUA MICELAR H/POTTER SKINQ 110ml,0,Descontinuado,QDB
22543,57456,-,ESTJ QUASAR CLASSIC PAIS/24,16,Descontinuado,BOT
22543,57473,-,"MAKE B ILUM FAC STCK SUN HIT ROSE 6,5g",0,Descontinuado,BOT
22543,57486,-,CJ FLAC MAGNIFIC D/COL RGE/CAM VDA 3x1ml,0,Descontinuado,EUD
22543,57489,85845,NIINA SKIN GEL LIMPEZA FACIAL 300g,0,Descontinuado,EUD
22543,57495,-,CJ SCH CBEM FEIRA BRASIL SH/COND 2x7ml,0,Descontinuado,BOT
22543,57505,-,MAKE B PLT SOMBRAS ONE 24g,2,Descontinuado,BOT
22543,57521,-,ESTJ LILY AMOR/24,0,Descontinuado,BOT
22543,57530,-,ESTJ EGEO CHOC AMOR/24,0,Descontinuado,BOT
22543,57531,-,ESTJ EGEO BLUE AMOR/24,0,Descontinuado,BOT
22543,57534,-,ESTJ CELEBRE AGORA FEM AMOR/24,0,Descontinuado,BOT
22543,57537,-,LILY GELEIA ILUM DES HID CPO 75g,0,Descontinuado,BOT
22543,57545,-,CBEM DES ANTIT ROLL BOB ESPNJ 55ml,0,Descontinuado,BOT
22543,57546,-,COFFEE SHW GEL CAB/CPO MAN V2 200g,0,Descontinuado,BOT
22543,57556,-,EGEO DES COL CHOC BERRY 50ml,0,Descontinuado,BOT
22543,57568,-,DEM EUD K/M DES COL LOVELY V2 4ml,0,Descontinuado,EUD
22543,57582,-,MAKE B BAT LIQ MAT C/AC POL RED/BLOS 5ml,1,Descontinuado,BOT
22543,57704,-,ESTJ INTENTION MAN PAIS/24,0,Descontinuado,EUD
22543,57743,-,CJ SCH BOT SUN A/F PR FAC C1/C2/C3 3x5ml,4,Descontinuado,BOT
22543,57744,-,CJ SCH BOT SUN A/F PR FAC C3/C4/C5 3x5ml,13,Descontinuado,BOT
22543,57766,-,"INTENSE BAT CREM POP ROSA MALVA 3,6g",6,Descontinuado,BOT
22543,57767,-,"INTENSE BAT CREM POP VERMELHO 3,6g",64,Descontinuado,BOT
22543,57802,-,CJ SCH N/DERM PRT/S F FPS50/70 DEF 2x2ml,0,Descontinuado,EUD
22543,57835,-,NSPA CR FIRM COLO 5/1 CER/ROUGE 200g,2,Descontinuado,BOT
22543,57897,-,COMB EUD INDULGENT,0,Descontinuado,EUD
22543,57898,-,COMB LA VICTORIE,0,Descontinuado,EUD
22543,57903,-,SCH INSTANCE CR D H CP AME/PR RPCK 3x7ml,0,Descontinuado,EUD
22543,58024,-,CLUB 6 DES ANTIT ROLL ON FEVER 55ml,0,Descontinuado,EUD
22543,58025,87766,INSTANCE SPR D/COL PERF AME/PR V2 200ml,0,Descontinuado,EUD
22543,58084,-,"SOUL K/M BAT HID MARROM DELICIOUS 3,7g",0,Descontinuado,EUD
22543,58118,-,INTENSE LAP DUO OLHOS FEIRA COCO MACA 1g,2,Descontinuado,BOT
22543,58123,-,BOTICARIO NECESSAIRE NYLON,1,Descontinuado,BOT
22543,58133,-,DEM CBEM D/COL BDY SPLSH DEL/CHOCOL 4ml,0,Descontinuado,BOT
22543,58219,-,NSPA CREM ANT/RESSEC MAOS CER/ROUGE 50g,4,Descontinuado,BOT
22543,58237,-,CBEM LOC DES HID CPO ILUM NUV/ALEG 150ml,5,Descontinuado,BOT
22543,58238,-,CBEM SAB LIQ CPO NUV/ALEGRIA 150ml,15,Descontinuado,BOT
22543,58244,-,LINDA CREM DES HID CPO MAES/24 75ml,0,Descontinuado,BOT
22543,58257,-,"SOUL K/M GLOS DOC/FIN BBOM/AVEL 5,2ml",0,Descontinuado,EUD
22543,58275,-,QDB EDP SEMPRE DESOBEDIENTE 100ml,12,Descontinuado,QDB
22543,58315,-,BOTICA 214 LOC D H CP AFR/SU FL/FR 200g,2,Descontinuado,BOT
22543,58331,84926,SOUL LAPIS RETR TURBO PRETA 300mg,8,Descontinuado,EUD
22543,58332,84928,SOUL LAPIS RETR TURBO MARROM 300mg,8,Descontinuado,EUD
22543,58355,-,SOUL MASC CILIOS TURBO ULTR/RESIST 10g,9,Descontinuado,EUD
22543,58383,-,NSPA OL MULTIF GLORIOSO CER/ROUGE 85ml,5,Descontinuado,BOT
22543,58402,-,SCH LA PIEL LOC DES H CP BIOSENS VDA 7ml,0,Descontinuado,EUD
22543,58403,-,SCH LA PIEL LOC DES HID CPO BIOSENS 7ml,0,Descontinuado,EUD
22543,58442,-,ESTJ LILY EDP NAT/24,0,Descontinuado,BOT
22543,58444,-,ESTJ COFFEE WOMAN SEDUCTION NAT/24,0,Descontinuado,BOT
22543,58445,-,ESTJ LILY ACETINADOS NAT/24,0,Descontinuado,BOT
22543,58446,-,ESTJ HER CODE NAT/24,0,Descontinuado,BOT
22543,58449,-,ESTJ GLAMOUR SEC/BL NAT/24,0,Descontinuado,BOT
22543,58451,-,ESTJ UOMINI NAT/24,0,Descontinuado,BOT
22543,58453,-,ESTJ QUASAR VISION NAT/24,0,Descontinuado,BOT
22543,58454,-,ESTJ EGEO CHOC NAT/24,0,Descontinuado,BOT
22543,58456,-,ESTJ BOTICOLL PORTINARI NAT/24,0,Descontinuado,BOT
22543,58457,-,ESTJ EGEO DOLCE NAT/24,0,Descontinuado,BOT
22543,58458,-,ESTJ LINDA IRRESISTIVEL NAT/24,0,Descontinuado,BOT
22543,58460,-,ESTJ LIZ NAT/24,0,Descontinuado,BOT
22543,58461,-,ESTJ NSPA AMEI NAT/24,0,Descontinuado,BOT
22543,58462,-,ESTJ CBEM BOA NOITE NAT/24,0,Descontinuado,BOT
22543,58463,-,ESTJ NSPA AMEIXA DOURADA NAT/24,0,Descontinuado,BOT
22543,58465,-,ESTJ EGEO BOMB BLACK NAT/24,0,Descontinuado,BOT
22543,58466,-,ESTJ CELEBRE AGORA MASC NAT/24,0,Descontinuado,BOT
22543,58467,-,ESTJ CELEBRE AGORA FEM NAT/24,0,Descontinuado,BOT
22543,58471,-,ESTJ CBEM FEIRA NAT/24,0,Descontinuado,BOT
22543,58480,-,ESTJ ZAAD NAT/24,0,Descontinuado,BOT
22543,58484,-,ESTJ MEN BARBA PAIS/24,14,Descontinuado,BOT
22543,58493,-,COFFEE LOC DES HID CPO MAN AMERIC 200ml,5,Descontinuado,BOT
22543,58511,-,DR BOTICA BONECO PELUCIA PES V2,0,Descontinuado,BOT
22543,58533,-,QUASAR DES COL DEEP BLUE PRM 10ml,0,Descontinuado,BOT
22543,58560,-,COMB CLUB 6 02,0,Descontinuado,EUD
22543,58590,-,BOTICA 214 SHW GEL CAB/CP/ROS V/FIR 100g,0,Descontinuado,BOT
22543,58594,-,EGEO SHW GEL CAB/CPO BOMB BLACK 100g,0,Descontinuado,BOT
22543,58596,-,NSPA CREM HID MAO AMEI DOUR 30g,0,Descontinuado,BOT
22543,58636,-,INSTANCE D/COL SPR CP PERF BAUN/GL 200ml,0,Descontinuado,EUD
22543,58642,-,DEM INSTANCE D/C SPR CP PERF BAUN/GL 4ml,0,Descontinuado,EUD
22543,58664,-,ESTJ EUD GOLDEN EDP NAT/24,0,Descontinuado,EUD
22543,58665,-,ESTJ INTENTION MAN BAD NAT/24,0,Descontinuado,EUD
22543,58666,-,ESTJ CLUB 6 NAT/24,0,Descontinuado,EUD
22543,58667,-,ESTJ DIVA NAT/24,0,Descontinuado,EUD
22543,58668,-,ESTJ SIAGE GLOW EXPERT NAT/24,8,Descontinuado,EUD
22543,58669,-,ESTJ EUD VELVET SENSUAL NAT/24,0,Descontinuado,EUD
22543,58670,-,ESTJ EUD KISS ME CABERNET NAT/24,0,Descontinuado,EUD
22543,58671,-,ESTJ NIINA SECRETS NAT/24,0,Descontinuado,EUD
22543,58672,-,ESTJ IMPRESSION NAT/24,0,Descontinuado,EUD
22543,58673,-,ESTJ LA VICTORIE INTENSE NAT/24,0,Descontinuado,EUD
22543,58674,-,ESTJ SOUL NAT/24,3,Descontinuado,EUD
22543,58676,-,ESTJ INSTANCE KARITE NAT/24,0,Descontinuado,EUD
22543,58685,-,DEM OUI EDP LOR/MEDITER MASC 5ml,37,Descontinuado,BOT
22543,58741,-,INSTANCE FONDUE HID CPO AME/PR RPK 180ml,12,Descontinuado,EUD
22543,58770,-,ESTJ CASA 214 VANILLA SUBLIME NAT/24,1,Descontinuado,BOT
22543,58772,-,ESTJ MALBEC X NAT/24,0,Descontinuado,BOT
22543,58774,-,MALBEC DES BDY SPR GOLD 100ml,0,Descontinuado,BOT
22543,58788,-,BOTI MASC P/DORMIR CETIM NAT/24,0,Descontinuado,BOT
22543,58838,85396,INSTANCE CR PERF MAOS AMEI/PRAL RPCK 30g,7,Descontinuado,EUD
22543,58841,85395,INSTAN SAB VEG PERF BAR AME/PR RPK 4x80g,0,Descontinuado,EUD
22543,58842,-,SCH INSTAN CR D H C AME/PR RPK VDA 7ml,0,Descontinuado,EUD
22543,58848,-,CJ FLAC CLUB 6 DES COL SPOTLIGHT 3x1ml,44,Descontinuado,EUD
22543,58865,-,BOTI NECESS PREM FEM BRANCA PU NAT/24,0,Descontinuado,BOT
22543,58868,-,BOTI NECESS PREM MASC MARROM PES NAT/24,0,Descontinuado,BOT
22543,58869,-,BOTI NECESS MASC AZUL LONA NAT/24,0,Descontinuado,BOT
22543,58901,-,COMB SIAGE LISO INTENSO,0,Descontinuado,EUD
22543,58919,-,EGEO DES COL BANANA 90ml,2,Descontinuado,BOT
22543,58923,-,DEM EGEO DES COL BANANA 4ml,22,Descontinuado,BOT
22543,58926,-,EUD CX COMB ESPECIAL NAM/24,0,Descontinuado,EUD
22543,58928,-,ESTJ DR BOTICA POCAO CORACAO CRIANCAS/24,0,Descontinuado,BOT
22543,58929,-,ESTJ DR BOTICA POCAO CORAGEM CRIANCAS/24,2,Descontinuado,BOT
22543,58930,-,ESTJ MA CHERIE 24,28,Descontinuado,BOT
22543,58935,-,INSTANCE CR DES HID CPO BAUN/GLOW 400ml,0,Descontinuado,EUD
22543,59009,-,CJ SCH GLAM BAS LIQ SECOND SKIN 3x2ml,0,Descontinuado,EUD
22543,59014,-,CJ FLAC DIVA DES COL SUPREMA 3x1ml,0,Descontinuado,EUD
22543,59051,-,MAKE B BAT LIQ RETIN 3 H RED VELVET 6ml,1,Descontinuado,BOT
22543,59052,-,MAKE B BAT LIQ RETIN 3 H PINK/HIBISC 6ml,2,Descontinuado,BOT
22543,59057,-,EUD CX COMB ESPECIAL FEM NAM/24,0,Descontinuado,EUD
22543,59058,-,DEM EGEO DES COL MELANCIA 4ml,25,Descontinuado,BOT
22543,59066,85315,INSTANCE CREM HID P/MAOS ROS/ABSOL 30g,0,Descontinuado,EUD
22543,59068,85353,INSTANCE SAB VEGT BAR PERF ROS/ABS 4x80g,25,Descontinuado,EUD
22543,59069,-,SCH INSTANCE LOC D H CPO ROS/ABS VDA 7ml,0,Descontinuado,EUD
22543,59070,85314,INSTANCE OL BIF CP ROS/ABS INF/ROS 200ml,10,Descontinuado,EUD
22543,59127,-,CJ SCH GLAM BAS LIQ SK/PERF VDA 3x2ml,0,Descontinuado,EUD
22543,59128,-,CJ SCH GLAM BAS LIQ SECON SKIN VDA 3x2ml,0,Descontinuado,EUD
22543,59146,-,LILY LEITE SBLM DES CPO ACETINADO 250ml,3,Descontinuado,BOT
22543,59147,-,LILY ESF HID CPO ACETINADO 200g,3,Descontinuado,BOT
22543,59183,-,GLAMOUR CR DES H CP SCRT/BL INTENS 200ml,7,Descontinuado,BOT
22543,59207,-,MAGNIFIC LOC DES HID CPO RGE/CAMEL 200ml,0,Descontinuado,EUD
22543,59244,-,INSTANCE DES/C B/SPL D/FIN M/FRAMB 200ml,0,Descontinuado,EUD
22543,59290,-,LA VICTORIE CR DES H CPO INTENSE V2 200g,0,Descontinuado,EUD
22543,59306,87896,FLORATTA EDP RED PASSION 75ml,67,Descontinuado,BOT
22543,59313,-,KIT SACOLA M EUDORA UNIT MAES/24,0,Descontinuado,EUD
22543,59314,-,KIT CAIXA M EUDORA MAES/24,0,Descontinuado,EUD
22543,59315,-,ENVELOPE P EUDORA MAES/24,0,Descontinuado,EUD
22543,59403,-,CBEM LOC DES HID CPO MELANC 400ml,15,Descontinuado,BOT
22543,59404,-,CBEM CREM HID DES CPO MELANC 150ml,7,Descontinuado,BOT
22543,59405,-,CBEM GEL ESF CPO MELANC 150g,2,Descontinuado,BOT
22543,59470,-,QDB BAT LIQ ILUMIMATTE ROSELUMI 4ml,0,Descontinuado,QDB
22543,59471,-,QDB BAT LIQ ILUMIMATTE ROSALUMI 4ml,0,Descontinuado,QDB
22543,59481,-,QDB BLUSH COMP SALVAMOS O DIA JUNTAS 4g,10,Descontinuado,QDB
22543,59837,-,QDB HID FAC DOCINHO MENIN/SUPERPOD 40ml,4,Descontinuado,QDB
22543,59838,-,QDB HID LAB FLORZINHA MENIN/SUPERPOD 9g,10,Descontinuado,QDB
22543,59891,-,"NIINA SCRT BAT DUO PERF/MATCH VERM 1,65g",6,Descontinuado,EUD
22543,59925,-,GLAM ILUM FAC COMP PAETE SHINE 5g,0,Descontinuado,EUD
22543,59926,-,GLAM GLITTER MULTIF PAETE SHINE ROSE 1g,0,Descontinuado,EUD
22543,59958,-,KIT SACOLA M EUDORA UNIT NATAL/24,0,Descontinuado,EUD
22543,59959,-,KIT CAIXA M EUDORA NATAL 2024,0,Descontinuado,EUD
22543,59960,-,ENVELOPE P EUDORA NATAL/24,0,Descontinuado,EUD
22543,70112,-,BOTICA 214 LC D/HD SEV/DOR AMOR/25 200ml,10,Descontinuado,BOT
22543,70677,-,BOTI BABY SAB BARRA LUA 2X85g,27,Descontinuado,BOT
22543,70882,84915,"SOUL DELIN LIQ OLHO PRET ESSENCIAL 2,5ml",0,Descontinuado,EUD
22543,71183,48774,NSPA DES ANTIT AER AMEI 75g,5,Descontinuado,BOT
22543,72050,53941,CAPRICHO DES COL 50ML,3,Descontinuado,BOT
22543,72337,-,NEO D/ETG PR SOL FPS50 CC CR B/NAT 40g,0,Descontinuado,EUD
22543,72483,53935,FLORATTA DES ANTIT ROLL BLUE 55ml V6,14,Descontinuado,BOT
22543,7290,-,NIINA SKIN ESF FAC 75g,0,Descontinuado,EUD
22543,73608,84388,MALBEC DES COL NOIR 100ml V2,4,Descontinuado,BOT
22543,73794,50214,MALBEC POS BARB CLUB 100g,0,Descontinuado,BOT
22543,73811,56027,MEN SAB BARRA 2X90g V3,0,Descontinuado,BOT
22543,73849,84391,MALBEC DES COL GOLD 100ml V2,0,Descontinuado,BOT
22543,7396,85915,NIINA SKIN GEL DE LIMP FAC 100g,0,Descontinuado,EUD
22543,74222,53931,MEN DES ANTIT AER 75g V4,0,Descontinuado,BOT
22543,74440,-,ARBO DES COL LIBERTE 100ml V2,41,Descontinuado,BOT
22543,74723,84392,MALBEC DES COL BLACK 100ml,0,Descontinuado,BOT
22543,74906,86752,MALBEC SHW GEL CPO BLACK 200g,0,Descontinuado,BOT
22543,75033,-,CAPRICHO DES COL WISH 50ML,1,Descontinuado,BOT
22543,75152,85543,CBEM LOC HID DES CPO DELEITE 200ml,2,Descontinuado,BOT
22543,75163,59169,SOPHIE COND CACH 200ML,11,Descontinuado,BOT
22543,75164,59170,SOPHIE CREM PENT CACH 200ML,13,Descontinuado,BOT
22543,75225,-,QDB BAT LIQ SUPERMATE CASTANHELI 4ml,5,Descontinuado,QDB
22543,75231,-,QDB BAT LIQ SUPERMATE CACAULI 4ml,5,Descontinuado,QDB
22543,75243,-,QDB BAT LIQ SUPERMATE CARAMELI 4ml,5,Descontinuado,QDB
22543,75493,59134,"MAKE B PO COMP FAC ILUM GOLD 5,4g",2,Descontinuado,BOT
22543,75609,-,INTENSE DES COL BOOM 50ML,4,Descontinuado,BOT
22543,75653,-,INTENSE MASC P/SOBRANC 1 3g,1,Descontinuado,BOT
22543,75654,-,INTENSE MASC P/SOBRANC 2 3g,1,Descontinuado,BOT
22543,75748,87041,MAKE B BAS LIQ PROT HYAL 70 COR 15 30ml,1,Descontinuado,BOT
22543,75750,87043,MAKE B BAS LIQ PROT HYAL 70 COR 25 30ml,0,Descontinuado,BOT
22543,75751,87044,MAKE B BAS LIQ PROT HYAL 70 COR 30 30ml,3,Descontinuado,BOT
22543,75772,58392,BOTI CJ DEM FLACON DES COL FEM VD 4ML V3,0,Descontinuado,BOT
22543,75775,-,KIT DEM BOTI PREMIUM VE C/4 V7,0,Descontinuado,BOT
22543,75792,48303,FLORATTA DES COL RED 75ml,171,Descontinuado,BOT
22543,75827,53929,MALBEC DES ANTIT AER GOLD 75g/125ml V2,2,Descontinuado,BOT
22543,75829,53927,MALBEC DES ANT AER MAGNETIC 75g/125ml V2,4,Descontinuado,BOT
22543,75877,-,FLORATTA EDP FLEUR SUPREME 75ml,18,Descontinuado,BOT
22543,75878,-,FLORATTA CR DES H CPO INT FL/SUP 250g,7,Descontinuado,BOT
22543,76664,-,MEN DES COL NEW 100ml,10,Descontinuado,BOT
22543,76670,-,DEM FLORATTA EDP FLEUR SUPREME 4ml,0,Descontinuado,BOT
22543,76681,-,BOTICOLL HORIZONTE DES COL 100ml,41,Descontinuado,BOT
22543,76840,50756,MAKE B MASC CILIOS POSTICOS V2 12g,7,Descontinuado,BOT
22543,77487,-,UOMINI DES ANTIT AER BLACK 75g V7,40,Descontinuado,BOT
22543,77530,-,MATCH MASC CAP BRLH 250g,8,Descontinuado,BOT
22543,77690,49825,CBEM LOC DES HID CPO BEIJINHO 400ml,19,Descontinuado,BOT
22543,77691,49824,CBEM LOC DES HID CPO BEIJINHO 200ml,5,Descontinuado,BOT
22543,77692,-,CBEM CREM HID MAOS BEIJINHO 50g,2,Descontinuado,BOT
22543,77773,-,QUASAR NEXT COL 50ml,16,Descontinuado,BOT
22543,77775,54170,QUASAR NEXT SHOWER GEL CAB/CPO 200g,5,Descontinuado,BOT
22543,79369,-,ESTJ EUD EDP ROXO MAES/25,0,Descontinuado,EUD
22543,79370,-,ESTJ EUD VELVET AUTHENTIC MAES/25,5,Descontinuado,EUD
22543,79371,-,ESTJ SIAGE NUTRI ROSE MAES/25,0,Descontinuado,EUD
22543,79372,-,ESTJ LYRA MAES/25,0,Descontinuado,EUD
22543,79373,-,ESTJ INSTANCE FRUTAS VERMELHAS MAES/25,0,Descontinuado,EUD
22543,79376,-,ESTJ NIINA SECRETS NAM/25,18,Descontinuado,EUD
22543,79377,-,ESTJ LA VICTORIE INTENSE NAM/25,0,Descontinuado,EUD
22543,79633,87047,MAKE B BAS LIQ PROT HYAL 70 COR 60 30ml,1,Descontinuado,BOT
22543,79648,-,MATCH COND ANTI IDADE DESMRL 250ml,0,Descontinuado,BOT
22543,79649,-,MATCH MASC CAP ANTI IDADE 250g,3,Descontinuado,BOT
22543,80358,53441,SIAGE COND REG POS QUIM 200ml RPCK,0,Descontinuado,EUD
22543,80361,-,DR BOTICA GEL FIX CAP 80g,14,Descontinuado,BOT
22543,80448,-,QDB SRUM CONC ANTIOX VITAM C 30ml,9,Descontinuado,QDB
22543,80698,59493,MALBEC SHAMP GREY CLUB 250ml V2,0,Descontinuado,BOT
22543,80729,85668,"MAKE B PO COMP FAC ILUM ROSE 5,4g",1,Descontinuado,BOT
22543,80761,84399,MALBEC DES COL FLAME 100ml,43,Descontinuado,BOT
22543,80813,-,MAKE B BAT LIQ DIAM AC/HIAL PLATINUM 5ml,7,Descontinuado,BOT
22543,81165,-,CBEM LOC DES H REFR CPO BEND/CACT 400ML,1,Descontinuado,BOT
22543,81166,-,CBEM LOC DES H REFR CPO BEND/CACT 200ml,0,Descontinuado,BOT
22543,81177,-,MAKE B EDP ROSE 75ml,1,Descontinuado,BOT
22543,81178,-,MAKE B EDP GOLD 75ml,0,Descontinuado,BOT
22543,81181,-,MATCH MASC CAP FORCA 250g,3,Descontinuado,BOT
22543,81508,87203,KIT BOTIK COMPLETO,0,Descontinuado,BOT
22543,81568,56025,MEN SHW GEL CAB/CPO/BARB 205g V4,0,Descontinuado,BOT
22543,81650,-,MATCH SHAMP A/RESID OLEOSOS 250ml,2,Descontinuado,BOT
22543,82097,-,OUI SAB BARRA LAMOURESSE 142 190g,3,Descontinuado,BOT
22543,82239,87039,MAKE B BAS LIQ PROT HYAL 70 INVIS 30ml,0,Descontinuado,BOT
22543,82476,53934,BOTICOL PORTINARI DES ANT/A 75g/125ml V7,6,Descontinuado,BOT
22543,82492,-,"REF MAKE B BAT CR C/AC POL ROS CASH 3,6g",2,Descontinuado,BOT
22543,82528,58566,"MAKE B CORRET LIQ FAC EFFECT 10 5,7ml",0,Descontinuado,BOT
22543,82529,58622,"MAKE B CORRET LIQ FAC EFFECT 15 5,7ml",0,Descontinuado,BOT
22543,82530,58624,"MAKE B CORRET LIQ FAC EFFECT 20 5,7ml",0,Descontinuado,BOT
22543,82531,58626,"MAKE B CORRET LIQ FAC EFFECT 25 5,7ml",0,Descontinuado,BOT
22543,82532,58627,"MAKE B CORRET LIQ FAC EFFECT 30 5,7ml",0,Descontinuado,BOT
22543,82533,58628,"MAKE B CORRET LIQ FAC EFFECT 40 5,7ml",0,Descontinuado,BOT
22543,82534,58629,"MAKE B CORRET LIQ FAC EFFECT 50 5,7ml",2,Descontinuado,BOT
22543,82535,58630,"MAKE B CORRET LIQ FAC EFFECT 60 5,7ml",0,Descontinuado,BOT
22543,82536,58631,"MAKE B CORRET LIQ FAC EFFECT 70 5,7ml",2,Descontinuado,BOT
22543,82537,58632,"MAKE B CORRET LIQ FAC EFFECT 80 5,7ml",0,Descontinuado,BOT
22543,82610,-,"MAKE B CORRET LIQ FAC FL IL RET H50 2,5g",1,Descontinuado,BOT
22543,82613,-,"MAKE B CORRET LIQ FAC FL IL RET H70 2,5g",1,Descontinuado,BOT
22543,82615,-,"MAKE B CORRET LIQ FAC FL IL RET H80 2,5g",2,Descontinuado,BOT
22543,82704,59579,MATCH SHAMP NUTR PROF 300ml,15,Descontinuado,BOT
22543,82705,85125,MATCH COND NUTR PROF 280ml,5,Descontinuado,BOT
22543,82708,59577,MATCH MASC CAP NUTR PROF 250g,5,Descontinuado,BOT
22543,82709,59574,MATCH OL CAP NUTR PROF 50ml,0,Descontinuado,BOT
22543,82788,57982,CBEM SHAMP HIDRATACAO NUVEM 250ml,3,Descontinuado,BOT
22543,82789,59188,CBEM SHAMP FEIRA BANANA 230ml,2,Descontinuado,BOT
22543,82792,-,CBEM SHAMP REST BEIJINHO 250ml,4,Descontinuado,BOT
22543,82795,59197,CBEM COND FEIRA PASTA ABACATE 170ml,0,Descontinuado,BOT
22543,82798,-,CBEM COND REST BEIJINHO 250ml,10,Descontinuado,BOT
22543,83052,49897,CBEM LOC DES HID CPO CER LIVRE 400ml,5,Descontinuado,BOT
22543,83053,49898,CBEM LOC DES HID CPO CER LIVRE 200ml,10,Descontinuado,BOT
22543,83068,-,LILY EDP LUMIER 30ml,0,Descontinuado,BOT
22543,83081,-,CAPRICHO DES COL HELLO STARS 50ml,0,Descontinuado,BOT
22543,83124,84743,REF MATCH MASC CAP NUTR/PROF 250ml,4,Descontinuado,BOT
22543,83167,85548,REF MATCH COND NUTR/PROF 250ml,0,Descontinuado,BOT
22543,83188,84400,MALBEC DES COL BLEU 100ml,5,Descontinuado,BOT
22543,83606,87040,MAKE B BAS LIQ PROT HYAL 70 COR 10 30ml,1,Descontinuado,BOT
22543,83607,87049,MAKE B BAS LIQ PROT HYAL 70 COR 80 30ml,0,Descontinuado,BOT
22543,83622,-,QDB LOC DES HID CPO NUTRI 200ml,13,Descontinuado,QDB
22543,83624,-,QDB CR HID MAO NUTRI 30g,5,Descontinuado,QDB
22543,83726,-,CBEM MASC REST CAP BEIJINHO 250ml,1,Descontinuado,BOT
22543,83773,-,AROMATER DES COL ENERG 75ml,1,Descontinuado,BOT
22543,84203,49943,CBEM LOC DES HID CPO PESSEGURA 400ml,4,Descontinuado,BOT
22543,84223,-,GLAMOUR DES COL JUST SHINE 75ml V2,3,Descontinuado,BOT
22543,84229,-,GLAMOUR OL DES HID CPO SEC BL 150ml V3,5,Descontinuado,BOT
22543,84243,49944,REF CBEM LOC DES HID CPO PESSEGURA 350ml,34,Descontinuado,BOT
22543,84313,57091,CBEM SHAMP FEIRA VINAGRE MACA 230ml,4,Descontinuado,BOT
22543,84314,87454,CBEM COND FEIRA OL/COCO 170ml,7,Descontinuado,BOT
22543,84454,-,OUI SAB BARR SAVON PARFUM ICONIQUE 190g,5,Descontinuado,BOT
22543,84481,-,QDB MANTG DES HID CPO NUTRI 100g,2,Descontinuado,QDB
22543,84488,-,LINDA LOC DES HID CPO REG 200ml v2,17,Descontinuado,BOT
22543,84502,-,CJ SCH MATCH MASC CAP POS/QUIM 4x7ml,4,Descontinuado,BOT
22543,84604,-,FLORATTA NECESS PU MAES/25 ESTJ,0,Descontinuado,BOT
22543,84606,-,LINDA NECESSAIRE PU MAES/25 ESTJ,0,Descontinuado,BOT
22543,84624,-,NSPA ESPONJA BANHO PU MAES/25 ESTJ,0,Descontinuado,BOT
22543,84667,-,ESTJ CLUB 6 VOYAGE NAM/25,1,Descontinuado,EUD
22543,84671,-,ESTJ EUDORA H NAM/25,4,Descontinuado,EUD
22543,84677,-,MALBEC SAB BARRA PURE GOLD 2x80g,83,Descontinuado,BOT
22543,84691,-,EUD MOUSSE BANHO ROUGE 150g,0,Descontinuado,EUD
22543,85095,-,"EUD K/M BAT HID CHERRY CER/DIVINA 3,7g",0,Descontinuado,EUD
22543,85104,-,COFFEE SAB LIQ CPO WOMAN SEDUCTION 150ml,0,Descontinuado,BOT
22543,85105,-,LIZ CREM DES HID CPO SUBLIME 100ml,0,Descontinuado,BOT
22543,85259,-,BOTICOLL PORTINARI NECESS PU PAIS/25,0,Descontinuado,BOT
22543,85292,-,ESTJ MALBEC X AMOR/25,0,Descontinuado,BOT
22543,85293,-,ESTJ HER CODE AMOR/25,0,Descontinuado,BOT
22543,85294,-,ESTJ QUASAR CLASSIC AMOR/25,0,Descontinuado,BOT
22543,85295,-,ESTJ CELEBRE AGORA FEMININO AMOR/25,0,Descontinuado,BOT
22543,85296,-,ESTJ COFFEE WOMAN SEDUCTION AMOR/25,0,Descontinuado,BOT
22543,85297,-,ESTJ CELEBRE AGORA MASCULINO AMOR/25,0,Descontinuado,BOT
22543,85298,-,ESTJ LILY LEAU/LILY AMOR/25,0,Descontinuado,BOT
22543,85299,-,ESTJ COFFEE MAN DUO AMOR/25,0,Descontinuado,BOT
22543,85300,-,ESTJ EGEO DOLCE AMOR/25,0,Descontinuado,BOT
22543,85301,-,ESTJ FLORATTA RED AMOR/25,2,Descontinuado,BOT
22543,85302,-,ESTJ EGEO ORIGINAL AMOR/25,0,Descontinuado,BOT
22543,85413,-,EUD MASC CIL BOMB ALONG CHERRY VINH 10g,0,Descontinuado,EUD
22543,85491,-,ESTJ CBEM DELEITE CHOCOLATUDO AMOR/25,0,Descontinuado,BOT
22543,85493,-,ESTJ NSPA CEREJA ROUGE AMOR/25,0,Descontinuado,BOT
22543,85562,-,ESTJ MALBEC PREMIUM PAIS/25,0,Descontinuado,BOT
22543,85563,-,ESTJ THE BLEND PAIS/25,0,Descontinuado,BOT
22543,85566,-,ESTJ ZAAD PAIS/25,5,Descontinuado,BOT
22543,85567,-,ESTJ MALBEC BLACK PAIS/25,8,Descontinuado,BOT
22543,85568,-,ESTJ ARBO PAIS/25,24,Descontinuado,BOT
22543,85569,-,ESTJ UOMINI PAIS/25,15,Descontinuado,BOT
22543,85570,-,ESTJ BOTICOLL PORTINARI PAIS/25,13,Descontinuado,BOT
22543,85572,-,ESTJ MALBEC PAIS/25,63,Descontinuado,BOT
22543,85574,-,ESTJ CLASH PAIS/25,33,Descontinuado,BOT
22543,85575,-,ESTJ QUASAR VISION PAIS/25,23,Descontinuado,BOT
22543,85576,-,ESTJ BOTICOLL CONNEXION PAIS/25,5,Descontinuado,BOT
22543,85577,-,ESTJ EGEO BOMB BLACK PAIS/25,15,Descontinuado,BOT
22543,85578,-,ESTJ CELEBRE FOUG/AROM FORCA PAIS/25,2,Descontinuado,BOT
22543,85579,-,ESTJ MALBEC CUIDADOS PAIS/25,15,Descontinuado,BOT
22543,85696,-,EUD GLAM SOMB PRIMER PAETE SHINE HOL 7ml,0,Descontinuado,EUD
22543,85723,-,CJ SCH INSTANCE LOC D H CP ROS/ABS 3x7ml,0,Descontinuado,EUD
22543,85733,-,LILY LOC DES HID CPO LEAU LILY 200ml,0,Descontinuado,BOT
22543,85943,-,"MAKE B BAT SHE MULTIF BTY/NAT CHERR 3,6g",3,Descontinuado,BOT
22543,86019,-,ESTJ ARBO AMOR/25,3,Descontinuado,BOT
22543,86116,-,CBEM DES COL BDY SPLSH DOC DELIRIO 200ml,0,Descontinuado,BOT
22543,86293,-,"EUD K/M GLOS LABIAL CHERRY 5,5ml",0,Descontinuado,EUD
22543,86336,-,MALBEC SHW GEL CAB/CPO 200g,0,Descontinuado,BOT
22543,86339,-,"MAKE B BAT CREM U/BALLET LAC/BALLET 3,6g",2,Descontinuado,BOT
22543,86340,-,"MAKE B BAT BAL CREM U/B LACE RED 3,6g",1,Descontinuado,BOT
22543,86429,-,NEXT PASTA MODEL CAP PRM 30g,0,Descontinuado,BOT
22543,86639,-,COMBO SIAGE SHAMPOO HAIR PLASTIA,0,Descontinuado,EUD
22543,86724,-,CJ SCH SIAGE NUTRI AC/COMPL SH/C/M 3x7ml,7,Descontinuado,EUD
22543,86825,-,PMPCK MALBEC CLUB/DR JONES BARB S/IRRIT,0,Descontinuado,BOT
22543,86975,-,"QDB LIP OIL ROSA POD SER DURONAS 9,5ml",5,Descontinuado,QDB
22543,86982,-,EGEO DES COL MELANCIA 90ml,5,Descontinuado,BOT
22543,87070,-,CJ SCH CBEM FEIR CACH/UVA SH/CON/M 3x7ml,8,Descontinuado,BOT
22543,87107,-,INSTANCE LOC DES H CPO MORAN/IRRES 400ml,61,Descontinuado,EUD
