PDV,SKU,DESCRIÇÃO,MARCA,CURVA,ESTOQUE_ATUAL
17787,1004,FLORATTA DES COL MY BLUE 75ml,BOT,E,95
17787,1080,INTENSE GLOS LAB BUBBAL TUT/FRUT 5ml,BOT,E,5
17787,12084,ESTJ EGEO DOLCE NAM/22,BOT,E,0
17787,1296,PMPCK THE BLEND DES ANTIT AER 2x75g,BOT,B,2
17787,12961,EUD CR DES HID CPO INDUL 250g,EUD,E,0
17787,12965,EUD CR DES HID CPO RGE 250g V2,EUD,E,0
17787,12967,LA VICT CR ACET DES HID CPO 250g V2,EUD,E,0
17787,1302,PMPCK LILY DES ANTIT AER 2X75G,BOT,B,14
17787,1314,PMPCK ZAAD DES ANTIT AER 2X75G,BOT,C,3
17787,1317,PMPCK MALBEC DES ANTIT AER 2x75g,BOT,B,6
17787,1428,NSPA LOC ANTIOX DES HID CPO M/RUBY 400ml,BOT,C,15
17787,1630,NSPA DES COL BDY SPLSH M/RUBY 200ml,BOT,B,9
17787,1634,NSPA GEL ESF CPO MORANGO RUBY 175G,BOT,B,3
17787,1640,NSPA LOC ANTIOX DES HID CPO M/RUBY 200ml,BOT,C,6
17787,1650,REF NSPA LOC ANTIOX D H CPO M/RUBY 350ml,BOT,C,14
17787,1676,NSPA OL MULTIF AMEIXA 85ml,BOT,E,1
17787,1680,NSPA OL MULTIF AMEIXA NEGRA 85ml,BOT,E,3
17787,1697,NSPA OL MULTIF QUINOA 85ml,BOT,E,0
17787,1703,NSPA OL CPO JASMIM SAMBAC 85ml,BOT,E,4
17787,1786,MAKE B BAS LIQ MATE SALICYLIC 150 30g,BOT,C,2
17787,1787,MAKE B BAS LIQ MATE SALICYLIC 120 30g,BOT,C,8
17787,1788,MAKE B BAS LIQ MATE SALICYLIC 100 30g,BOT,E,5
17787,1789,MAKE B BAS LIQ MATE SALICYLIC 220 30g,BOT,B,1
17787,1790,MAKE B BAS LIQ MATE SALICYLIC 190 30g,BOT,C,4
17787,1806,MAKE B BAS LIQ MATE SALICYLIC 180 30g,BOT,C,0
17787,1808,MAKE B BAS LIQ MATE SALICYLIC 200 30g,BOT,C,5
17787,1861,MAKE B BAS LIQ MATE SALICYLIC 320 30g,BOT,E,4
17787,1862,MAKE B BAS LIQ MATE SALICYLIC 290 30g,BOT,C,1
17787,1863,MAKE B BAS LIQ MATE SALICYLIC 330 30g,BOT,E,5
17787,19685,ELYSEE EDP 50ml,BOT,E,0
17787,19734,THATY DES COL BOTICOLL 100ML,BOT,A,22
17787,19814,EUD CR DES HID CPO DLX 250g V4,EUD,E,0
17787,19815,SOUL MASC CILIO VOL BOMB 10g,EUD,E,0
17787,2094,"INTENSE BAT CREM POP BEGE AMEND 3,6g",BOT,C,0
17787,2100,"INTENSE BAT CREM POP ROSA 3,6g",BOT,C,4
17787,2150,"INTENSE BAT CREM POP MAGENTA 3,6g",BOT,B,0
17787,2186,"INTENSE BAT MATE POP BEGE CAST 4,0g",BOT,B,1
17787,2192,INTENSE BAT MAT INTENSE POP VERM 4g,BOT,C,0
17787,2215,INTENSE BAT MAT INTENSE POP ROS/TELH 4g,BOT,B,0
17787,22248,CECITA DES COL BOTICOLL 100ML,BOT,E,55
17787,22249,FREE DES COL BOTICOLL 100ml V4,BOT,A,88
17787,2239,INTENSE BAS LIQ MATE CAMUFL POP 100 20ml,BOT,C,1
17787,2240,INTENSE BAS LIQ MATE CAMUFL POP 120 20ml,BOT,E,6
17787,2252,INTENSE BAS LIQ MATE CAMUFL POP 140 20ml,BOT,E,7
17787,2256,INTENSE BAS LIQ MATE CAMUFL POP 160 20ml,BOT,C,7
17787,2257,INTENSE BAS LIQ MATE CAMUFL POP 190 20ml,BOT,C,0
17787,2258,INTENSE BAS LIQ MATE CAMUFL POP 210 20ml,BOT,C,1
17787,2259,INTENSE BAS LIQ MATE CAMUFL POP 230 20ml,BOT,E,1
17787,2260,INTENSE BAS LIQ MATE CAMUFL POP 240 20ml,BOT,C,0
17787,2274,INTENSE BAS LIQ MATE CAMUFL POP 260 20ml,BOT,E,3
17787,2276,INTENSE BAS LIQ MATE CAMUFL POP 300 20ml,BOT,E,8
17787,2285,INTENSE BAS LIQ MATE CAMUFL POP 320 20ml,BOT,E,8
17787,2286,INTENSE BAS LIQ MATE CAMUFL POP 330 20ml,BOT,E,5
17787,23743,DEM FLAC ELYSEE EDP 4ml VE,BOT,E,0
17787,2483,"INTENSE LAP P/OLHO POP PRETO 1,1g",BOT,C,5
17787,2501,MALBEC CAR PRES CLUB,BOT,E,0
17787,25458,FLORATTA DES COL BLUE 75ml,BOT,E,34
17787,25682,MAKE B NUTRIDETOX C NOTURNO SKIN 2x15g,BOT,E,1
17787,25730,MAKE B MOUSSE  LIMP TONIF 2/1 SKIN 150ml,BOT,E,2
17787,26401,MAKE B PRIMER OLH V2,BOT,E,2
17787,27707,BOTICOLL CONNEXION DES COL 100ml V2,BOT,A,13
17787,27856,MAKE B DELINEADOR LIQ P/OLHOS PRETO,BOT,E,4
17787,27858,MAKE B LAP RETR P/OLH PRET PCK,BOT,B,4
17787,27861,MAKE B LAP P/OLH GEL ULTRABLACK,BOT,E,5
17787,29046,BOTICOLL CONNEX DES BDY SPR 100ml V6 PCK,BOT,B,20
17787,29226,ELYSEE CREM HID DES CPO ACETINADO 250g,BOT,E,6
17787,29807,MAKE B SPR FIX MAQ ROSTO 75ml/40g,BOT,E,1
17787,30186,CARTAO PRESENTE INST 2021 UNITARIO,BOT,E,0
17787,30192,MALBEC DES COL X 100ml,BOT,E,42
17787,30201,MALBEC DES COL X 10ml PRM,BOT,E,4
17787,30226,MATCH MASC CAP SCIENCE CRESC 50ml PRM,BOT,E,1
17787,30247,EGEO DES COL PINA BLAST 90ml,BOT,C,19
17787,30302,SIAGE COND HIDRATACAO MICELAR V2 200ml,EUD,E,0
17787,30363,EGEO DES COL CHERRY BLAST 90ml,BOT,B,1
17787,33424,ESTJ FLORATTA FLOWERS SORT REG/22,BOT,B,5
17787,33427,LILY GELEIA DES HID CORPORAL GLOW 250g,BOT,B,5
17787,3505,CAIXA P INST 2021 ROSA ECONOMICA,BOT,E,7
17787,3517,CAIXA P INST 2021 VERDE ECONOMICA,BOT,E,134
17787,3529,CAIXA M INST 2021 ROSA ECONOMICA,BOT,E,116
17787,3530,CAIXA M INST 2021 VERDE ECONOMICA,BOT,E,132
17787,3542,CAIXA G INST 2021 ROSA ECONOMICA,BOT,E,14
17787,3554,CAIXA G INST 2021 VERDE ECONOMICA,BOT,E,299
17787,36226,ESTJ GLAMOUR SEC BL REG/22,BOT,C,0
17787,36485,ESTJ COFFEE W/SEDUC REG/22,BOT,E,0
17787,36486,ESTJ FLORATTA BLUE REG/22,BOT,E,1
17787,36487,REF MAKE B PO COMP FAC HYAL 40 8g,BOT,C,8
17787,36488,REF MAKE B PO COMP FAC HYAL 50 8g,BOT,E,1
17787,36637,REF MAKE B PO COMP FAC HYAL 60 8G,BOT,E,1
17787,36826,REF MAKE B PO COMP FAC HYAL 70 8g,BOT,E,0
17787,3700,KIT CAIXA M INST 2021 VERDE VD,BOT,E,2
17787,37159,REF MAKE B PO COMP FAC HYAL 80 8g,BOT,E,0
17787,37235,ACESSORIO NECESSAIRE LIMPEZA MAES 2012,BOT,E,5
17787,37262,INTENSE NECESSARIE POLIES S/ALCA 2013,BOT,E,1
17787,37693,REF MAKE B PO COMP FAC HYAL 10 8g,BOT,E,4
17787,37694,REF MAKE B PO COMP FAC HYAL 20 8G,BOT,C,3
17787,37695,REF MAKE B PO COMP FAC HYAL 25 8G,BOT,C,6
17787,37696,REF MAKE B PO COMP FAC HYAL 15 8G,BOT,C,0
17787,37699,REF MAKE B PO COMP FAC HYAL 30 8g,BOT,C,2
17787,37875,BOTICARIO APLICADOR DESCART LABIOS C/100,BOT,E,0
17787,37876,BOTICARIO APLICADOR DES DELINEADOR C/100,BOT,E,0
17787,37877,BOTICARIO APLICADOR DESCART SOMBRA C/100,BOT,E,0
17787,37878,BOTICARIO ESPATULA DESCARTAVEL C/100,BOT,E,0
17787,37879,BOTICARIO ESPONJA DESC MAQUIAGEM C/100,BOT,E,0
17787,37905,NSPA TOALHA DE BAMBU,BOT,E,2
17787,38554,NSPA NECESS PVC S/ALCA,BOT,E,4
17787,39235,CELEBRE DES BDY SPR FORCA 100ml,BOT,B,18
17787,39640,BOLSA MAO PVC S/ALCA NAT/14,BOT,E,6
17787,39683,CAIXA VERTICAL P MARROM LEVE BELEZ UNIT,BOT,E,2
17787,39687,CAIXA VERTICAL G MARROM LEVE BELEZA UNIT,BOT,E,4
17787,39827,TAPETE DE BANHO EM PVC SPULOKIS 14,BOT,E,9
17787,40030,INTENSE NECESS PVC CALIF S/ALCA 2015,BOT,E,2
17787,40032,INTENSE NECESS BOCA PU S/ALCA 2015,BOT,E,1
17787,40037,BOLSA ENVELOPE PU S/A MAKE B. UNIVER 15,BOT,E,1
17787,40049,BOT NECESS ALG CUSTMZ S/ALCA 2015,BOT,E,4
17787,40051,BOLSA MATERNIDADE POLIESTER C/A MAES/15,BOT,E,6
17787,40085,MAKE B PINCEL BASE PO FIBRAS DUPLAS,BOT,E,0
17787,40087,MAKE B PINCEL CORRETIVO FIBRAS DUPLAS,BOT,E,4
17787,40088,MAKE B PINCEL APLICAR SOMBRA,BOT,E,2
17787,40090,MAKE B PINCEL ESFUMAR SOMBRA,BOT,E,4
17787,40091,MAKE B PINCEL DELINEAR,BOT,E,2
17787,40093,MAKE B ESPNJ MAQ SILIESPONJA PU,BOT,E,2
17787,40121,ESTJ ZAAD REG/22,BOT,E,2
17787,40163,STYLETTO NECESS ESTJ NAT/12 VDA,BOT,E,2
17787,40220,ESTJ CBEM NUVEM REG/22,BOT,E,0
17787,40268,ESTJ NSPA AMEIXA REG/22,BOT,A,4
17787,40387,ESTJ MALBEC CLUB REG/22,BOT,B,1
17787,41143,BOT NECESS PVC BARBIE S/ALCA 16,BOT,E,2
17787,41449,INTENSE PORTA BATOM PINK EM PAPEL,BOT,E,4
17787,41450,INTENSE NECESSAIRE PINK EM PVC S/ALCA,BOT,E,3
17787,41544,N/SPA BANHEIRINHA TRANSP EM PS,BOT,E,8
17787,41623,MAKE B PINCEL BASE LIQUIDA,BOT,E,1
17787,41624,MAKE B PINCEL CONTORNO FACIAL,BOT,E,2
17787,41625,MAKE B PINCEL DUPLO OLHOS CHANFRADO,BOT,E,4
17787,41992,MAKE B NECESS TASSEL PVC S/ALCA,BOT,E,1
17787,42072,N/SPA NECESSAIRE ONDAS EM ALGODAO S/A,BOT,E,7
17787,42111,CAPINHA MORANGUINHO EM SILICONE,BOT,E,1
17787,42112,CAPINHA ABELINHA EM SILICONE,BOT,E,1
17787,42113,CAPINHA NUVEM EM SILICONE,BOT,C,1
17787,42223,CAPINHA ROSA E ALGODAO EM SILICONE,BOT,E,2
17787,42233,NECESSAIRE THEO EM PVC S/A SPULOKIS 2016,BOT,E,2
17787,42405,CAIXA RIGIDA CUBO PAIS 2016 UN,BOT,E,2
17787,42512,MAKE B PORTA PINCEIS METALIZADO PU,BOT,E,1
17787,42993,DR BOTICA MOCHI POLIEST C/ALC,BOT,E,3
17787,43149,SAQUINHO COMBO C/ADES PAIS 2017,BOT,E,140
17787,43290,CAIXA RIGIDA INST M,BOT,E,1
17787,43302,ENVELOPE NATAL 2017 M COM VISOR,BOT,E,2
17787,43350,BOTI NECESS HOLOG DREAM PVC S/ALC,BOT,E,1
17787,43352,INTENSE TOALHA DEMAQ BYE MAKE POLIEST,BOT,E,1
17787,43358,DR BOTICA NECESS PVC S/ALC,BOT,E,1
17787,43370,CAIXA HORIZ NATAL 2017 PP UNIT,BOT,E,43
17787,43561,INTENSE CAPINHA BOCA P/ BATOM SILICONE,BOT,E,3
17787,43566,MAKE B PINC ESCOVA BASE,BOT,E,4
17787,43568,MAKE B MALET MAQ HOLOG ABS C/ALC,BOT,E,1
17787,43785,CBEM CAPINHA DELEITE SILICONE,BOT,E,2
17787,43849,MAKE B PINC PIGM ROSE GOLD,BOT,E,1
17787,43917,CBEM NECESS DELEITE POLIESTER S/ALC,BOT,E,1
17787,43932,MATCH ESCV P/MODELAR E ALISAR ABS,BOT,E,1
17787,43934,MATCH ESCV P/MODELAR 3D ABS,BOT,E,1
17787,43935,CBEM SAQUIN MANI E PEDI NYLON S/ALC,BOT,E,5
17787,43939,MATCH ESCV PARA DESEMBARACAR ABS,BOT,E,3
17787,43945,MAKE B ESPNJ KONJAC,BOT,E,1
17787,43951,SOPHIE ESCV DESEMBARACO ABS,BOT,E,1
17787,43955,MATCH PENTE P/VOL PA,BOT,E,1
17787,43960,MATCH ESCV P/ACAB ABS,BOT,E,1
17787,44162,CAIXA INST G LACO VERDE,BOT,E,5
17787,44164,CARTUCHO INST S/VISOR LACO VERDE,BOT,E,11
17787,44410,MAKE B PINC LEQUE,BOT,E,3
17787,44411,MAKE B PINC CONTORNO ANGULAR,BOT,E,3
17787,44413,MAKE B PINC DUPLO ILUMINADOR,BOT,E,2
17787,4443,BOTIK ACQ GEL HID ANTIOL AC MAND/SAL 50g,BOT,E,2
17787,44580,MAKE B PINC ESPIRAL P/PELE,BOT,E,1
17787,44581,MAKE B PINCEL P/MARCAR CONCAVO,BOT,E,2
17787,4473,BOTIK GEL LIMP FAC MCLR AC MAND/SAL 150g,BOT,E,15
17787,44742,FITA DE VEDACAO VOID DEVOLUCAO,BOT,E,0
17787,44764,SOPHIE CJ PINC C/2 UN,BOT,E,2
17787,44798,BOTI FONE OUV ROSA ABS,BOT,E,6
17787,44799,BOTI FONE OUV AZUL ABS,BOT,E,9
17787,4480,BOTIK ACQ GEL HID FAC ANTIS AC/POLIG 50g,BOT,E,4
17787,44803,CBEM CESTINHO METAL C/A,BOT,C,2
17787,4481,BOTIK CREM HID FAC FIRM AC/POLIGL 50g,BOT,C,2
17787,4482,BOTIK LOC HID ANTIOL ACI POL FAC 110ml,BOT,C,22
17787,44851,MAKE B ESTJ P/SOBRANCELHAS,BOT,E,1
17787,44864,INTENSE NECESS PRATICA PES S/A,BOT,E,3
17787,44865,BOTI BANHEIRINHA TRANSP PS,BOT,E,3
17787,44967,BOTI BABY SABONETEIRA PP,BOT,E,1
17787,45025,BOTI BABY FRASQ TROCADOR CINZA PES C/A,BOT,E,2
17787,45036,BOTI BANDEJA PARA BANCADA ACO INOX,BOT,E,1
17787,4510,REF BOTIK CR FAC FIRM AC/HIALUR 40g,BOT,E,5
17787,4520,BOTIK GEL CR FAC FIRM AC/HIALUR 40g,BOT,B,9
17787,4522,REF BOTIK GEL CR FAC FIRM AC/HIAL 40g V2,BOT,C,3
17787,4539,BOTIK CR FAC FIRMADOR AC/HIAL 40G V2,BOT,E,4
17787,45479,CAIXA HORIZ M PAIS 2019,BOT,E,1
17787,45544,NSPA ESPNJ VERDE KONJAC,BOT,E,1
17787,45553,INTENSE TOALHA DEMAQ ROXA PES,BOT,E,1
17787,45557,BOTI APONTADOR CHUMBO,BOT,E,5
17787,45568,BOTI BABY CAPINHA FIDO AMARELA SILICONE,BOT,E,8
17787,45580,SOPHIE FRASQ TRANSP GLITTER EVA C/A,BOT,E,12
17787,45593,BOTI APARELHO LIMP FACIAL,BOT,E,4
17787,45599,BOTI SACO ORGANIZADOR ALGODAO,BOT,E,1
17787,45627,INTENSE CJ PINC MINI FAC C/4,BOT,E,2
17787,45629,INTENSE KIT ESPNJ C/2 UND,BOT,E,0
17787,46006,CONJ ME MALBEC NAT/19,BOT,E,0
17787,46014,BOTI CAPINHA CREM MAOS PES C/A,BOT,E,1
17787,46047,BOTI NECESS QUADR REC PRM PTA EVA C/A,BOT,E,4
17787,46054,CAIXA PAPELAO TAMPA LIGADA DEVOLUCAO PCK,BOT,E,0
17787,46442,O BOTI FRASQ OFF WHITE VDA,BOT,E,0
17787,46467,CBEM NECESS BRCA BOA NOITE S/A PES,BOT,E,1
17787,46554,BOTI ECOBAG LONITA SUSTENTAVEL/NYLON,BOT,E,2
17787,46555,BOTI DIFUSOR ELETRONICO ABS,BOT,E,2
17787,46568,SOPHIE BOLSA NYLON,BOT,E,0
17787,46580,CAIXA P NATAL 2020,BOT,E,41
17787,46643,ELYSEE NECESS PAETE PES NAT/21 VDA,BOT,E,9
17787,46645,ZAAD NECESS PES NAT/21 VDA,BOT,E,12
17787,46752,CAIXA M INST 2021 LACO VERDE UNIT,BOT,E,0
17787,46757,BOTI BOLSA ECOBAG BRCA G PES C/A,BOT,E,4
17787,46758,CELEBRE BOLSA FEM PRATA PU C/ALC,BOT,E,3
17787,46893,MATCH NECESSAIRE C/VISOR PES,BOT,E,2
17787,46894,MALBEC NECESSARIES TRIANGULAR PU PRETA,BOT,C,3
17787,46898,ZAAD EDP EXPEDITION 95ml,BOT,B,20
17787,46931,ESTJ BOTICOLL SORTIDO REG/22,BOT,B,2
17787,47144,CBEM DES ANTIT AER PROTECT/BTY 90g/150ml,BOT,C,21
17787,47145,CBEM DES ANTIT ROLL PROTECT/BEAUTY 55ml,BOT,C,3
17787,47146,CBEM DES ANTIT AER INV PROTECT 90g/150ml,BOT,C,15
17787,47147,CBEM DES ROLL INV PROTECT 55ml,BOT,C,5
17787,47148,CBEM DES ANT AER CLIN ULT/PROT 90g/150ml,BOT,E,9
17787,47149,MEN DES ANT AER CLIN ULTR/PROT 90G/150ML,BOT,C,0
17787,47150,MEN DES ANTIT AER COOL PROTECT 90g/150ml,BOT,C,3
17787,47151,CBEM DES ANTIT AER S/ALUM 90g/150ml,BOT,C,2
17787,47152,MEN DES ANTIT AER INV PROTECT 90g/150ml,BOT,C,7
17787,47154,CBEM DES ROLL S/ALUM 55ml,BOT,C,5
17787,47165,CBEM DES ANTIT CR CLIN ULTRA PROTECT 50g,BOT,B,1
17787,47173,EGEO CARTCH PRES BLUE,BOT,E,5
17787,47174,EGEO CARTCH PRES CHOC,BOT,E,2
17787,47235,BOTI SUN PROT SOL CPO FPS 30 200g,BOT,E,1
17787,47299,NSPA COND SOLIDO 75G,BOT,E,3
17787,47300,NSPA SHAMP SLD AMEI 90g,BOT,E,2
17787,47303,ZAAD EDP EXPEDITION 10ml PRM,BOT,E,0
17787,47321,BOTIK SRUM ALT/POT ACID MAND/TRANEX 30ML,BOT,C,11
17787,47339,LIZ DES COL SUBLIME 100ml,BOT,A,18
17787,47341,CJ FLAC LIZ DES COL SUBLIME 5x1ml,BOT,E,0
17787,47411,ARBO NECESS LONA,BOT,C,1
17787,47412,INTENSE NECESSAIRE PU S/ALC,BOT,E,0
17787,47550,BOTIK GEL CR UNIFOR OLH AC MAND/TRAN 15g,BOT,E,7
17787,47552,BOTICA 214 EDP FOUG AROM VER/FIRENZ 90ml,BOT,E,7
17787,47553,BOTICA 214 EDP FLOR FRUT VER/FIRENZ 75ml,BOT,C,13
17787,47593,MAKE B NECESS POMPOM PU,BOT,C,4
17787,47594,BOTI SUN PROT CPO FPS 50 200G,BOT,E,0
17787,47596,BOTI SUN GEL POS SOL ACQUA GEL 120G,BOT,E,2
17787,47597,INSTANCE DES ANTIT AER FR/VERM 150ml,EUD,E,0
17787,47598,BOTI SUN PR FAC ANTIOL ACQ FL FPS30 40ml,BOT,C,1
17787,47599,BOTI SUN PROT FAC ANTIOL A/FL FPS70 40ml,BOT,C,0
17787,47600,BOTI SUN PR FAC ANTIS ACQ FLD FPS30 40ml,BOT,C,4
17787,47601,INSTANCE DES ANTIT ROLL FR/VERM 55ml,EUD,E,0
17787,47602,BOTI SUN PR FAC ANTIS ACQ FLD FPS70 40ml,BOT,C,6
17787,47617,BOTI NECESS CORACAO EVA,BOT,E,3
17787,47624,MATCH SHAMP PROT DA COR 250ml,BOT,C,7
17787,47629,BOTICA 214 EDP GOLD/GARD 75ml V2,BOT,A,2
17787,47630,BOTICA 214 EDP DARK MINT 90ml V2,BOT,E,1
17787,47635,BOTICA 214 CR AC DES HID CPO V/FIR 200g,BOT,E,0
17787,47637,MATCH SHAMP MATIZ PROT/LOIROS 250ml,BOT,C,10
17787,47638,MATCH COND PROT DA COR 250ml,BOT,E,6
17787,47639,MATCH COND PROT/LOIROS 250ml,BOT,C,13
17787,47640,MATCH MASC CAP PROT/COR 250G,BOT,C,5
17787,47729,BOTIK MASSAG LIMP FAC QUARTZO,BOT,E,12
17787,47754,DEM BOTICA 214 EDP GOLD/GARD 4ml V2,BOT,E,0
17787,47755,DEM BOTICA 214 EDP DARK MINT 4ml V2,BOT,E,0
17787,47777,BOTI BABY SAB LIQ CAB/PES NAN/NEN 200ml,BOT,E,3
17787,47779,BOTI BABY LOC HID CPO NAN/NEN 150ml,BOT,C,17
17787,47803,CBEM AROMAT DE AMB NETFLIX 60ml,BOT,C,0
17787,47814,INSTANCE DES ROLL ON CHA VDE/ROMA 55ml,EUD,E,0
17787,47815,INSTANCE DES ANTIT AER CHA VDE/ROM 150ml,EUD,E,0
17787,47816,INSTANCE DES ANTIT CREM CHA VDE/ROMA 80g,EUD,E,0
17787,47817,INSTANCE DES ANTIT CREM S/PERF 80g,EUD,E,0
17787,47818,INSTANCE DES ANTIT AER S/PERF 150ml,EUD,E,0
17787,47842,EUD DES ANTIT AER 90g/150ml V2,EUD,E,0
17787,47843,IMPRESSION DES ANTIT AER 90g/150ml V2,EUD,E,0
17787,47851,ARBO DES COL FOREST 100ml,BOT,C,15
17787,47881,REF ARBO DES COL FOREST 100ml,BOT,B,1
17787,47905,BOTICOLL ACQUA FRESCA DES COL 100ml V2,BOT,B,9
17787,47908,DREAM DES COL SPLSH VIAG/ENC 200ml V2,BOT,E,0
17787,47913,MATCH COND RESP/CACH 250ml V2,BOT,E,1
17787,47916,MATCH CR MODEL ONDUL RESP/CACH 290ml V2,BOT,E,3
17787,47920,MATCH MASC CAP RESP/CACH 250g V3,BOT,E,3
17787,47949,THE BLEND EDP 100ml V2,BOT,A,5
17787,47950,ZAAD EDP 95ml V6,BOT,A,11
17787,47951,ZAAD EDP MONDO 95ML V3,BOT,E,3
17787,47960,BOTI SUN PROT CPO SPR ACQ/FL FPS50 180ml,BOT,E,5
17787,47962,BOTI SUN PROT SOL FAC ULT FLD FPS70 40ml,BOT,B,6
17787,47963,BOTI SUN PROT SOL CPO GEL CR FPS50 200g,BOT,E,3
17787,47968,MATCH LEAVE IN 150ml,BOT,C,6
17787,47969,INTENSE SAB LIQ DEMAQ 85ml V2,BOT,E,3
17787,47973,INTENSE ILUM LIQ MULTIF DOURADO 8ML V3,BOT,E,2
17787,47974,CBEM SAB LIQ INT NUVEM 200ml,BOT,E,3
17787,48015,MAKE B PRIMER FAC HYAL 16ml,BOT,C,1
17787,48020,NSPA OLEO ACUC ESF CPO AMEI 200g V3,BOT,E,1
17787,48058,LILY CR HID DES ACET CPO LOVE 250G V3,BOT,C,5
17787,48059,REF LILY CR H DES ACET CPO LOVE 250g V2,BOT,B,2
17787,48060,LILY CREM DES HID ACET CPO 250g V8,BOT,A,13
17787,48062,REF LILY CR ACET DES HID CPO 250g V2,BOT,A,18
17787,48100,CBEM COND FEIRA BANANA 170ml,BOT,E,3
17787,48130,MALBEC DES COL 100ml V5,BOT,E,0
17787,48133,MALBEC DES COL VERT 100ml V2,BOT,B,3
17787,48136,FLORATTA DES COL F/SECRET 75ml V2,BOT,E,26
17787,48139,COFFEE DES COL WOMAN SEDUC 100ml V5,BOT,E,11
17787,48141,ACCORDES DES COL 80ml V5,BOT,A,14
17787,48142,FLORATTA DES COL CER/FLOR 75ml V4,BOT,A,3
17787,48143,ELYSEE EDP BLANC 50ml V2,BOT,B,11
17787,48144,INSENSATEZ DES COL 100ml V3,BOT,E,35
17787,48145,BOTICOLL ANNI DES COL 100ml V2,BOT,A,22
17787,48146,ELYSEE EDP NUIT 50ml V2,BOT,B,3
17787,48151,MATCH AMP CAP SCIENCE RECONS 15ML,BOT,E,5
17787,48181,LILY OL PERF DES CPO 150ml V11,BOT,B,9
17787,48200,MALBEC CR P/BARB SENSIT CLUB 100G,BOT,E,0
17787,48253,REF NSPA LOC DES HID CPO F/AMEI 400ml V2,BOT,E,2
17787,48255,NSPA LOC DES HID CPO F/AMEI 200ml V5,BOT,E,4
17787,48258,REF NSPA LOC DES HID CPO CVR 400ml V2,BOT,E,16
17787,48269,INTENSE BASE LIQ SUPFIX 60 25ml V3,BOT,E,2
17787,48270,INTENSE BASE LIQ SUPFIX 75 25ml V3,BOT,E,2
17787,48271,INTENSE BASE LIQ SUPFIX 20 25ml V3,BOT,C,0
17787,48272,INTENSE BASE LIQ SUPFIX 30 25ml V3,BOT,E,3
17787,48275,INTENSE BASE LIQ SUPFIX 50 25ML V3,BOT,E,2
17787,48276,INTENSE BASE LIQ SUPFIX 80 25ml V3,BOT,E,2
17787,48277,INTENSE BASE LIQ SUPFIX 15 25ml V3,BOT,E,3
17787,48278,INTENSE BASE LIQ SUPFIX 25 25ml V3,BOT,E,3
17787,48280,NSPA DES COL BDY SPLSH AMEI/NEG 200ml V2,BOT,B,19
17787,48281,NSPA LOC DES HID CPO AMEI/NEG 400ml V3,BOT,A,57
17787,48282,NSPA LOC DES HID CPO AMEI 400ml V6,BOT,A,34
17787,48283,NSPA SAB LIQ CPO AMEI/NEG 200ML V2,BOT,E,21
17787,48285,NSPA SAB LIQ CPO AMEI 200ml V3,BOT,C,14
17787,48286,NSPA SAB LIQ MAO AMEI 400ml V2,BOT,E,0
17787,48287,NSPA CR ANTIS MAO FPS 15 QUINOA 75g V2,BOT,C,0
17787,48288,NSPA SHAMP AMEI 300ml V2,BOT,C,6
17787,48290,NSPA DES COL BDY SPLSH AMEI 200ml V2,BOT,B,4
17787,48292,NSPA CR HID MAO F/AMEI 75G V2,BOT,E,7
17787,48296,FLORATTA DES COL ROSE BOUQUET 75ml,BOT,E,85
17787,48298,FLORATTA DES COL ROSE BOUQUET PRM 10ml,BOT,E,35
17787,48303,FLORATTA DES COL RED V2 75ml,BOT,A,29
17787,48307,FLORATTA DES COL F/SECRET V3 75ml,BOT,A,26
17787,48310,FLORATTA DES COL BLUE V2 75ml,BOT,A,734
17787,48313,FLORATTA DES COL ROSE V4 75ml,BOT,A,3
17787,48315,FLORATTA DES COL GOLD V3 75ml,BOT,A,28
17787,48344,DEM DREAM DES COL SPLSH VIAG/ENC 4ml V2,BOT,E,0
17787,48345,DEM FLORATTA DES COL L AMORE 4ml V2,BOT,E,0
17787,48347,DEM ELYSEE EDP BLANC 4ml V2,BOT,E,0
17787,48349,DEM INSENSATEZ DES COL 4ml V2,BOT,E,0
17787,48351,DEM FLORATTA DES COL F/SECRET 4ml V2,BOT,E,0
17787,48352,BOTICOLL ACQUA FRESCA DES COL 200ml V2,BOT,A,32
17787,48354,DEM THE BLEND EDP 4ml V2,BOT,E,0
17787,48355,DEM QUASAR DES COL EVLT 4ml V3,BOT,E,0
17787,48357,DEM QUASAR DES COL 4ml V2,BOT,E,0
17787,48359,ZAAD EDP 50ml V2,BOT,B,8
17787,48361,BOTICOLL ANNI DES COL 200ml V2,BOT,B,21
17787,48362,MALBEC DES COL 50ml V4,BOT,E,0
17787,48364,DEM MALBEC DES COL VERT 4ml V2,BOT,E,0
17787,48365,COFFEE DES COL MAN SEDUC 100ml V4,BOT,B,17
17787,48367,ZAAD DES ANTIT AER MONDO 75g V3,BOT,E,23
17787,48368,ZAAD ESPUM P/ BARB 200ML V4,BOT,C,0
17787,48369,QUASAR DES BODY SPR 100ml V9,BOT,E,2
17787,48371,QUASAR SHW GEL CAB/CPO 200g V2,BOT,E,1
17787,48375,ELYSEE CR DES HID ACET CPO BLANC 250g V2,BOT,B,9
17787,48381,MALBEC DES ANTIT ROLL 55ml V9,BOT,B,33
17787,48485,NSPA CACHEPO VERMELHO PU/PES,BOT,E,1
17787,48491,MALBEC SHW GEL CAB/CPO BLEU 200g,BOT,E,2
17787,48508,LILY OL PRODIG ACET MULTIF 50ml,BOT,C,12
17787,48510,LILY CR HID MAO 50g,BOT,B,6
17787,48511,LILY SHAMP ACET 250ml,BOT,C,4
17787,48513,LILY SAB LIQ CPO 250ML,BOT,B,0
17787,48514,LILY COND ACET 250ml,BOT,E,7
17787,48516,DEM LILY EDP ABSOLU 4ml VDA,BOT,E,0
17787,48521,DEM LIZ DES COL 4ml VDA,BOT,E,0
17787,48528,DEM BOTICA 214 EDP DARK MINT 4ml VDA,BOT,E,46
17787,48535,DEM LILY EDP 4ml VDA,BOT,E,0
17787,48536,DEM MALBEC DES COL BLEU 4ml VDA,BOT,E,0
17787,48537,DEM MALBEC DES COL MAGNETIC 4ml VDA,BOT,E,0
17787,48545,CBEM LOC DES HID CPO NUVEM 200ml V2,BOT,E,0
17787,48546,CBEM DES ROLL ON NUVEM 55ml V2,BOT,E,15
17787,48555,OUI SAB BARR CPO JARDIN DE GRASSE 90G,BOT,E,0
17787,48558,O BOTI CARTCH COMB/1 NAT/21,BOT,E,9
17787,48559,O BOTI CARTCH COMB/2 NAT/21,BOT,E,1
17787,48560,FLORATTA DES BDY SPR MY BLUE 100ml,BOT,E,6
17787,48562,NSPA CR HID MAO AMEI/NEG 75g V2,BOT,C,7
17787,48573,EGEO DES COL DOLCE COLORS 90ML V2,BOT,E,6
17787,48614,CBEM CREM HID MAO DELEITE 50g V2,BOT,E,1
17787,48619,REF CBEM LOC HID DES CPO NUVEM 400ml V2,BOT,E,3
17787,48621,FLORATTA EDP FLEUR D ECLIPSE 75ml,BOT,E,2
17787,48622,FLORATTA EDP FLEUR D ECLIPSE 10ml PRM,BOT,E,1
17787,48625,FLORATTA LOC DES HID CPO FL/D ECLIP 200g,BOT,E,2
17787,48628,CBEM LOC DES HID CPO NUVEM 400ml V2,BOT,E,0
17787,48632,DREAM DES COL SPLSH AMOR NO AR 350ml V2,BOT,E,0
17787,48634,DREAM DES COL SPLSH AMOR NO AR 200ml V2,BOT,E,0
17787,48635,FLORATTA DES COL ROSE 75ml V3,BOT,E,3
17787,48636,DEM FLORATTA DES COL ROSE 4ml V2,BOT,E,0
17787,48645,ELYSEE CR HID DES CPO NUIT 250g V2,BOT,C,5
17787,48646,FLORATTA CR DES HID CPO ROSE 200ml V5,BOT,C,15
17787,48653,ELYSEE DES ANTIT AEROSSOL 75g V3,BOT,B,3
17787,48654,FLORATTA DES ANTIT AER BLUE 75g V10,BOT,E,1
17787,48657,EGEO DES ANTIT AEROSSOL DOLCE 75g V9,BOT,C,4
17787,48663,BOTICOLL ANNI DES COL SWEETY 100ml V2,BOT,E,6
17787,48664,BOTICOLL PORTINARI DES COL 100ml V5,BOT,A,13
17787,48669,BOTICOLL CECITA DES COL BLOSSOM 100ml V2,BOT,E,9
17787,48672,NSPA LOC DES HID CPO AMEI/NEG 200ml V4,BOT,B,36
17787,48673,NSPA LOC DES HID CPO AMEI 200ml V5,BOT,B,21
17787,48675,REF NSPA LOC DES H CPO AMEI/NEG 400ml V2,BOT,E,2
17787,48676,REF NSPA LOC DES HID CPO AMEI 400ml V2,BOT,E,10
17787,48679,NSPA LOC DES HID CPO AMEI 400ml V6 PRM,BOT,E,30
17787,48680,REF NSPA LOC FIRM D H CPO QUIN 400ml V2,BOT,B,0
17787,48683,MALBEC LOC DES HID CPO VERT 200ml V2,BOT,C,0
17787,48685,COFFEE LOC HID DES CPO W/SEDUC 200ml V2,BOT,B,10
17787,48687,MEN PROT FAC FPS 30 48ml V4,BOT,E,1
17787,48696,LILY DES ANTIT AEROSSOL 75g V9,BOT,B,4
17787,48700,EGEO DES COL HIT 90ml V2,BOT,E,17
17787,48701,EGEO DES COL BEAT 90ml V2,BOT,E,6
17787,48731,REF CBEM LOC HID DES CPO R/ALG 400ml V2,BOT,E,5
17787,48734,LILY PARFUM LE 30ML,BOT,E,3
17787,48735,REF MALBEC CLUB CARG GILLETE MACH 3 C/2,BOT,E,2
17787,48736,CBEM CR HID MAO NUVEM 50g V3,BOT,E,0
17787,48742,CBEM DES ANT AER R/ALG 75g/125ml V2,BOT,E,6
17787,48743,DR BOTICA SHAMP POC ESPUMA 200ml V2,BOT,E,0
17787,48744,DR BOTICA COND POC BRILHO 200ml V2,BOT,E,11
17787,48745,DR BOTICA CREM PENT POC TIRA NO150g V2,BOT,B,9
17787,48761,EGEO DES ANTIT AER RED 75g V3,BOT,C,3
17787,48768,NSPA CR HID MAO AMEI 75g V5,BOT,C,3
17787,48770,NSPA COND AMEI 300ml V2,BOT,C,5
17787,48771,NSPA LOC HID CPO QUINOA 200ml V2,BOT,C,4
17787,48774,NSPA DES ANTIT AEROSOL AMEI 75g V2,BOT,B,2
17787,48776,QUASAR GEL POS BARBA 110g V7,BOT,E,0
17787,48777,THE BLEND SHW GEL 2/1 CAB/CPO 250g V2,BOT,C,4
17787,48779,BOTICOLL PORTINARI DES BDY SPR 100ml V7,BOT,B,5
17787,48780,COFFEE DES ANTIT AER WOMAN SEDUC 75g V4,BOT,E,7
17787,48784,ZAAD DES ANTIT AER 75g V7,BOT,B,3
17787,48785,MALBEC DES BDY SPR 100ml V4 PCK,BOT,A,4
17787,48787,MALBEC DES COL SPRT 100ml V3,BOT,E,5
17787,48788,REF BOTICOLL PORTINARI DES B/SP 100ml V6,BOT,B,0
17787,48789,THE BLEND DES ANTIT AER 75g/125ml V3,BOT,B,0
17787,48790,REFIL MALBEC DES BDY SPR REG 100ml PK V5,BOT,B,6
17787,48962,CBEM SHAMP LISO PERF 250ml V3,BOT,E,5
17787,48963,CBEM COND LISO PERF 250ml V3,BOT,C,0
17787,48965,CBEM SHAMP CACH FIRM/FORT 250ml V3,BOT,E,4
17787,48972,INTENSE BAS LIQ CORRET REB HD C35 24g V2,BOT,E,5
17787,48973,INTENSE BAS LIQ CORRET REB HD C50 24g V2,BOT,E,4
17787,48974,INTENSE BAS LIQ CORRET REB HD C60 24g V2,BOT,E,0
17787,48975,INTENSE BAS LIQ CORRET REB HD C15 24g V2,BOT,C,6
17787,48976,INTENSE BAS LIQ CORRET REB HD C3 24g V2,BOT,E,4
17787,48977,INTENSE BAS LIQ CORRET REB HD C37 24g V2,BOT,E,3
17787,48978,INTENSE BAS LIQ CORRET REB HD C75 24g V2,BOT,E,0
17787,48979,INTENSE BAS LIQ CORRET REB HD C80 24g V2,BOT,E,0
17787,48980,INTENSE BAS LIQ CORRET REB HD C10 24g V2,BOT,E,3
17787,48981,INTENSE BAS LIQ CORRET REB HD C20 24g V2,BOT,C,0
17787,48982,INTENSE BAS LIQ CORRET REB HD C30 24g V2,BOT,E,7
17787,48983,INTENSE BAS LIQ CORRET REB HD C53 24g V2,BOT,E,5
17787,48984,INTENSE BAS LIQ CORRET REB HD C25 24g V2,BOT,E,6
17787,48985,INTENSE BAS LIQ CORRET REB HD C40 24g V2,BOT,C,1
17787,48986,INTENSE BAS LIQ CORRET REB HD C77 24g V2,BOT,E,2
17787,48987,INTENSE BAS LIQ CORRET REB HD C85 24g V2,BOT,E,1
17787,48988,INTENSE BAS LIQ CORRET REB HD C13 24g V2,BOT,E,5
17787,48994,NSPA MASC CAP QUINOA 200g V3,BOT,C,5
17787,48997,NSPA OL DES HID CPO AMEI 200ml V3,BOT,B,9
17787,48998,NSPA OL DES HID CPO F/AMEI 200ml V3,BOT,E,17
17787,48999,NSPA OL DES HID CPO AMEI/NEG 200ml V3,BOT,B,1
17787,49006,CBEM SAB LIQ MAO ANTBAC NUVEM 400ml V2,BOT,E,4
17787,49012,FLORATTA CR DES HID CPO F/SECR 200ml V3,BOT,E,2
17787,49014,ACCORDES CREM DES HID CPO 200ml V2,BOT,E,5
17787,49016,ACCORDES DES BDY SPR 100ml V6,BOT,B,7
17787,49022,EGEO DES ANTIT AER CHOC 75G V3,BOT,E,2
17787,49023,DREAM LOC DES HID CPO CEU/BAUN 200ml V2,BOT,C,0
17787,49025,FLORATTA DES BDY SPR ROSE 100ml V8,BOT,B,0
17787,49026,REF ACCORDES DES BDY SPR 100ml V5,BOT,E,1
17787,49031,MALBEC DES COL CLUB 100ml V3,BOT,E,1
17787,49038,ZAAD BALM POS BARB 110g V4,BOT,E,0
17787,49039,ZAAD DES COL BDY SPLSH 200ml,BOT,B,7
17787,49048,CBEM CREM HID P/MAOS NUVEM V4 45g,BOT,B,9
17787,49049,CBEM CREM HID P/MAOS BEIJINHO V2 45g,BOT,E,5
17787,49051,CBEM CR HID MAO R/ALG 50g V4,BOT,E,0
17787,49053,REF CBEM CREM HID MAOS NUVEM 40g,BOT,E,3
17787,49054,REF CBEM CREM HID MAOS BEIJINHO 40g,BOT,E,1
17787,49055,REF CBEM CREM HID MAOS DELEITE 40g,BOT,E,2
17787,49056,REF CBEM CREM HID MAOS ROSA/ALGODAO 40g,BOT,E,1
17787,49089,MATCH SHAMP NUTR REGENERADORA 300ml,BOT,E,15
17787,49090,MATCH COND NUTR REGENERADORA 280ml,BOT,E,1
17787,49091,MATCH MASC CAP NUTR REGENERADORA 250g,BOT,B,5
17787,49092,MATCH OL BIF NUTR REGENERADORA 90ml,BOT,E,3
17787,49093,MATCH AMP CAP PREENCHEDORA 9ml,BOT,E,26
17787,49102,MATCH MASC CAP NUTR REGEN PRM 50ml,BOT,E,165
17787,49121,BOTI CARTCH COMB PERF NAM/22,BOT,E,4
17787,49139,MATCH LEAVE IN HIDRATACAO ANTIF 150ml,BOT,C,3
17787,49144,MATCH LEAVE IN LISO PROLONGADO 150ml,BOT,E,1
