PDV,SKU,DESCRIÇÃO,MARCA,CURVA,ESTOQUE_ATUAL
17787,49150,MATCH SPR CAP MULTIBENEFICIOS V2 150ml,BOT,C,4
17787,49154,COFFEE DES COL UNIQ WOM FL/GOURM 100ml,BOT,E,16
17787,49163,BOTI CARTUCHO PAIS/22,BOT,E,0
17787,49188,DEM BOTICA 214 EDP PEON/APRCT 4ml V2,BOT,E,0
17787,49193,COFFEE DES COL UNIQ MAN FOUG/OR 100ml,BOT,E,19
17787,49196,BOTI CARTCH COMB LGBT NAM/22,BOT,E,0
17787,49217,NSPA SAB LIQ CPO MORANGO RUBY 200ml,BOT,B,15
17787,49218,MAKE B ESTJ PO COMP HYALURONIC,BOT,C,0
17787,49225,COFFEE D/COL UNIQ WOM FL/GOURM PRM 10ml,BOT,E,2
17787,49228,COFFEE DES COL MAN FOUG/ORIENT PRM 10ml,BOT,E,27
17787,49242,COFFEE DES ANTIT AER WOM/SEDUC V5 75g,BOT,C,7
17787,49244,COFFEE D/COL MAN ORIENT/AMB V4 100ml,BOT,B,5
17787,49252,COFFEE D/C SEDUC/WOM/FLORIEN/FR V6 100ml,BOT,A,11
17787,49258,FLORATTA SHOWER GEL CPO BLUE 75g,BOT,E,1
17787,49259,MALBEC DES ANTIT AEROSOL 31g,BOT,E,20
17787,49263,ESTJ SOPHIE MINI V2,BOT,E,0
17787,49264,SOPHIE COND 200ml V2,BOT,C,11
17787,49265,SOPHIE SHAMP 200ml V2,BOT,C,6
17787,49286,ZAAD BALM POS BARBA 40G V3,BOT,C,0
17787,49288,ESTJ ARBO REG/22,BOT,A,71
17787,49291,ESTJ MALBEC REG/22,BOT,C,5
17787,49316,CAIXA LACO M NATAL/21 VERMELHA,BOT,E,0
17787,49317,CAIXA ECON M NATAL/21 VERMELHA,BOT,E,0
17787,49353,BOTICA 214 EDP PEON/APRCT 75ml V2,BOT,B,1
17787,49362,MALBEC DES ANTIT AER 75g/125ml V10,BOT,B,6
17787,49378,MATCH FLD SELAD CAP PROT/LOIROS 100ml,BOT,E,12
17787,49379,MATCH ACIDIFICANTE 100ml,BOT,C,10
17787,49389,MALBEC POMAD MODEL CAP ANTICASP CLUB 85g,BOT,E,0
17787,49390,MALBEC COND TRAT ANTICASPA CLUB 250ml,BOT,E,1
17787,49399,DEM FLORATTA DES COL AMOR/LAVAN 4ml V2,BOT,E,0
17787,49401,CASA 214 SAB LIQ MULTIF VAN/SUBLIM 400ml,BOT,E,6
17787,49402,MATCH MASC CAP SCIENCE RECONS 250g,BOT,E,0
17787,49403,BOTIK SRUM ALT/POT RETINOL PURO 15ml,BOT,E,8
17787,49418,NSPA OL DES HID CPO QUIN/AMEN 200ml V3,BOT,C,3
17787,49485,AURIEN LOC ILUM DES CPO GOLD 200ml V2,EUD,E,0
17787,49487,AURIEN LOC HID DES CPO RUBRA 200ml V3,EUD,E,0
17787,49490,GLAMOUR NECESS REG PU,BOT,E,0
17787,49496,AURIEN DES COL RUBRA 100ml V3,EUD,E,0
17787,49498,DEM AURIEN DES COL RUBRA 4ml V3,EUD,E,0
17787,49500,AURIEN DES COL TURQ 100ml V2,EUD,E,0
17787,49503,DEM AURIEN DES COL TURQ 4ml V2,EUD,E,0
17787,49510,DEM IMENSI DES COL 4ml V2 VDA,EUD,E,0
17787,49511,EUD EDP ROUGE 75ml V2,EUD,E,0
17787,49521,DEM EUD EDP ROUGE 4ml V2,EUD,E,0
17787,49539,DEM EUD EDP 4ml V2,EUD,E,0
17787,49540,EUD EDP 75ml V4,EUD,E,0
17787,49543,LA VICTORIE EDP 75ml V2,EUD,E,0
17787,49549,BOTICA 214 EDP FEM VER/FIRENZ 10ml PRM,BOT,E,0
17787,49550,BOTICA 214 EDP MASC VER/FIRENZ 10ml PRM,BOT,E,0
17787,49562,CLUB 6 BALM POS BARBA 75g V2,EUD,E,0
17787,49568,CLUB 6 ESPUM P/ BARB 200ml V2,EUD,E,0
17787,49570,IMPRESSION GEL CREME POS BARBA 75g V2,EUD,E,0
17787,49575,FOR LIFE DES COL 100ml V2,EUD,E,0
17787,49577,IMPRESSION EDP 100ml V2,EUD,E,0
17787,49578,DEM IMPRESSION EDP 4ml V2,EUD,E,0
17787,49579,IMPRESSION EDP IN BLACK 100ml V2,EUD,E,0
17787,49582,DEM IMPRESSION EDP IN BLACK 4ml V2,EUD,E,0
17787,49583,IMPRESS ESPUM P/ BARB 200ml V2,EUD,E,0
17787,49584,IMPRESS LOC D HID CPO IN BLACK 200ml V2,EUD,E,0
17787,49586,DEM MALBEC DES COL CLUB 4ml V3,BOT,E,2
17787,49680,LILY DES COL LEAU DE LILY SOLEIL 75ml,BOT,B,13
17787,49682,LILY D/COL LEAU DE LILY SOLEIL PRM 10ml,BOT,E,124
17787,49758,CJ FLAC LILY D/C LEAU DE LILY SOL 5x1ml,BOT,E,0
17787,49765,UOMINI DES COL V6 100ml,BOT,A,6
17787,49766,UOMINI DES COL BLACK V6 100ml,BOT,A,549
17787,49800,CHIC DES COL 95ml V2,EUD,E,0
17787,49802,DEM CHIC DES COL 4ml V2,EUD,E,0
17787,49803,CHIC DES COL RETRO 95ml V2,EUD,E,0
17787,49806,DEM LA VICTORIE EDP 4ml V2,EUD,E,0
17787,49807,BOTICA 214 EDP JASM/PATCH 75ML V2,BOT,E,11
17787,49812,EGEO DES COL ORIGNL 90ml V2,BOT,B,11
17787,49813,EGEO SHW GEL CPO ORIGNL 200g V2,BOT,C,0
17787,49814,DEM EGEO DES COL ORIGNL 4ml V3,BOT,E,0
17787,49823,REF CBEM LOC DES H CPO BEIJINHO V2 350ml,BOT,B,3
17787,49824,CBEM LOC DES HID CPO BEIJINHO V2 200ml,BOT,B,4
17787,49825,CBEM LOC DES HID CPO BEIJINHO V2 400ml,BOT,B,30
17787,49878,CBEM LOC DES HID CPO BOA NOITE V2 400ml,BOT,B,24
17787,49879,REF CBEM LOC DES HID CPO BOA NOITE 350ml,BOT,C,15
17787,49880,CBEM LOC DES HID CPO BOA NOITE V2 200ml,BOT,B,41
17787,49881,CBEM LOC DES HID CPO DELEITE V2 400ml,BOT,E,3
17787,49882,CBEM LOC DES HID CPO DELEITE V2 200ml,BOT,E,0
17787,49883,REF CBEM LOC DES HID CP DELEITE V2 350ml,BOT,E,2
17787,49886,REF CBEM LOC DES HID CPO L/MEL V6 350ml,BOT,E,5
17787,49887,REF CBEM LOC DES HID CPO NUVEM V3 350ml,BOT,B,14
17787,49888,CBEM LOC DES HID CPO NUVEM V3 400ml,BOT,B,11
17787,49890,CBEM LOC DES HID CPO NUVEM V3 200ml,BOT,A,19
17787,49893,CBEM LOC DES HID CPO ROS/ALG V3 400ml,BOT,B,38
17787,49896,CBEM LOC DES HID CPO ROS/ALG V3 200ml,BOT,B,0
17787,49897,CBEM LOC DES HID CPO CER/LIV V2 400ml,BOT,B,11
17787,49898,CBEM LOC DES HID CPO CER/LIV V2 200ml,BOT,B,7
17787,49903,CBEM LOC DES HID CPO PESSEGURA V2 200ml,BOT,B,24
17787,49917,SOPHIE PANTERA NEGRA PENT GARFO ABS,BOT,E,4
17787,49924,INTENSE TOALHINHAS DE ALG RECICLAVEL,BOT,E,1
17787,49943,CBEM LOC DES HID CPO PESSEGURA V2 400ml,BOT,B,23
17787,49944,REF CBEM LOC DES H CPO PESSEGUR V2 350ml,BOT,B,3
17787,49945,REF CBEM LOC DES H CPO ROS/ALG V3 350ml,BOT,B,20
17787,49950,CBEM LOC DES HID CPO BOA NOITE PRM 100ml,BOT,E,1
17787,49954,NSPA LOC DES HID FIRM QUINOA 400ml V2,BOT,E,2
17787,49957,REF NSPA LOC DES HID CPO ORQ NOIRE 350ml,BOT,B,15
17787,49958,NSPA LOC DES HID CPO ORQ NOIRE 400ml,BOT,B,26
17787,49959,NSPA LOC DES HID CPO ORQ NOIRE 200ml,BOT,C,23
17787,49960,NSPA DES COL BDY SPLSH ORQ NOIRE 200ml,BOT,B,11
17787,49963,NSPA SAB ESF CPO ORQ NOIRE 175ML,BOT,E,11
17787,49964,NSPA CREM MASSAGEM ORQ NOIRE 200g,BOT,E,1
17787,49970,FLORATTA DES COL BDY SPLSH RED 200ml,BOT,A,10
17787,49973,FLORATTA DES COL RED BLOSSOM 75ml,BOT,E,68
17787,49978,FLORATTA DES COL RED BLOSSOM PRM 10ml,BOT,E,9
17787,49980,CJ FLAC FLORATTA D/COL RED BLOSSOM 5x1ml,BOT,E,0
17787,50017,LILY SERUM LEAVE CAP ACET 100ml,BOT,C,5
17787,50021,QUASAR DES ANTIT AEROSOL 250ml,BOT,E,4
17787,50022,HER CODE EDP 50ml,BOT,A,0
17787,50026,FLORATTA DES ANTIT AEROSOL BLUE 250ml,BOT,E,9
17787,50052,ARBO LOC DES HID CPO 75ml,BOT,E,0
17787,50056,DEM EUDORA H DES COL READY 4ml,EUD,E,0
17787,50089,BOTI CARTCH PRES COMB 2 MAE/22,BOT,E,0
17787,5009,MA CHERIE DES COL 100ml V6,BOT,A,23
17787,50112,EUDORA H DES COL REFRESH 100ml,EUD,E,0
17787,50119,MALBEC DES COL ULT BLEU 100ml,BOT,E,4
17787,50123,MALBEC DES COL ULTRA BLEU 10ml PRM,BOT,E,0
17787,50125,MALBEC DES BDY SPR ULTRA BLEU 100ml,BOT,B,32
17787,50127,CJ FLAC MALBEC DES COL ULT BLEU 5x1ml,BOT,E,0
17787,50158,BOTI VAPORIZADOR PERF ALUM,BOT,E,6
17787,50160,CBEM PAR MEIA ALGODAO,BOT,E,72
17787,50165,MALBEC SHW GEL CAB/CPO 75g,BOT,E,4
17787,50169,LILY CR HID MAO 50g V3,BOT,E,0
17787,50172,LILY CREM HID MAO 30g V2,BOT,E,0
17787,50187,CBEM SAB LIQ CPO BORB SHOW/BNH 150ml,BOT,E,2
17787,50188,CBEM SAB LIQ ESF CPO SHOW/BNH 150ml,BOT,E,3
17787,50193,MALBEC SHAMP ANTIQUEDA CLUB V2 250ml,BOT,E,0
17787,50207,MALBEC TON CAP 2/1 CLUB V2 100ml,BOT,E,2
17787,50208,MALBEC COND ANTIQUEDA CLUB 250ML V2,BOT,E,0
17787,50211,MALBEC SHAMP ESF ANTICASPA CLUB V2 150ml,BOT,E,2
17787,50213,MALBEC POMAD MOD CAP ANTIC CLUB V2 85g,BOT,C,0
17787,50214,MALBEC BALM POS BARBA CLUB 100G V2,BOT,C,0
17787,50217,MALBEC ESPUM P/BARB CLUB V2 200ml,BOT,E,0
17787,50218,MALBEC CREM HID MULTIF CLUB V2 50ml,BOT,E,4
17787,50220,MALBEC LOC DES HID CPO CLUB V2 200ml,BOT,E,0
17787,50221,MALBEC SHW GEL CAB/CPO CLUB 250g,BOT,E,20
17787,50225,MALBEC BALM POS BARB SENSIT CLUB V2 100g,BOT,E,0
17787,50230,MALBEC SHAMP CABELOS OL CLUB 250ML,BOT,E,0
17787,50267,EUD K/M DES COL R/MARCAN V3 50ml,EUD,E,0
17787,50268,EUD K/M DES COL CABERNET V3 50ml,EUD,E,0
17787,50269,EUD K/M DES COL NUD/CARAM V3 50ml,EUD,E,0
17787,50271,EUD K/M DES COL NOW V2 50ml,EUD,E,0
17787,50272,EUD K/M LOC PERF DES CPO R/MARC V3 100ml,EUD,E,0
17787,50273,EUD K/M LOC PERF DES CPO CBRNT V2 100ml,EUD,E,0
17787,50290,DEM EUD K/M DES COL NOW V2 4ml,EUD,E,0
17787,50379,"INTENSE BAT GLOSS STICK NUD/ROSD 3,2g",BOT,E,1
17787,50380,"INTENSE BAT GLOSS STICK VERM 3,2g",BOT,E,5
17787,50381,"INTENSE BAT GLOSS STICK MARSALA 3,2g",BOT,E,2
17787,50388,DEM ZAAD EDP 4ml VDA,BOT,E,6
17787,50389,DEM THE BLEND EDP 4ml VDA,BOT,E,3
17787,50390,DEM QUASAR DES COL 4ml VDA,BOT,E,0
17787,50391,DEM MALBEC DES COL 4ml VDA,BOT,E,82
17787,50392,DEM ELYSEE EDP BLANC 4ml VDA,BOT,E,0
17787,50393,DEM COFFEE DES COL W/SEDUC 4ml VDA,BOT,E,7
17787,50395,BOTI SUN PROT SOL CPO FPS30 200g,BOT,C,4
17787,50396,BOTI SUN PROT SOL FAC FPS30 ULT FLD 40ml,BOT,E,5
17787,50397,BOTI SUN PR SOL FAC FPS70 UL FL PRM 10ml,BOT,E,1
17787,50414,CJ FLAC ZAAD EDP EXPEDITION 5x1ml,BOT,E,0
17787,50418,UOMINI DES COL INFINITE V2 100ml,BOT,E,8
17787,50446,"INTENSE HID LAB BY CUID PESSG CORAL 6,2g",BOT,E,0
17787,50447,"INTENSE HID LAB BY CUID L/MEL INC 6,2g",BOT,C,0
17787,50448,"INTENSE HID LAB BY CUID DEL ROS/NUD 6,2g",BOT,C,0
17787,50449,"INTENSE HID LAB BY CUID CER/L CER/V 6,2g",BOT,C,0
17787,50615,INTENSE GLOS LAB BUBBALOO MORANGO 5ml,BOT,E,4
17787,50644,CBEM LOC DES HID CPO BUBBALOO UVA 200ml,BOT,C,1
17787,50645,CBEM LOC DES HID CPO BUBBALOO MOR 200ml,BOT,B,0
17787,50651,ARBO DES COL INT 100ml,BOT,B,40
17787,50653,REF ARBO DES COL INT 100ml,BOT,E,1
17787,50654,ARBO DES COL INT 10ml PRM,BOT,E,10
17787,50659,UOMINI DES ANTIT AER SPIRIT 75g,BOT,E,6
17787,50662,QUASAR DES COL VISION 100ml,BOT,B,11
17787,50674,QUASAR DES COL VISION PRM 10ml,BOT,E,47
17787,50677,CLASH DES COL 100ml,BOT,A,3
17787,50678,REF CLASH DES COL 100ml,BOT,E,9
17787,50679,DEM CLASH DES COL 4ml,BOT,E,0
17787,50680,MAKE B BAT LIQ MAT C/AC POLIG BROWN 5ML,BOT,E,1
17787,50704,"MAKE B BLUSH PO C/A POLIG BERRY 5,5g",BOT,C,2
17787,50705,"MAKE B BLUSH PO C/AC POLIG CORAL 5,5g",BOT,E,6
17787,50706,"MAKE B BLUSH PO C/AC POLIG ROSE 5,5g",BOT,C,4
17787,50707,CLASH DES COL PRM 10ml,BOT,E,178
17787,50708,CJ FLAC CLASH DES COL 5x1ml,BOT,E,0
17787,50726,QUASAR DES ANTIT AER RUSH 75g/125ml,BOT,C,6
17787,50732,UOMINI DES COL SPIRIT 100ml,BOT,B,35
17787,50752,CLUB 6 DES COL EXCLUSIVE V2 95ml,EUD,E,0
17787,50756,MAKE B MASC CILIO POSTICOS PRETA 10g V3,BOT,C,14
17787,50797,DR BOTICA COND POC/BRLH 400ML V2,BOT,C,2
17787,50820,QUASAR DES COL RUSH V2 100ml,BOT,E,23
17787,50831,QUASAR DES COL ICE V2 100ml,BOT,C,12
17787,50863,REF QUASAR DES COL BLUE 100ml,BOT,E,0
17787,50879,CBEM SAB BARRA PESSEGURA V2 4x80g,BOT,B,105
17787,50880,CBEM SAB BARRA DELEITE 4x80g,BOT,E,1
17787,50881,CBEM DES COL BDY SPLSH DELEITE V3 200ml,BOT,A,12
17787,50882,CBEM SAB BARRA BOA NOITE V2 4x80g,BOT,B,32
17787,50888,MAKE B MASC GEL P/SOBRANC BROW LAMIN 4g,BOT,C,1
17787,50902,MATCH MASC CAP SCIENCE CRESC 250G,BOT,E,4
17787,50930,UOMINI DES COL SPIRIT PRM 10ml,BOT,E,37
17787,50931,ESTJ NSPA 3 AMEIXAS REG/22,BOT,E,0
17787,50932,ESTJ CBEM M/LEI REG/22,BOT,E,0
17787,50956,CLASH DES BDY SPR 100ml,BOT,B,20
17787,51068,BOTIK GEL LIMP FAC MICLR AC MAND/SAL 50g,BOT,C,10
17787,51082,INSTANCE DES COL F/VERM V2 200ml,EUD,E,0
17787,51084,INSTANCE SPR PERF DES COL KAR V2 200ml,EUD,E,0
17787,51086,INSTANCE DES COL BDY SPLSH MARAC 200ml,EUD,E,0
17787,51099,INSTANCE CR HID MAO FR/VERM V3 30g,EUD,E,0
17787,51108,QUASAR SHW GEL CAB/CPO BLUE V3 200g,BOT,C,2
17787,51122,CBEM SAB LIQ ESF CPO BOA NOITE V2 200ml,BOT,B,28
17787,51123,CBEM DES COL BDY SPLSH BOA NOIT V2 200ml,BOT,A,33
17787,51124,CBEM SAB BARRA BOA NOITE V2 2x80g,BOT,B,35
17787,51128,CBEM SAB BARRA LEITE/MEL 4x80g,BOT,A,0
17787,51129,CBEM DES ANTIT AER NUVEM V3 75g,BOT,B,3
17787,51130,CBEM DES COL BDY SPLSH BEIJINHO V2 200ml,BOT,B,30
17787,51131,CBEM DES ANTIT ROL BEIJINHO V3 55ml,BOT,C,2
17787,51144,CBEM DES ANTIT ROL L/MEL V7 55ml,BOT,E,0
17787,51146,CBEM DES ANTIT ROL NUVEM V3 55ml,BOT,B,18
17787,51147,CBEM DES COL BDY SPLSH NUVEM V3 200ml,BOT,A,33
17787,51148,CBEM ALCOOL GEL NUVEM V4 30g,BOT,C,0
17787,51161,CBEM DES ANTIT AER R/ALG V3 125ml,BOT,B,11
17787,51163,CBEM DES COL BDY SPLSH R/ALG V3 200ml,BOT,A,11
17787,51164,CBEM DES ANTIT CR R/ALG V3 80g,BOT,B,1
17787,51165,CBEM SAB BARRA ROSA/ALGODAO 4x80g,BOT,B,41
17787,51166,CBEM SAB BARRA ROSA/ALGODAO V8 2x80g,BOT,B,86
17787,51167,CBEM DES ANTIT CREM S/PERF V2 80g,BOT,B,28
17787,51168,CBEM SAB LIQ INT CER LIVRE V2 200ml,BOT,E,5
17787,51172,MAKE B BAT LIQ MAT C/AC POLIG D/ROUG 5ML,BOT,E,0
17787,51173,MAKE B GLOS LAB C/AC POLIG ROS/LOVER 5ml,BOT,C,1
17787,51174,MAKE B BAT LIQ MAT C/AC POLIG W/CASH 5ml,BOT,E,1
17787,51175,MAKE B BAT LIQ MAT C/AC POLIG EX/ROS 5ml,BOT,E,0
17787,51176,MAKE B BAT LIQ DIAM C/AC POL LUXURY 5ML,BOT,E,9
17787,51177,MAKE B BAT LIQ MAT C/AC POLIG G/BERR 5ml,BOT,E,3
17787,51178,MAKE B BAT LIQ MAT C/AC POLIG DP/ROS 5ml,BOT,E,0
17787,51179,"MAKE B BLUSH PO C/AC POLIG BROWN 5,5g",BOT,C,6
17787,51180,MAKE B GLOS LAB C/AC POLIG CRYST/ICO 5ml,BOT,C,6
17787,51181,MAKE B BAT LIQ MAT C/AC POLIG BR/WIN 5ml,BOT,E,2
17787,51182,MAKE B BAT LIQ MAT C/AC POLIG RED/BO 5ml,BOT,E,3
17787,51183,MAKE B GLOS LAB C/AC POL SOFT SILK 5ml,BOT,C,3
17787,51184,MAKE B BAT LIQ DIAM C/AC POL PLAT 5ML,BOT,E,8
17787,51185,MAKE B BAT LIQ DIAM C/AC POLIG GLOW 5ml,BOT,E,4
17787,51190,"MAKE B BALM LAB MICRO TINT ROSEWAT 3,6g",BOT,C,6
17787,51191,"MAKE B BALM LAB MICR TINT GRAP WINE 3,6g",BOT,C,4
17787,51213,ACCORDES DES COL HARMONIA 80ml V4,BOT,B,3
17787,51214,QUASAR DES ANTIT AER BLUE V10 75g,BOT,B,0
17787,51215,QUASAR DES ANTIT AER BRAVE V3 75g,BOT,E,13
17787,51217,QUASAR GEL POS BARBA BLUE V8 110g,BOT,C,7
17787,51225,BOTICOLL SAB BARR CPO PERF 5x80g V2,BOT,B,62
17787,51226,CBEM SAB BARRA NUVEM V5 2x80g,BOT,B,61
17787,51227,CBEM SAB BARRA NUVEM 4x80g,BOT,B,13
17787,51229,CBEM DES ANTIT ROLL ON R/ALG V3 55ml,BOT,C,8
17787,51230,CBEM SAB BARRA SORT 4x80g,BOT,E,0
17787,51231,CBEM SAB BARRA CEREJA LIVRE V2 2x80g,BOT,B,48
17787,51235,CBEM MASC HID P/BUMBUM PESSEGURA V2 230g,BOT,C,4
17787,51236,CBEM DES COL BDY SPLSH PESSEGUR V2 200ml,BOT,B,6
17787,51237,CBEM CREM ESF CPO PESSEGURA V2 230g,BOT,C,2
17787,51239,CBEM DES COL BDY SPLSH CER/LIV V2 200ml,BOT,B,7
17787,51242,QUASAR DES COL BRAVE V2 100ml,BOT,B,15
17787,51243,QUASAR DES COL CLASSIC 100ml,BOT,B,1
17787,51244,QUASAR DES COL BLUE V4 100ml,BOT,A,28
17787,5125,MA CHERIE LOC DESC HID CPO 200ml,BOT,C,9
17787,51250,QUASAR DES BDY SPR ICE V2 100ml,BOT,C,11
17787,51261,QUASAR DES B/SPR BLUE RPCK 100ml,BOT,B,30
17787,51262,QUASAR DES COL FIRE V2 100ml,BOT,B,8
17787,51268,MAKE B BAS LIQ C/ GLYC TX 130 30g,BOT,E,2
17787,51269,MAKE B BAS LIQ C/ GLYC TX 210 30g,BOT,E,6
17787,51270,MAKE B BAS LIQ C/ GLYCOLIC TX 300 30g,BOT,E,2
17787,51271,MAKE B BAS LIQ C/ GLYC TX  190 30g,BOT,E,4
17787,51272,MAKE B BAS LIQ C/ GLYCOLIC TX 120 30g,BOT,E,1
17787,51273,MAKE B BAS LIQ C/ GLYC TX 260 30g,BOT,E,2
17787,51274,MAKE B BAS LIQ C/ GLYC TX 270 30g,BOT,E,0
17787,51275,MAKE B BAS LIQ C/ GLYC TX 180 30g,BOT,E,5
17787,51276,MAKE B BAS LIQ C/ GLYC TX  230 30g,BOT,E,4
17787,51278,MAKE B BAS LIQ C/ GLYC TX 100 30g,BOT,E,2
17787,51279,MAKE B BAS LIQ C/ GLYC TX 140 30g,BOT,E,3
17787,5128,MATCH LEAV CAP SCIENCE CRESC 150ml,BOT,E,1
17787,51280,MAKE B BAS LIQ C/ GLYC TX 220 30G,BOT,E,0
17787,51281,MAKE B BAS LIQ C/ GLYCOLIC TX 320 30g,BOT,E,0
17787,51282,MAKE B BAS LIQ C/ GLYC TX  330 30G,BOT,E,1
17787,51322,ESTJ QDB SKIN Q COMBATE OLEOSIDADE,QDB,E,0
17787,51324,QUASAR DES SPR RUSH V2 100ml,BOT,B,9
17787,51383,"REF MAKE B BAT MATE C/AC POL R/FAB 4,0g",BOT,E,1
17787,51387,BOTICA 214 EDP FIJI PAR FL ESPEC 75ml,BOT,B,7
17787,51391,BOTICA 214 EDP FIJ/PAR FLOR/ESP PRM 10ml,BOT,E,4
17787,51392,BOTICA 214 LOC DES H CPO FIJ/PAR  200ML,BOT,E,1
17787,51393,CJ FLAC BOTICA 214 EDP FIJI P/F/ES 5x1ml,BOT,E,0
17787,51395,BOTICA 214 EDP FIJI PAR FL ESPEC 90ml,BOT,B,7
17787,51399,BOTICA 214 EDP FIJ/PAR FOUG/ESP PRM 10ml,BOT,E,3
17787,51401,CJ FLAC BOTICA 214 EDP FIJ P/FG/ES 5x1ml,BOT,E,0
17787,51402,BOTICA 214 DES ANT AER FIJ P/FG/ES 125ml,BOT,C,13
17787,51422,NSPA SAB BARR CPO AMEI 2x90g V2,BOT,E,2
17787,51423,NSPA SAB BARR CPO AMEI 3x90g V4,BOT,E,0
17787,51432,INTENTION FOR MAN DES COL BAD 100ml,EUD,E,0
17787,51436,DR BOTICA SAB BARRA POC/CORAG 3x80g V2,BOT,C,20
17787,51438,SOPHIE SAB BARRA 3x80g V2,BOT,C,4
17787,51439,CBEM NECESS BUBBALOO PES,BOT,E,36
17787,51441,DR BOTICA COL POCAO FORCA 120ml V2,BOT,B,21
17787,51448,FLORATTA DES COL GOLD 75ml V2,BOT,E,28
17787,51453,REF FLORATTA DES BDY SPR S/LOVE 100ml V2,BOT,E,0
17787,51455,"INTENSE BAT GLOSS STICK CORAL 3,2g",BOT,C,2
17787,51459,"INTENSE BLUSH/ILUM GLOW BY MELISSA 5,5g",BOT,E,1
17787,51460,"INTENSE GLOS LAB BY MELISS PL/LIPS 5,5ml",BOT,E,60
17787,51461,FLORATTA CR DES H CPO SIMP/LOVE 200ml V2,BOT,E,0
17787,51466,BOTIK MULTIPR FAC FPS50 VITAM C 40G,BOT,C,3
17787,51467,BOTIK SRUM FAC ALT POT VITAM C 30ml,BOT,B,5
17787,51468,BOTIK CR HID FAC ANTIOX VITAM C V2 50g,BOT,B,15
17787,51470,BOTIK GEL LIMP FAC VITAM C 200g,BOT,E,6
17787,51473,ESTJ BOTIK VITAMINA C,BOT,E,0
17787,51474,ETIQUETA MAKE PRETA SWAROVSKI,BOT,E,0
17787,51475,ETIQUETA PERF PRETA SWAROVSKI,BOT,E,0
17787,51500,SOPHIE COL CANDY 100ml V2,BOT,B,50
17787,51502,"REF MAKE B BAT GLOSS C/AC POL ROSE 3,6g",BOT,E,1
17787,51505,SIAGE SHAMP REGEN POS QUIMICA 1000ml V2,EUD,E,0
17787,51509,SCH INSTANCE LOC D H C FR/VER VDA V3 7ml,EUD,E,0
17787,51510,SCH INSTANCE LOC D H CP KARIT VDA V3 7ml,EUD,E,0
17787,51513,EUDORA MOUSSE BANHO 150ML V2,EUD,E,0
17787,51514,INSTANCE CR HID MAO BAUN V2 30g,EUD,E,0
17787,51516,INSTANCE DES COL BAUN V2 200ml,EUD,E,0
17787,51517,SIAGE MASC CAP REGEN POS QUIMICA 500g V2,EUD,E,0
17787,51521,DR BOTICA COL POCAO/CORAG 120ml V2,BOT,B,10
17787,51525,CBEM DES ANTIT ROLL ON BEIJINHO 55ml V2,BOT,E,0
17787,51526,FLORATTA OL DES CPO PERF RED V2 150ML,BOT,C,4
17787,51533,INSTANCE CR HID MAO KARITE V2 30g,EUD,E,0
17787,51581,FLORATTA DES BDY SPR S/LOVE 100ml V2,BOT,B,14
17787,51595,MAKE B PEDRA VULCANICA ABSORV OL,BOT,E,6
17787,51608,MEN SHAMP ANTICASPA 200ml V2,BOT,E,1
17787,51704,GLAMOUR DES COL MIDNIGHT 75ml,BOT,B,10
17787,51707,GLAMOUR DES COL MIDNIGHT PRM 10ml,BOT,E,75
17787,51740,REF NSPA SHAMP CAVIAR 250ML,BOT,E,0
17787,51741,REF NSPA COND CAVIAR 250ml,BOT,C,0
17787,51757,CBEM SAB BARR CPO SHOW BNH 100G,BOT,E,5
17787,51775,EUD BABY SHAMP 200ml V2,EUD,E,0
17787,51784,EUD BABY AGUA COL 100ML V2,EUD,E,0
17787,51785,EUD BABY LOC H CPO BNH/POS BNH 200ml V2,EUD,E,0
17787,51786,EUD BABY SAB LIQ CABECA/PES 200ml V2,EUD,E,0
17787,51787,OUI EDP JD/GRASSE C/VALVULA 100ml,BOT,E,0
17787,51797,OUI CR DES HID CPO JD/GRASSE ROSE 400ml,BOT,E,0
17787,51801,BOTI BABY SAB LIQ GLIC V2 200ml,BOT,B,12
17787,51802,BOTI BABY COL SOL V2 100ml,BOT,B,257
17787,51803,BOTI BABY COND V2 400ml,BOT,C,2
17787,51805,BOTI BABY CR REPAR 30ml,BOT,E,3
17787,51806,REF BOTI BABY COND 350ml,BOT,C,7
17787,51808,BOTI BABY COND V2 200ml,BOT,E,4
17787,51834,PULSE DES COL ACTION 100ml,EUD,E,0
17787,51869,NSPA OL DES HID CPO ORQ NOIRE 200ml,BOT,C,5
17787,51873,ZAAD DES ANTIT AER ARTIC 75g,BOT,E,2
17787,51874,ZAAD EDP ARTIC 95ml,BOT,B,11
17787,51875,CJ FLAC ZAAD EDP ARTIC 5x1ml,BOT,E,0
17787,51944,COFFEE DES COL MAN SEDUC TCH PRM 10ml,BOT,E,52
17787,51953,INTENSE MASC P/CILIO POP PRETO 10g,BOT,C,9
17787,51987,EGEO DES COL FREE FIRE PRM 10ml,BOT,E,3
17787,52004,NSPA LOC RAD DES HID CPO AMEI DOUR 400ml,BOT,B,18
17787,52005,REF NSPA LOC RAD D H CPO AMEI DOUR 350ml,BOT,B,6
17787,52008,NSPA LOC RAD DES HID CPO AMEI DOUR 200ml,BOT,C,0
17787,52012,NSPA DES COL BDY SPLSH AMEIXA DOUR 200ml,BOT,E,8
17787,52016,NSPA CREM HID MAOS AMEI DOUR 75g,BOT,E,7
17787,52018,BOTI BABY SHAMP V2 400ml,BOT,C,8
17787,52019,BOTI BABY SHAMP V2 200ml,BOT,C,3
17787,52021,REF BOTI BABY SHAMP 350ml,BOT,C,13
17787,52022,BOTI BABY LOC HID CPO 200ml,BOT,C,1
17787,52023,BOTI BABY LOC HID CPO 400ml,BOT,C,3
17787,52024,REF BOTI BABY SAB LIQ GLIC 350ml,BOT,C,12
17787,52025,BOTI BABY SAB LIQ GLIC V2 400ml,BOT,C,1
17787,52029,BOTICOLL PORTINARI D/COL ABSOLUTO 100ml,BOT,B,11
17787,52034,NSPA SAB BARRA AMEIXA DOURADA 2x90g,BOT,C,10
17787,52040,REF BOTI BABY LOC HID CPO 350ml,BOT,B,2
17787,52044,CELEBRE DES COL FEM AGORA 100ml,BOT,A,8
17787,52048,CELEBRE DES COL FEM AGORA PRM 10ml,BOT,E,0
17787,52050,CELEBRE LOC DES HID CPO AGORA 200ml,BOT,E,1
17787,52051,CASA 214 DIF VARET GARDENIA IMPER 250ml,BOT,C,5
17787,52052,CELEBRE DES COL MASC AGORA 100ml,BOT,A,42
17787,52055,CELEBRE DES COL MASC AGORA PRM 10ml,BOT,E,11
17787,52056,CJ FLAC CELEBRE DES COL MASC AGORA 5x1ml,BOT,E,0
17787,52058,MALBEC DES COL ELEGANT 100ml,BOT,E,0
17787,52060,MALBEC DES COL ELEGANT PRM 10ml,BOT,E,48
17787,52072,MATCH OL MULTIBENEFICIOS CIEN/CURV 50ml,BOT,E,2
17787,52073,MATCH FIN CAP JELLY CIEN/CURV 350g,BOT,E,3
17787,52075,MATCH MASC CAP HID 4ABC CIEN/CURV 350g,BOT,E,4
17787,52076,MATCH SHAMP CIEN/CURV 300ml,BOT,C,0
17787,52077,MATCH CR P/PENT CRESPOS CIEN/CURV 450ml,BOT,E,5
17787,52078,MATCH COND HID CIEN/CURV 300ml,BOT,C,5
17787,52079,MATCH MASC C H 2ABC 3ABC CIEN/CURV 350g,BOT,C,7
17787,52081,MATCH LEAV CAP LEVE CIEN/CURV 250ml,BOT,E,2
17787,52082,MATCH CR P/PENT CACH CIEN/CURV 450ml,BOT,B,5
17787,52083,MATCH BOOSTER RECONS CAP CIEN/CURV 90ml,BOT,E,1
17787,52085,MATCH BOOSTER NUTR CAP CIEN/CURV 90ml,BOT,E,3
17787,52086,CASA 214 SAB LIQ MULTIF GARD/IMPER 400ml,BOT,E,11
17787,52095,CASA 214 H/SPR GARDENIA IMPER 250ml,BOT,E,7
17787,52110,DR BOTICA CR PENT POC/TR/NO LISOS 350ml,BOT,E,1
17787,52122,DR BOTICA SHAMP POC/ESPUM LISOS 400ml,BOT,E,3
17787,52136,DR BOTICA COND POC/BRILHO LISOS 400ml,BOT,E,3
17787,52140,DR BOTICA COND POC/BRILHO CACHOS 400ml,BOT,E,3
17787,52145,"INTENSE BAT CREM 340 V6 3,8g",BOT,C,13
17787,52146,"INTENSE BAT CREM 260 V2 3,8g",BOT,B,0
17787,52147,DR BOTICA CR PENT POC/TR/NO CACHOS 350ml,BOT,E,3
17787,52148,"INTENSE BAT CREM 420 V2 3,8g",BOT,C,5
17787,52150,INTENSE BAT LIQ TINT 16H SUPF 535 V2 5ml,BOT,C,6
17787,52153,"INTENSE BAT CREM 540 V2 3,8g",BOT,C,12
17787,52154,INTENSE BAT LIQ TINT 16H SUPF 345 V3 5ml,BOT,C,4
17787,52155,"INTENSE BAT CREM 120 V4 3,8g",BOT,C,3
17787,52156,INTENSE BAT LIQ TINT 16H SUPF 425 V3 5ml,BOT,C,3
17787,52159,INTENSE BAT LIQ TINT 16H SUPF 245 V3 5ml,BOT,B,0
17787,52160,INTENSE BAT LIQ TINT 16H SUPF 635 V3 5ml,BOT,C,0
17787,52161,"INTENSE BAT CREM 270 V2 3,8g",BOT,C,8
17787,52162,"INTENSE BAT CREM 580 V3 3,8g",BOT,E,14
17787,52163,"INTENSE BAT CREM 250 V7 3,8g",BOT,B,5
17787,52164,DR BOTICA CR PENT POC/TR/NO CRESP 350ml,BOT,E,7
17787,52172,DR BOTICA LOC HID CPO POC/NUVENS 400ml,BOT,E,5
17787,52175,DR BOTICA SAB LIQ CPO POC/BOLHAS 400ml,BOT,E,4
17787,52193,"INTENSE BAT MATE POP 235 V2 3,8g",BOT,E,0
17787,52194,"INTENSE BAT MATE POP 360 V3 3,8g",BOT,E,10
17787,52197,"INTENSE BAT MATE POP 130 V3 3,8g",BOT,E,2
17787,52199,"INTENSE BAT MATE POP 520 V2 3,8g",BOT,E,7
17787,52200,INTENSE BAT LIQ MATE 230 V2 5ML,BOT,E,22
17787,52202,"INTENSE BAT MATE POP 430 V3 3,8g",BOT,E,6
17787,52209,ZAAD EDP ARTIC PRM 10ml,BOT,E,19
17787,52212,SIAGE SHAMP COMBATE CASP MEN V3 250ml,EUD,E,0
17787,52213,SIAGE SHAMP ESTIM CRESC MEN V2 250ml,EUD,E,0
17787,52214,SIAGE POMAD MODEL CAP MEN V2 90g,EUD,E,0
17787,52225,NSPA SAB BARR CPO AMEI 90g V6,BOT,E,7
17787,52258,INTENSE BAT LIQ MATE 530 V2 5ML,BOT,E,4
17787,52259,"INTENSE BAT SUP/FRESH NUDE V3 3,4g",BOT,E,10
17787,52261,"INTENSE BAT SUP/FRESH CEREJA V3 3,4g",BOT,E,9
17787,52281,INTENSE GLOS LAB 115 V2 5ml,BOT,C,0
17787,52282,INTENSE GLOS LAB 215 V2 5ml,BOT,C,0
17787,52296,NSPA SRUM CPO ORQ NOIRE 30ml,BOT,E,7
17787,52299,VOLPE NEXT DES COL 100ML,EUD,E,0
17787,52310,"SOUL K/M BAT HID NUDE VELUDO V3 3,7g",EUD,E,0
17787,52325,"SOUL K/M BAT MATE CABERNET V2 3,7g",EUD,E,0
17787,52326,"SOUL K/M BAT MAT ROSE UNICO V2 3,7g",EUD,E,0
17787,52327,"SOUL K/M BAT HIDR/MAT MALVA MODA V2 3,7g",EUD,E,0
17787,52328,"SOUL K/M BAT MATE MARR AUTENTICO V2 3,7g",EUD,E,0
17787,52332,"SOUL K/M BAT MATE NUDE AUTORAL V2 3,7g",EUD,E,0
17787,52334,"SOUL K/M BAT MATE VERM MODERNO V2 3,7g",EUD,E,0
17787,52335,"SOUL K/M BAT MATE VERM PAPARAZZI V2 3,7g",EUD,E,0
17787,52342,BOTI SUN PROT SOL CPO FPS70 200g,BOT,C,2
17787,52350,"SOUL K/M BAT HID/MAT CAST PASSAR V2 3,7g",EUD,E,0
17787,52351,"SOUL K/M BAT HD/MAT BORD LOK/DIA V2 3,7g",EUD,E,0
17787,52353,"SOUL GLOS LAB T/COAT ROSA HOLOF V2 5,2ml",EUD,E,0
17787,52354,"SOUL K/M GLOS LAB T/COAT PES/FL V2 5,2ml",EUD,E,0
17787,52370,INSTANCE SAB LIQ MAOS BAUN 400ml,EUD,E,0
17787,52373,INSTANCE SAB LIQ MAOS KARITE 400ml,EUD,E,0
17787,52374,INSTANCE SAB BARRA KARITE 4x80g,EUD,E,0
17787,52376,INSTANCE SAB LIQ MAOS FR/VERM 400ml,EUD,E,0
17787,52378,INSTANCE SAB BARRA FR/VERM 4x80g,EUD,E,0
17787,52379,INSTANCE SAB LIQ INT FR/VERM 180ml,EUD,E,0
17787,52381,INSTANCE SAB BARRA CER/AMEND 4x80g,EUD,E,0
17787,52382,INSTANCE OL BIF DES H CPO CER/AMEN 200ml,EUD,E,0
17787,52383,INSTANCE CR HID MAO CER/AMEND V2 30g,EUD,E,0
17787,52421,SCH INSTANCE H D CP CER/AMEND VDA V2 7ml,EUD,E,0
17787,52493,FLORATTA DES COL MY BLUE V2 75ml,BOT,B,95
17787,52507,FLORATTA EDP FLEUR ECLIPSE V2 75ml,BOT,B,6
17787,52537,"INTENSE DEL LIQ HOL BY MELISS PINK 3,2ml",BOT,E,1
17787,52538,"INTENSE DEL LIQ HOL BY MELISS REAL 3,2ml",BOT,E,2
17787,52540,ESTJ MALBEC CLUB TRATAMENTO V2,BOT,E,1
17787,52546,ESTJ MALBEC CLUB TRATAMENTO ANTICASPA V2,BOT,E,1
17787,52553,CJ SCH MALBEC CLUB SH/C ANTIC V2 2x7ml,BOT,E,0
17787,52554,CJ SCH MALBEC CLUB SH/C ANTIQ V2 2x7ml,BOT,E,0
17787,52589,REF ELYSEE CR DES HID ACET CP BLANC 200g,BOT,B,4
17787,52591,REF ELYSEE CR DES HID ACET CPO 200g,BOT,E,3
17787,52613,NSPA SHAMP CVR 300ml V4,BOT,C,3
17787,52618,MAKE B MASC CIL VOL EXTRM PRETA V2 10g,BOT,C,0
17787,52619,MAKE B MASC CIL SCANDAL L C/OL COCO 10g,BOT,C,1
17787,52620,MAKE B MASC CIL EXPLOSION EFFECT AC/HIAL 10G,BOT,C,5
17787,52627,"BOTIK BALM LAB HID AC/HIALUR 3,2g",BOT,B,5
17787,52628,BOTIK GEL HID FORT FAC AC/HIALUR 50G,BOT,E,6
17787,52629,BOTIK FLD MULTIPR FAC AC/HIAL FPS50 30ml,BOT,C,6
17787,52634,NSPA LOC DES HID CPO PITAYA 250ml,BOT,E,4
17787,52637,CHIC LOC DES HID CPO 200ml V2,EUD,E,0
17787,52638,MAKE B MASC CILIO 4K PANORAMIC 10g V2,BOT,C,1
17787,52639,ESTJ FLORATTA ROSE REG/21 V2,BOT,E,0
17787,52640,ESTJ LILY REG/21 V2,BOT,C,2
17787,52654,ESTJ NSPA QUINOA REG/21 V2,BOT,E,0
17787,52655,ESTJ QUASAR REG/21 V2,BOT,E,0
17787,52668,LILY CR DES HID CPO 75g,BOT,C,2
17787,52670,ESTJ LILY JUMBO REG/21 V2,BOT,B,4
17787,52672,ESTJ QUASAR JUMBO REG/21 V2,BOT,E,0
