PDV,SKU,DESCRIÇÃO,MARCA,CURVA,ESTOQUE_ATUAL
17787,79417,ARBO DES BDY SPR BOTANIC 100ml V2,BOT,B,16
17787,79565,BOTICOLL HORIZONTE DES ANTIT AER 75G,BOT,E,2
17787,79648,MATCH COND ANTI IDADE DESMRL 250ml,BOT,E,0
17787,79987,NSPA LOC DES HID CPO KARITE 200ML V3,BOT,E,3
17787,79997,GLAMOUR DES ANTIT AER 75g V7,BOT,C,1
17787,79998,GLAMOUR DES BDY SPR SEC BL 100ml V3 PCK,BOT,B,7
17787,80358,SIAGE COND REG POS QUIM 200ml RPCK,EUD,E,0
17787,80361,DR BOTICA GEL FIX CAP 80g,BOT,E,1
17787,80693,"INTENSE BATOM ACETINADO 225 3,8g V6",BOT,E,4
17787,80698,MALBEC SHAMP GREY CLUB 250ml V2,BOT,E,0
17787,80729,"MAKE B PO COMP FAC ILUM ROSE 5,4g",BOT,E,3
17787,80761,MALBEC DES COL FLAME 100ml,BOT,E,11
17787,80813,MAKE B BAT LIQ DIAM AC/HIAL PLATINUM 5ml,BOT,E,9
17787,80815,MAKE B BAT LIQ DIAM AC/HIAL FANTASY 5ml,BOT,E,2
17787,80849,REF LILY CR AC HID DES CPO LUMIERE 250g,BOT,B,3
17787,80852,CBEM GEL CREM DES CPO ATIVA 200g,BOT,E,18
17787,80887,UOMINI DES BDY SPR 100ml V7 PCK,BOT,B,44
17787,80888,UOMINI DES BDY SPR INFINITE 100ml,BOT,B,30
17787,80971,COFFEE DES COL WOMAN SENSE 100ML,BOT,B,1
17787,80972,COFFEE DES COL MAN SENSE 100ml,BOT,B,20
17787,81054,REF ARBO DES COL 100ml,BOT,E,0
17787,81108,GLAMOUR DES COL DIVA 75ml V2,BOT,B,6
17787,81110,BOTICOLL CRAZY DES COL CHOICES 100ml,BOT,E,5
17787,81166,CBEM LOC DES H REFR CPO BEND/CACT 200ml,BOT,E,1
17787,81178,MAKE B EDP GOLD 75ml,BOT,E,0
17787,81181,MATCH MASC CAP FORCA 250g,BOT,E,5
17787,81330,COFFEE D/C ADD/MAN/ORIENT/AROM V2 100ml,BOT,B,11
17787,81331,ELYSEE EDP SUCCES 50ml,BOT,E,3
17787,81334,"INTENSE PALETTE BRONZE MULTIF 2 13,2g",BOT,B,5
17787,81382,ZAAD EDP SANTAL 95ml,BOT,B,0
17787,81384,COFFEE D/COL ADD/WOM/ORIENT/FR V2 100ml,BOT,B,29
17787,81417,REF NSPA LOC DES REVIT CPO ROSE 400ML,BOT,C,5
17787,81419,REF CBEM LOC D H REFR CPO BEN/CACT 400ml,BOT,B,5
17787,81423,ELYSEE CREM DES HID ACET CPO SUCCES 250g,BOT,C,1
17787,81480,"INTENSE LAPIS P/SOBRANC 1 1,1g",BOT,C,0
17787,81481,"INTENSE LAPIS P/SOBRANC 2 1,1g",BOT,C,1
17787,81508,KIT BOTIK COMPLETO,BOT,E,0
17787,81512,INTENSE BAT LIQUIDO AQUATINT VERM 5ml,BOT,C,4
17787,81513,INTENSE BAT LIQUIDO AQUATINT ROSA 5ml,BOT,C,4
17787,81514,INTENSE BAT LIQUIDO AQUATINT CORAL 5ml,BOT,E,1
17787,81568,MEN SHW GEL CAB/CPO/BARB 205g V4,BOT,E,0
17787,81602,"MAKE B BAT CREM C/AC POLIG REV BRW 3,6g",BOT,C,0
17787,81605,"MAKE B BAT CREM C/AC POL ROSA CASH 3,6g",BOT,C,1
17787,81608,"MAKE B BAT CREM C/AC POL NUD MALVA 3,6g",BOT,C,0
17787,81610,"MAKE B BAT CREM C/AC POL REVOL RED 3,6g",BOT,E,2
17787,81612,"MAKE B BAT CREM C/AC POL SOFT NUD 3,6g",BOT,C,1
17787,81613,"MAKE B BAT CREM C/AC POL WATERMELON 3,6g",BOT,C,5
17787,81614,"MAKE B BAT CREM C/AC POL FASH BERR 3,6g",BOT,C,1
17787,81618,MAKE B BAT MATE C/AC POLIGL RED SUPR 4g,BOT,C,1
17787,81621,MAKE B BAT MATE C/AC POLIG ORANGE FEV 4g,BOT,E,3
17787,81623,MAKE B BAT MATE C/AC POLIGL VIOLET 4g,BOT,C,0
17787,81624,MAKE B BAT MATE C/AC POLIGL HOT BROWN 4g,BOT,C,1
17787,81626,MAKE B BAT MATE C/AC POLIGL ROS FABUL 4g,BOT,E,3
17787,81628,"MAKE B BAT GLOSS C/AC POLIGL NUDE 3,6g",BOT,C,2
17787,81629,"MAKE B BAT GLOSS C/AC POLIGL ROSE 3,6g",BOT,C,2
17787,81631,"MAKE B BAT GLOSS C/AC POLIGL WINE 3,6g",BOT,C,0
17787,81633,MAKE B BASE LIQ RETIN H INVISIVEL 26G,BOT,E,0
17787,81634,MAKE B BASE LIQ RETIN H  15 26g,BOT,E,0
17787,81635,MAKE B BASE LIQ RETIN H COR 20 26g,BOT,C,1
17787,81636,MAKE B BASE LIQ RETIN H COR 25 26g,BOT,C,2
17787,81637,MAKE B BASE LIQ RETIN H COR 30 26g,BOT,E,2
17787,81638,MAKE B BASE LIQ RETIN H COR 40 26G,BOT,C,1
17787,81639,MAKE B BASE LIQ RETIN H COR 50 26g,BOT,E,0
17787,81640,MAKE B BASE LIQ RETIN H COR 53 26g,BOT,E,0
17787,81642,MAKE B BASE LIQ RETIN H COR 60 26g,BOT,E,3
17787,81643,MAKE B BASE LIQ RETIN H COR 65 26g,BOT,E,3
17787,81644,MAKE B BASE LIQ RETIN H COR 70 26g,BOT,E,0
17787,81645,MAKE B BASE LIQ RETIN H COR 75 26g,BOT,E,1
17787,81646,MAKE B BASE LIQ RETIN H COR 80 26g,BOT,E,0
17787,81756,LINDA DES COL IRRESISTIVEL 100ml,BOT,B,13
17787,81828,LINDA DES COL IRRESISTIVEL PRM 10ml,BOT,E,38
17787,81849,LINDA DES COL FELICIDADE V2 100ml,BOT,B,15
17787,81884,INTENSE LOC DES HID CPO OOPSS 200ml,BOT,C,101
17787,81917,CJ FLAC LINDA DES COL IRRESISTIVEL 5x1ml,BOT,E,0
17787,81951,"MAKE B BAT LIQ UL/TINT UNLIM TAUP 7,2ml",BOT,E,2
17787,81954,FLORATTA DES COL SIMPLE LOVE 75ml,BOT,B,58
17787,81956,FLORATTA CR DES HID CPO SIMP/LOVE 200ml,BOT,E,0
17787,81969,EGEO DES BDY SPR HIT 100ml,BOT,E,1
17787,82017,DEM EGEO DES COL HIT 4ml,BOT,E,2
17787,82033,CBEM LOC DES HID CPO BOA NOITE 400ml,BOT,E,3
17787,82036,CBEM SAB LIQ ESF CPO BOA NOITE 200ml,BOT,E,24
17787,82037,CBEM DES COL BDY SPLASH BOA NOITE 200ml,BOT,E,0
17787,82045,NSPA LOC DES CPO A/STRES JAS/SAMB 400ml,BOT,E,5
17787,82046,NSPA LOC DES CPO A/STRES JAS/SAMB 200ml,BOT,B,11
17787,82052,NSPA DES COL BODY SPLASH JAS/SAMB 200ml,BOT,B,9
17787,82059,OUI EDP SCAPIN 245 75ml,BOT,E,0
17787,82065,"INTENSE LAP BAT ROSA 1,2g",BOT,B,3
17787,82112,DEM MEN DES COL ONLY 4ml V2,BOT,E,0
17787,82113,DEM MEN DES COL GALBE 4ml V2,BOT,E,0
17787,82238,BOTICOLL DES COL THATY 200ml,BOT,B,43
17787,82239,MAKE B BAS LIQ PROT HYAL 70 INVIS 30ml,BOT,E,2
17787,82246,REF CBEM LOC DES HID CPO BOA NOITE 400ml,BOT,E,1
17787,82250,REF NSPA LOC DES CPO A/STR JAS/SAM 400ml,BOT,C,9
17787,82265,NSPA SAB LIQ CPO ESF A/STR JAS/SAM 175ml,BOT,C,6
17787,82354,KIT BOTIK VITAMINA B5/ACIDO HIALURONIC,BOT,E,2
17787,82448,MAKE B BAT LIQ RETIN H RED VELVET 11ml,BOT,E,3
17787,82449,MAKE B BAT LIQ RETIN H EASY PINK 11ml,BOT,E,3
17787,82450,MAKE B BAT LIQ RETIN H WINE BLOSSOM 11ml,BOT,E,3
17787,82451,MAKE B BAT LIQ RETIN H SALTED CARAM 11ml,BOT,E,3
17787,82452,MAKE B BAT LIQ RETIN H CINNAMON LOV 11ml,BOT,E,1
17787,82464,MAKE B BASE LIQ RETIN H COR 10 26g,BOT,E,2
17787,82476,BOTICOL PORTINARI DES ANT/A 75g/125ml V7,BOT,E,1
17787,82491,"REF MAKE B BAT CR C/AC POL REV RED 3,6g",BOT,E,3
17787,82492,"REF MAKE B BAT CR C/AC POL ROS CASH 3,6g",BOT,E,1
17787,82493,"REF MAKE B BAT GLOSSY C/AC POL WINE 3,6G",BOT,E,2
17787,82494,"REF MAKE B BAT CR C/AC POL SOFT NUD 3,6g",BOT,C,0
17787,82495,REF MAKE B BAT MATE C/AC POL HOT BROW 4g,BOT,E,3
17787,82528,"MAKE B CORRET LIQ FAC EFFECT 10 5,7ml",BOT,E,4
17787,82530,"MAKE B CORRET LIQ FAC EFFECT 20 5,7ml",BOT,E,1
17787,82531,"MAKE B CORRET LIQ FAC EFFECT 25 5,7ml",BOT,E,5
17787,82532,"MAKE B CORRET LIQ FAC EFFECT 30 5,7ml",BOT,E,2
17787,82533,"MAKE B CORRET LIQ FAC EFFECT 40 5,7ml",BOT,E,1
17787,82534,"MAKE B CORRET LIQ FAC EFFECT 50 5,7ml",BOT,E,0
17787,82535,"MAKE B CORRET LIQ FAC EFFECT 60 5,7ml",BOT,E,0
17787,82536,"MAKE B CORRET LIQ FAC EFFECT 70 5,7ml",BOT,E,1
17787,82537,"MAKE B CORRET LIQ FAC EFFECT 80 5,7ml",BOT,E,0
17787,82540,MAKE B BAS LIQ MATE SALICYLIC 110 30g,BOT,E,3
17787,82541,MAKE B BAS LIQ MATE SALICYLIC 130 30g,BOT,E,6
17787,82542,MAKE B BAS LIQ MATE SALICYLIC 140 30g,BOT,C,2
17787,82543,MAKE B BAS LIQ MATE SALICYLIC 160 30g,BOT,C,2
17787,82544,MAKE B BAS LIQ MATE SALICYLIC 170 30g,BOT,C,2
17787,82545,MAKE B BAS LIQ MATE SALICYLIC 210 30g,BOT,E,0
17787,82546,MAKE B BAS LIQ MATE SALICYLIC 230 30g,BOT,E,3
17787,82547,MAKE B BAS LIQ MATE SALICYLIC 240 30g,BOT,B,0
17787,82548,MAKE B BAS LIQ MATE SALICYLIC 250 30g,BOT,C,2
17787,82549,MAKE B BAS LIQ MATE SALICYLIC 260 30g,BOT,E,1
17787,82550,MAKE B BAS LIQ MATE SALICYLIC 270 30g,BOT,C,2
17787,82551,MAKE B BAS LIQ MATE SALICYLIC 280 30g,BOT,C,2
17787,82552,MAKE B BAS LIQ MATE SALICYLIC 300 30g,BOT,E,3
17787,82553,MAKE B BAS LIQ MATE SALICYLIC 310 30g,BOT,E,0
17787,82586,MATCH COND POS QUIMICA 250ml,BOT,C,14
17787,82605,"MAKE B CORRET LIQ FAC FL IL RET H10 2,5g",BOT,E,0
17787,82608,"MAKE B CORRET LIQ FAC FL IL RET H30 2,5g",BOT,E,0
17787,82609,"MAKE B CORRET LIQ FAC FL IL RET H40 2,5g",BOT,E,0
17787,82610,"MAKE B CORRET LIQ FAC FL IL RET H50 2,5g",BOT,E,2
17787,82612,"MAKE B CORR LIQ FLSH IL FAC RET H60 2,5g",BOT,E,3
17787,82655,COMB EGEO VANILLA NAM/20,BOT,E,2
17787,82685,EGEO DES COL BOMB BLACK C/CAR 90ml,BOT,A,1
17787,82686,EGEO DES COL BLUE C/CAR 90ml,BOT,B,6
17787,82688,EGEO DES COL DOLCE C/CAR 90ml,BOT,A,16
17787,82689,EGEO DES COL CHOC C/CAR 90ml,BOT,A,2
17787,82690,EGEO DES COL RED C/CART 90ml,BOT,B,17
17787,82700,MATCH SHAMP HIDRATACAO ANTIF 300ml,BOT,C,3
17787,82701,MATCH COND HIDRATACAO ANTIF 280ML,BOT,C,5
17787,82704,MATCH SHAMP NUTR PROF 300ml,BOT,E,0
17787,82705,MATCH COND NUTR PROF 280ml,BOT,E,2
17787,82707,MATCH LEAVE IN NUTR PROF 150ml,BOT,B,6
17787,82708,MATCH MASC CAP NUTR PROF 250g,BOT,E,3
17787,82709,MATCH OL CAP NUTR PROF 50ml,BOT,E,6
17787,82788,CBEM SHAMP HIDRATACAO NUVEM 250ml,BOT,E,12
17787,82789,CBEM SHAMP FEIRA BANANA 230ml,BOT,E,10
17787,82794,CBEM COND HIDRATACAO NUVEM 250ml,BOT,C,0
17787,82795,CBEM COND FEIRA PASTA ABACATE 170ml,BOT,E,2
17787,82798,CBEM COND REST BEIJINHO 250ml,BOT,E,2
17787,82803,CBEM CREM PENT FEIRA AMIDO MILHO 200ml,BOT,E,3
17787,82815,MAKE B DEMAQ BIF MICLR 110ML V3,BOT,C,5
17787,82824,MATCH SHAMP MATIZADOR LOIROS 300ml,BOT,E,7
17787,82825,MATCH COND LOIRO REPARADO 280ml,BOT,C,6
17787,82826,MATCH MASC CAP MATIZ LOIRO REPARADO 250g,BOT,E,0
17787,82827,MATCH SHAMP SCIENCE RECONS 250ml,BOT,C,2
17787,82839,MATCH COND SCIENCE RECONS 250ml,BOT,C,2
17787,82844,MATCH SHAMP LISO PROLONGADO 300ml,BOT,C,4
17787,82845,MATCH COND LISO PROLONGADO 280ml,BOT,C,10
17787,82847,MATCH MASC CAP LISO PROLONGADO 250g,BOT,C,0
17787,82873,MATCH COND SCIENCE CRESC 250ml,BOT,E,2
17787,82874,MATCH TON CAP SCIENCE CRESC 65ml,BOT,E,9
17787,82887,MATCH SHAMP HIDRATACAO E BRLH 300ml,BOT,C,8
17787,82888,MATCH COND HIDRATACAO E BRLH 280ml,BOT,C,1
17787,82890,MATCH SPR BRLH HIDRATACAO E BRLH 100ml,BOT,E,0
17787,82899,MATCH LEAVE IN HIDRATACAO E BRLH 150ML,BOT,C,12
17787,82948,MATCH TON CAP ANTI OLEOSIDADE 100ml,BOT,E,0
17787,82959,FLAC OUI EDP SCAPIN 245 3x1ml,BOT,E,0
17787,82964,FLAC OUI EDP ICONIQUE 001 3x1ml,BOT,E,0
17787,82969,MALBEC SHAMP ANTIQUEDA CLUB 250ml,BOT,E,2
17787,83041,QUASAR DES BDY SPR RUSH 100ml,BOT,E,9
17787,83053,CBEM LOC DES HID CPO CER LIVRE 200ml,BOT,E,0
17787,83059,CELEBRE DES COL FOUG AROM FORC 100ml,BOT,A,42
17787,83060,CELEBRE DES COL FLOR FRUT FORC 100ml,BOT,A,106
17787,83061,CELEBRE LOC DES HID CPO FORC 200ml,BOT,B,13
17787,83065,LIZ DES ANTIT AER 75g,BOT,C,2
17787,83068,LILY EDP LUMIER 30ml,BOT,C,0
17787,83072,NSPA SHAMP ROSE 300ml V2,BOT,E,4
17787,83082,CJ FLAC CELEBRE DES COL FL/FR/FORC 5x1ml,BOT,E,0
17787,83086,CJ FLAC CELEBRE DES COL F/AR FORC 5x1ml,BOT,E,0
17787,83124,REF MATCH MASC CAP NUTR/PROF 250ml,BOT,E,10
17787,83140,REF MATCH COND HID/BRLH 250ml,BOT,C,5
17787,83145,REF MATCH COND LISO PROLONGADO 250ml,BOT,C,0
17787,83147,REF MATCH SHAMP NUTR/PROF 250ml,BOT,E,8
17787,83151,REF MATCH SHAMP LISO PROLONGADO 250ml,BOT,C,3
17787,83156,REF MATCH SHAMP HID/BRLH 250ml,BOT,C,5
17787,83167,REF MATCH COND NUTR/PROF 250ml,BOT,E,9
17787,83188,MALBEC DES COL BLEU 100ml,BOT,E,36
17787,83211,REF CELEBRE DES COL FOUG AROM FORC 100ml,BOT,E,0
17787,83212,REF CELEBRE DES COL FLOR FRUT FORC 100ml,BOT,E,1
17787,83308,NSPA SAB BARRA JASM/SAM 2x90g,BOT,E,0
17787,83356,FLORATTA DES COL SPLSH ROSE 200ml,BOT,B,3
17787,83357,FLORATTA DES COL SPLASH BLUE 200ml,BOT,B,1
17787,83372,GLAMOUR DES COL 30ml,BOT,B,6
17787,83391,ARBO SHW GEL REG 200g,BOT,E,2
17787,83408,REF MAKE B BASE LIQ RETIN H INVISIV 26g,BOT,E,2
17787,83423,REF MAKE B BASE LIQ RETIN H 80 COR25 26g,BOT,E,2
17787,83425,REF MAKE B BASE LIQ RETIN H 80 COR40 26g,BOT,E,2
17787,83426,REF MAKE B BASE LIQ RETIN H COR 50 26g,BOT,E,1
17787,83427,REF MAKE B BASE LIQ RETIN H COR 53 26g,BOT,E,2
17787,83430,REF MAKE B BASE LIQ RETIN H COR 65 26g,BOT,E,2
17787,83431,REF MAKE B BASE LIQ RETIN H 80 COR70 26g,BOT,E,2
17787,83432,REF MAKE B BASE LIQ RETIN H 80 COR75 26g,BOT,E,0
17787,83438,ESTJ LILY LUMIERE PRM,BOT,E,0
17787,83453,NSPA GEL DES HID CPO AMEI 250G,BOT,E,9
17787,83457,NSPA GEL DES HID CPO AMEI/NEG 250g,BOT,E,7
17787,83519,NSPA GEL DES HID CPO ALOE VERA 250g,BOT,E,4
17787,83529,THE BLEND EDP CARDAMOM 100ml,BOT,B,2
17787,83550,BOTIK SRUM ALT/POT RETIN PURO 30ml,BOT,E,8
17787,83551,BOTIK GEL CREM REDUT RUG RETIN PURO 30g,BOT,C,7
17787,83607,MAKE B BAS LIQ PROT HYAL 70 COR 80 30ML,BOT,E,1
17787,83618,QDB SAB LIQ CPO LICH 200ml,QDB,E,0
17787,83637,BOTI BABY COND 400ml,BOT,E,1
17787,83652,CBEM ALCOOL GEL S/FRAG 30g,BOT,E,2
17787,83668,NSPA CR REPAR FAC CENTELLA ASIATICA 75ml,BOT,E,5
17787,83670,NSPA CR FAC MULTIREP INT CENT/ASIAT 30ML,BOT,E,5
17787,83684,DR BOTICA COL POC/AVENTURA 120ml,BOT,B,15
17787,83697,MATCH SHAMP OL CONTROLADA 300ml,BOT,C,1
17787,83699,MATCH COND OL CONTROLADA 280ml,BOT,C,2
17787,83756,COFFEE DES COL WOMAN LUCKY 100ML,BOT,B,14
17787,83757,COFFEE DES COL MAN LUCKY 100ML,BOT,B,0
17787,83766,BOTIK SRUM ALT/POT AC/GLICOL 30ml,BOT,C,1
17787,83768,BOTIK MASC FAC RESET NOT AC/GLICOL 40g,BOT,C,8
17787,83770,BOTIK SOLUC DESINCRUST AC/GLICOL 200ml,BOT,C,1
17787,83800,ZAAD DES COL SPLASH SANTAL 200ml,BOT,E,1
17787,83859,MAKE B LENC DEMAQ SKIN C/20,BOT,E,0
17787,83894,MAKE B HID FAC ACQUA JELLY 50g,BOT,E,0
17787,83903,MALBEC OLEO P/BARBA CLUB 25ml V2,BOT,E,0
17787,83960,ARBO DES ANTIT AER 75ml V9,BOT,B,9
17787,83961,ARBO DES BDY SPR 100ml V6,BOT,B,9
17787,83968,CBEM AROMAT AMB ALIVIO 200ml,BOT,E,0
17787,83971,LILY DES COL LEAU DE 75ml,BOT,B,1
17787,84043,ESTJ EGEO DOLCE REG/21,BOT,E,0
17787,84047,ESTJ EGEO BLUE REG/21,BOT,C,19
17787,84049,ESTJ CBEM OBRIGADA/22,BOT,C,3
17787,84055,MALBEC DES BDY SPR VERT 100ml,BOT,B,14
17787,84056,FLORATTA DES BDY SPR RED 100ml,BOT,E,7
17787,84057,FLORATTA DES BDY SPR F/SECRET 100ML,BOT,E,1
17787,84097,FLORATTA LOC DES HID CPO RED 75ml,BOT,C,14
17787,84113,ESTJ FLORATTA BLUE JUMBO REG/21,BOT,B,0
17787,84117,CBEM ALCOOL GEL NUVEM 30g V3,BOT,E,0
17787,84182,LILY DES COL BDY SPLSH 200ml,BOT,B,22
17787,84183,CJ FLAC LILY DES COL LEAU DE 5x1ml,BOT,E,0
17787,84193,BOTIK CREM MULTIREP CICA PANT/NIAC 30ml,BOT,C,6
17787,84194,CBEM MASC HID P/BUMBUM PESSEGURA 230g,BOT,E,4
17787,84197,MAKE B BAT STCK PREENCH HYAL S/COR 3g,BOT,E,2
17787,84203,CBEM LOC DES HID CPO PESSEGURA 400ml,BOT,E,0
17787,84204,CBEM LOC DES HID CPO PESSEGURA 200ml,BOT,E,0
17787,84206,CBEM CREM ESF CPO PESSEGURA 230g,BOT,E,0
17787,84209,GLAMOUR DES COL GOLD GLAM 75ml,BOT,B,1
17787,84213,EGEO DES COL VAN VIBE 90ml,BOT,B,7
17787,84214,EGEO DES COL SPCY VIBE C/CAR 90ml,BOT,A,339
17787,84223,GLAMOUR DES COL JUST SHINE 75ml V2,BOT,E,10
17787,84224,GLAMOUR DES COL FEVER 75ml V2,BOT,C,4
17787,84225,GLAMOUR DES ANTIT AER SEC BL 75g V6,BOT,C,8
17787,84226,GLAMOUR DES ANTIT AER MYRIAD 75g V3,BOT,E,3
17787,84228,GLAMOUR DES BDY SPR 100ml V6 PCK,BOT,B,3
17787,84229,GLAMOUR OL DES HID CPO SEC BL 150ML V3,BOT,E,2
17787,84230,GLAMOUR LOC DES HID CPO SEC BL 200ml V2,BOT,C,0
17787,84241,REF BOTIK MASC FAC RESET NOT AC/GLIC 40g,BOT,E,3
17787,84243,REF CBEM LOC DES HID CPO PESSEGURA 350ml,BOT,E,3
17787,84255,REF GLAMOUR DES COL 75ml,BOT,C,4
17787,84260,REF GLAMOUR DES COL SEC BL 75ml,BOT,C,12
17787,84305,NSPA OL DES HID CPO GINS/CAF 200ml,BOT,E,0
17787,84307,"MAKE B CORR LIQ FAC FL IL RET H INV 2,5g",BOT,E,2
17787,84313,CBEM SHAMP FEIRA VINAGRE MACA 230ml,BOT,E,7
17787,84314,CBEM COND FEIRA OL/COCO 170ml,BOT,E,8
17787,84321,HER CODE EDP PRM 10ml,BOT,E,14
17787,84326,CJ FLAC HER CODE EDP 5x1ml,BOT,E,0
17787,84385,MALBEC EDP SIGNATURE V3 90ml,BOT,B,10
17787,84387,MALBEC DES COL V6 100ml,BOT,A,112
17787,84388,MALBEC DES COL NOIR V3 100ml,BOT,B,10
17787,84390,MALBEC DES COL MAGNETIC V3 100ml,BOT,A,6
17787,84391,MALBEC DES COL GOLD V3 100ml,BOT,A,30
17787,84392,MALBEC DES COL BLACK V2 100ml,BOT,A,11
17787,84399,MALBEC DES COL FLAME V2 100ml,BOT,B,31
17787,84400,MALBEC DES COL BLEU V2 100ml,BOT,B,43
17787,84452,BOTIK MASC FAC R/NOT AC/GLICOL 10g PRM,BOT,E,42
17787,84487,LINDA LOC DES HID CPO IRRESISTIVEL 200ml,BOT,C,9
17787,8458,MATCH SPR CAP MULTIBENEFICIOS 150ml,BOT,E,0
17787,84602,CJ FLAC SOPHIE NEXT COL DIVER2 MEM 5x1ml,BOT,E,0
17787,84654,MALBEC SAB BARRA 4x80g,BOT,C,0
17787,84677,MALBEC SAB BARRA PURE GOLD 2x80g,BOT,E,2
17787,84682,MALBEC SAB BARRA CUIDADOS 2x80g,BOT,C,9
17787,84690,MALBEC CREM PRE/POS BARBA PURE GOLD 200g,BOT,B,2
17787,84705,REF MALBEC DES COL 100ml,BOT,E,5
17787,84739,MATCH SHAMP NUTR PROFUNDA V2 50ml,BOT,C,19
17787,84741,REF MATCH SHAMP NUTR PROFUNDA V2 250ml,BOT,C,8
17787,84743,REF MATCH MASC CAP NUTR/PROF V2 250ml,BOT,C,10
17787,84744,MATCH MASC CAP NUTRICAO PROFUNDA V2 70g,BOT,E,6
17787,84808,"BOTIK REPAR LAB CIC/PANT/CER 7,5ml",BOT,E,6
17787,84878,"EUD MAKE BAT LIQ DUO CLIN CAN/SBLM 3,5g",EUD,E,0
17787,84879,"EUD MAKE BAT LIQ DUO CLIN MAG/ENIG 3,5g",EUD,E,0
17787,84880,"EUD MAKE BAT LIQ DUO CLIN MASCV/IRR 3,5g",EUD,E,0
17787,84881,"EUD MAKE BAT LIQ DUO CLIN ROSAD/ESS 3,5g",EUD,E,0
17787,84882,"EUD MAKE BAT LIQ DUO CLIN VERM/MAGN 3,5g",EUD,E,0
17787,84888,EUD MAKE BAT LIQ S/M K/M VERM/MAGNIF 5ml,EUD,E,0
17787,84889,EUD MAKE BAT LIQ S/M K/M ROS/FABUL 5ml,EUD,E,0
17787,84890,EUD MAKE BAT LIQ S/M K/M MARROM/ATR 5ml,EUD,E,0
17787,84895,MAKE B PRIMER FAC DROPS OF BEAUTY 30ml,BOT,C,6
17787,84907,"EUD MAKE BAT LIQ TINT K/M VERM/HAP 5,5ml",EUD,E,0
17787,84908,"EUD MAKE BAT LIQ TINT K/M ROSAD/EN 5,5ml",EUD,E,0
17787,84915,"EUD MAKE DELIN LIQ TRB PRET ESSENC 2,5ml",EUD,E,0
17787,84921,"EUD MAKE LAP SOBRANC TURBO CLARO 1,1g",EUD,E,0
17787,84922,"EUD MAKE LAP SOBRANC TURBO MEDIO 1,1g",EUD,E,0
17787,84926,"EUD MAKE LAP RETR P/OLH TURBO PRETO 0,3g",EUD,E,0
17787,84928,"EUD MAKE LAPIS RETR OLH TRB MARROM 0,3g",EUD,E,0
17787,84946,EUD MAKE MASC/CILIO TURBO 10g,EUD,E,0
17787,85006,"EUD MAKE GLOS LAB K/M INCOLOR 5,2ml",EUD,E,0
17787,85051,REF NSPA OL GLOR D H CPO AMEIXA 150ml,BOT,E,0
17787,85052,REF NSPA OL GLOR D H CPO AMEIX/NEG 150ml,BOT,E,0
17787,85058,REF NSPA OL GLOR D H CPO AMEN/QUIN 150ml,BOT,E,0
17787,85067,EGEO DES COL COGU MELLOW 90ml,BOT,E,5
17787,85069,EGEO DES COL COGU MELLOW PRM 10ml,BOT,E,39
17787,85096,NSPA OL GLORIOSO DES HID CPO AMEIX 200ml,BOT,E,15
17787,85097,NSPA OL GLOR DES HID CPO AMEIX/NEG 200ml,BOT,E,15
17787,85098,NSPA OL GLOR DES HID CPO ORQ/NOIRE 200ml,BOT,E,2
17787,85099,NSPA OL GLOR DES HID CPO AMEN/QUIN 200ml,BOT,E,8
17787,8512,BOT BAT BRILHO BOCA 121 PRM,BOT,E,2
17787,85120,CBEM SAB BARRA DELEITE V4 2x80g,BOT,B,35
17787,85122,CBEM DES ANTIT ROLL L/MEL V8 55ml,BOT,C,0
17787,85124,CBEM LOC DES HID CPO DELEITE V3 400ml,BOT,B,9
17787,85125,MATCH COND NUTR/PROF V2 280ml,BOT,B,13
17787,85163,NSPA OLEO/CREME CPO AMEIXA 200g,BOT,C,4
17787,85164,"MAKE B BAT CREM CLR U/BALLET LC WIN 3,6g",BOT,E,7
17787,85268,EUD EDP ROSE V2 75ml,EUD,E,0
17787,85269,DEM THE BLEND EDP BOURBON V2 4ml,BOT,E,0
17787,85275,DEM CASA 214 SPR AROMAT BRIS/CEDROS 4ml,BOT,E,0
17787,85280,DEM CASA 214 SPRAY AROMAT GARD/IMPER 4ml,BOT,E,0
17787,85285,INSTANCE SAB LIQ ESF CPO F/VER V4 180g,EUD,E,0
17787,85288,DEM CASA 214 SPR AROMAT VAN/SUBLIM 4ml,BOT,E,0
17787,85292,ESTJ MALBEC X AMOR/25,BOT,E,3
17787,85293,ESTJ HER CODE AMOR/25,BOT,E,9
17787,85294,ESTJ QUASAR CLASSIC AMOR/25,BOT,E,0
17787,85295,ESTJ CELEBRE AGORA FEMININO AMOR/25,BOT,E,0
17787,85296,ESTJ COFFEE WOMAN SEDUCTION AMOR/25,BOT,E,0
17787,85297,ESTJ CELEBRE AGORA MASCULINO AMOR/25,BOT,E,0
17787,85298,ESTJ LILY LEAU/LILY AMOR/25,BOT,E,0
17787,85299,ESTJ COFFEE MAN DUO AMOR/25,BOT,E,1
17787,85300,ESTJ EGEO DOLCE AMOR/25,BOT,E,0
17787,85301,ESTJ FLORATTA RED AMOR/25,BOT,E,0
17787,85302,ESTJ EGEO ORIGINAL AMOR/25,BOT,E,4
17787,85306,INSTANCE SAB LIQ INT FR/VERM RPCK 180ml,EUD,E,0
17787,85308,INSTANCE SAB BARRA KARITE RPCK 4x80g,EUD,E,0
17787,85311,INSTANC OL BIF D H CPO CER/AM RPCK 200ml,EUD,E,0
17787,85312,INSTANCE SAB BARR CER/AMEND RPCK 4x80g,EUD,E,0
17787,85313,INSTANCE SAB BARR MARACUJA RPCK 4x80g,EUD,E,0
17787,85314,INSTANCE OLEO BIF CPO ROSAS 200ml,EUD,E,0
17787,85315,INSTANCE CR HID MAOS ROSAS 30g,EUD,E,0
17787,85316,INSTANCE CR HID MAOS FR/VERM V2 30g,EUD,E,0
17787,85317,INSTANCE CR HID MAOS KARITE RPCK 30g,EUD,E,0
17787,85318,INSTANCE CR HID MAOS CER/AMEND RPCK 30g,EUD,E,0
17787,85324,CBEM CR HID CPO DEPIL DOC/PESSEGUR 150ml,BOT,B,9
17787,85353,INSTANCE SAB VEGT BARR PERF ROSAS 4x80g,EUD,E,0
17787,85369,INSTANCE SAB BARR FR/VERM RPCK 4x80g,EUD,E,0
17787,85395,INSTANCE SAB BARR AMEIXA/PRALINE 4x80g,EUD,E,0
17787,85396,INSTANCE CR HID MAOS AMEI/PRAL RPCK 30g,EUD,E,0
17787,85440,COFFEE LOC D H CP UNIQ WOM FL/GOUR 200ml,BOT,E,0
17787,85452,NEXT PASTA MODEL CAP 150g,BOT,E,10
17787,85482,FLORATTA DES BDY SPR F/SECRET V2 100ml,BOT,B,51
17787,85483,FLORATTA DES BDY SPRAY RED V2 100ml,BOT,B,7
17787,85491,ESTJ CBEM DELEITE CHOCOLATUDO AMOR/25,BOT,E,0
17787,85493,ESTJ NSPA CEREJA ROUGE AMOR/25,BOT,E,0
17787,85542,REF CBEM LOC DES HID CPO DEL V3 350ml,BOT,B,6
17787,85543,CBEM LOC DES HID CPO DELEITE V3 200ml,BOT,B,15
17787,85547,CBEM SAB BARRA SORTIDO V2 4x80g,BOT,B,42
17787,85548,REF MATCH COND NUTR/PROF V2 250ml,BOT,C,9
17787,85562,ESTJ MALBEC PREMIUM PAIS/25,BOT,E,0
17787,85563,ESTJ THE BLEND PAIS/25,BOT,E,0
17787,85564,CBEM SAB BARRA DELEITE V2 4x80g,BOT,B,6
17787,85566,ESTJ ZAAD PAIS/25,BOT,E,4
17787,85567,ESTJ MALBEC BLACK PAIS/25,BOT,E,3
17787,85568,ESTJ ARBO PAIS/25,BOT,E,2
17787,85569,ESTJ UOMINI PAIS/25,BOT,E,2
17787,85570,ESTJ BOTICOLL PORTINARI PAIS/25,BOT,E,11
17787,85572,ESTJ MALBEC PAIS/25,BOT,E,26
17787,85574,ESTJ CLASH PAIS/25,BOT,E,0
17787,85575,ESTJ QUASAR VISION PAIS/25,BOT,E,3
17787,85576,ESTJ BOTICOLL CONNEXION PAIS/25,BOT,E,0
17787,85577,ESTJ EGEO BOMB BLACK PAIS/25,BOT,E,0
17787,85578,ESTJ CELEBRE FOUG/AROM FORCA PAIS/25,BOT,E,3
17787,85579,ESTJ MALBEC CUIDADOS PAIS/25,BOT,E,6
17787,85584,NSPA OL GLOR DES HID CPO ORQ/LUM 200ml,BOT,E,2
17787,85606,INSENSATEZ DES COL V4 100ml,BOT,B,36
17787,85666,MAKE B PALETTE BLUSH PINK HIT V2 8g,BOT,E,1
17787,85667,MAKE B PALETTE BLUSH CHERRY HIT V2 8g,BOT,C,0
17787,85668,"MAKE B ILUM PO COMP FAC ROSE V2 5,4g",BOT,E,3
17787,85710,ENVELOPE M PAIS 2024,BOT,E,134
17787,85796,ELYSEE CREM DES HID CPO ACET V2 250g,BOT,B,6
17787,85797,REF ELYSEE CR DES HID ACET CPO V2 200g,BOT,B,3
17787,85845,NIINA SKIN GEL LIMPEZA FACIAL V2 300g,EUD,E,0
17787,85846,MAKE B BAS LIQ C/GLYCOL TX 130 V2 30g,BOT,E,2
17787,85847,MAKE B BAS LIQ C/GLYCOL TX 300 V2 30g,BOT,E,2
17787,85848,MAKE B BAS LIQ C/GLYCOL TX 190 V2 30g,BOT,C,4
17787,85849,MAKE B BAS LIQ C/GLYCOL TX 120 V2 30g,BOT,C,1
17787,85850,MAKE B BAS LIQ C/GLYCOL TX 260 V2 30g,BOT,E,2
17787,85851,MAKE B BAS LIQ C/GLYCOL TX 270 V2 30g,BOT,E,0
17787,85852,MAKE B BAS LIQ C/GLYCOL TX 180 V2 30g,BOT,C,5
17787,85853,MAKE B BAS LIQ C/GLYCOL TX 230 V2 30g,BOT,E,4
17787,85854,MAKE B BAS LIQ C/GLYCOL TX 100 V2 30g,BOT,E,2
17787,85855,MAKE B BAS LIQ C/GLYCOL TX 140 V2 30g,BOT,C,3
17787,85856,MAKE B BAS LIQ C/GLYCOL TX 220 V2 30g,BOT,C,0
17787,85857,MAKE B BAS LIQ C/GLYCOL TX 320 V2 30g,BOT,E,0
17787,85858,MAKE B BAS LIQ C/GLYCOL TX 330 V2 30g,BOT,E,1
17787,85864,MAKE B BAS LIQ C/GLYCOL TX 210 V2 30g,BOT,C,6
17787,85915,NIINA SKIN GEL DE LIMPEZA FACIAL V2 100g,EUD,E,0
17787,85916,CBEM LOC DES HID CPO DOC/DELIRIOS 400ml,BOT,E,2
17787,85917,CBEM CR DUO DES HID CP DOC/DELIRIOS 200g,BOT,E,0
17787,85918,CBEM SAB BARR DOCES DELIRIOS 4x80g,BOT,E,32
17787,85919,CBEM MOUS BNH DOC/DELIRIOS 150ml,BOT,E,6
17787,85920,CBEM DES COL BDY SPLSH AMORUDA 200ml,BOT,B,23
17787,85933,MALBEC SPRAY INTIMO PURE GOLD 75ml,BOT,C,8
17787,85935,HER CODE CREM AVELUD DES CPO 250g,BOT,A,14
17787,85936,HER CODE OL MASS CPO TOUCH 150ml,BOT,C,9
17787,85943,"MAKE B BAT SHE MULTIF BTY/NAT CHERR 3,6g",BOT,E,1
17787,85945,"MAKE B BAT SHE MULTIF BTY/NAT GUAVA 3,6g",BOT,E,1
17787,85946,"MAKE B BAT SHE MULTIF BTY/NAT MAUVE 3,6g",BOT,E,1
17787,85947,HER CODE LOC DES HID CPO CLIMAX 200ml,BOT,E,26
17787,85970,PMPCK EGEO DES ANTIT AER BLUE V2,BOT,C,6
17787,86007,CAIXA LACO P NAT/24,BOT,E,10
17787,86008,CAIXA LACO M NAT/24,BOT,E,19
17787,86009,CAIXA LACO G NAT/24,BOT,E,0
17787,86010,ENVELOPE P NAT/24,BOT,E,80
17787,86011,ENVELOPE M NAT/24,BOT,E,0
17787,86019,ESTJ ARBO AMOR/25,BOT,E,10
17787,86024,CBEM CREM HID FAC DOCES DELIRIOS 50g,BOT,E,2
17787,86027,CAIXA DIVERTIDAMENTE M INFANTIL 2024,BOT,E,56
17787,86031,INSTANCE DES ANT ROLL FR/VERM V2 55ml,EUD,E,0
17787,86035,INSTANCE DES ANTIT AER F/VER V2 150ml,EUD,E,0
17787,86037,MATCH SHAMP MATIZ LOIROS V2 300ml,BOT,C,7
17787,86038,INSTANCE DES ANTIT CR CHA VDE/ROM V2 80g,EUD,E,0
17787,86041,INSTANCE DES ANT ROLL CHA VD/ROM V2 55ml,EUD,E,0
17787,86042,INSTANCE DES ANTIT CREM KARITE V2 80g,EUD,E,0
17787,86044,ZAAD LOC DES HID CPO INTENSE 200ml,BOT,E,0
17787,86047,COMB OUI ICONIQUE 2025,BOT,E,0
17787,86079,BOTICOLL DES COL FELICITA 100ml,BOT,E,4
17787,86081,BOTICOLL PORTINARI D/COL MEMORIAS 100ml,BOT,E,0
17787,86092,CBEM D/COL BDY SPLSH FEIR CACH/UVA 200ml,BOT,C,23
17787,86094,CBEM SPR PERF P/CAB FEIR CACH/UVA 100ml,BOT,E,3
17787,86116,CBEM DES COL BDY SPLSH DOC DELIRIO 200ml,BOT,E,1
17787,86154,ESTJ BOTIK ACIDO HIALURONICO V2,BOT,E,3
17787,86166,MAKE B BALM LAB NIGHT MASK LIP/CHRON 9g,BOT,C,3
17787,86167,ESTJ LILY JUMBO REG/25,BOT,B,7
17787,86169,ESTJ MALBEC JUMBO REG/25,BOT,E,11
17787,86170,ESTJ ZAAD NAT/25,BOT,E,4
17787,86171,ESTJ LILY 02 NAT/25,BOT,E,7
17787,86172,ESTJ MALBEC NAT/25,BOT,E,9
17787,86173,ESTJ BOTICA 214 GOLD/GARD NAT/25,BOT,E,4
17787,86175,ESTJ HER CODE TOUCH NAT/25,BOT,E,10
17787,86176,ESTJ FLORATTA RED PASSION NAT/25,BOT,E,5
17787,86177,ESTJ MALBEC GOLD NAT/25,BOT,E,4
17787,86178,ESTJ COFFEE WOMAN SEDUCTION NAT/25,BOT,E,7
17787,86179,ESTJ ARBO NAT/25,BOT,E,2
17787,86180,ESTJ EGEO DOLCE NAT/25,BOT,E,9
17787,86181,ESTJ LILY LEAU/LILY SOLEIL NAT/25,BOT,E,10
17787,86182,ESTJ LILY ACETINADOS NAT/25,BOT,E,8
17787,86183,ESTJ FLORATTA RED 02 NAT/25,BOT,E,10
17787,86184,ESTJ BOTICOLL PORTINARI NAT/25,BOT,E,4
17787,86188,ESTJ QUASAR DEEP BLUE NAT/25,BOT,E,4
17787,86189,ESTJ LIZ NAT/25,BOT,E,11
17787,86190,ESTJ NSPA AMEIXA NEGRA NAT/25,BOT,E,5
17787,86191,ESTJ EGEO BLUE NAT/25,BOT,E,3
17787,86192,ESTJ EGEO CHOC NAT/25,BOT,E,5
17787,86193,ESTJ INSENSATEZ NAT/25,BOT,E,5
17787,86194,ESTJ CBEM DELEITE NAT/25,BOT,E,7
17787,86195,ESTJ CELEBRE AGORA MASC NAT/25,BOT,E,9
17787,86196,ESTJ CELEBRE AGORA FEM NAT/25,BOT,E,10
17787,86197,ESTJ NSPA CER/ROUGE NAT/25,BOT,E,10
17787,86200,ESTJ CBEM PESSEGURA NAT/25,BOT,E,6
17787,86201,ESTJ MALBEC P1 NAT/25,BOT,E,5
17787,86202,ESTJ LILY NAT/25,BOT,E,0
17787,86203,ESTJ FLORATTA RED NAT/25,BOT,E,0
17787,86204,ESTJ CBEM ROSA/ALGODAO NAT/25,BOT,E,5
