PDV,SKU,DESCRIÇÃO,MARCA,CURVA,ESTOQUE_ATUAL
18461,81602,"MAKE B BAT CREM C/AC POLIG REV BRW 3,6g",BOT,C,0
18461,81605,"MAKE B BAT CREM C/AC POL ROSA CASH 3,6g",BOT,C,3
18461,81608,"MAKE B BAT CREM C/AC POL NUD MALVA 3,6g",BOT,E,2
18461,81610,"MAKE B BAT CREM C/AC POL REVOL RED 3,6g",BOT,C,3
18461,81612,"MAKE B BAT CREM C/AC POL SOFT NUD 3,6g",BOT,E,1
18461,81613,"MAKE B BAT CREM C/AC POL WATERMELON 3,6g",BOT,E,2
18461,81614,"MAKE B BAT CREM C/AC POL FASH BERR 3,6g",BOT,E,1
18461,81618,MAKE B BAT MATE C/AC POLIGL RED SUPR 4g,BOT,E,1
18461,81621,MAKE B BAT MATE C/AC POLIG ORANGE FEV 4g,BOT,E,0
18461,81623,MAKE B BAT MATE C/AC POLIGL VIOLET 4g,BOT,E,1
18461,81624,MAKE B BAT MATE C/AC POLIGL HOT BROWN 4g,BOT,C,0
18461,81626,MAKE B BAT MATE C/AC POLIGL ROS FABUL 4g,BOT,E,1
18461,81628,"MAKE B BAT GLOSS C/AC POLIGL NUDE 3,6g",BOT,E,1
18461,81629,"MAKE B BAT GLOSS C/AC POLIGL ROSE 3,6g",BOT,C,1
18461,81631,"MAKE B BAT GLOSS C/AC POLIGL WINE 3,6g",BOT,C,1
18461,81633,MAKE B BASE LIQ RETIN H INVISIVEL 26G,BOT,E,0
18461,81634,MAKE B BASE LIQ RETIN H  15 26g,BOT,E,1
18461,81635,MAKE B BASE LIQ RETIN H COR 20 26g,BOT,E,1
18461,81636,MAKE B BASE LIQ RETIN H COR 25 26g,BOT,E,2
18461,81637,MAKE B BASE LIQ RETIN H COR 30 26g,BOT,E,5
18461,81638,MAKE B BASE LIQ RETIN H COR 40 26G,BOT,E,0
18461,81639,MAKE B BASE LIQ RETIN H COR 50 26g,BOT,E,1
18461,81640,MAKE B BASE LIQ RETIN H COR 53 26g,BOT,E,3
18461,81642,MAKE B BASE LIQ RETIN H COR 60 26g,BOT,E,2
18461,81643,MAKE B BASE LIQ RETIN H COR 65 26g,BOT,E,2
18461,81644,MAKE B BASE LIQ RETIN H COR 70 26g,BOT,E,0
18461,81646,MAKE B BASE LIQ RETIN H COR 80 26g,BOT,E,0
18461,81650,MATCH SHAMP A/RESID OLEOSOS 250ml,BOT,E,1
18461,81754,LINDA DES ANTIT AEROSOL V8 75g,BOT,E,5
18461,81756,LINDA DES COL IRRESISTIVEL 100ml,BOT,B,16
18461,81828,LINDA DES COL IRRESISTIVEL PRM 10ml,BOT,E,54
18461,81849,LINDA DES COL FELICIDADE V2 100ml,BOT,C,25
18461,81884,INTENSE LOC DES HID CPO OOPSS 200ml,BOT,E,1
18461,81885,INTENSE LOC DES HID CPO GLOSS 200ML,BOT,E,1
18461,81917,CJ FLAC LINDA DES COL IRRESISTIVEL 5x1ml,BOT,E,0
18461,81951,"MAKE B BAT LIQ UL/TINT UNLIM TAUP 7,2ml",BOT,E,1
18461,81954,FLORATTA DES COL SIMPLE LOVE 75ml,BOT,B,5
18461,81956,FLORATTA CR DES HID CPO SIMP/LOVE 200ml,BOT,E,3
18461,82033,CBEM LOC DES HID CPO BOA NOITE 400ml,BOT,E,3
18461,82037,CBEM DES COL BDY SPLASH BOA NOITE 200ml,BOT,E,0
18461,82045,NSPA LOC DES CPO A/STRES JAS/SAMB 400ml,BOT,E,2
18461,82046,NSPA LOC DES CPO A/STRES JAS/SAMB 200ml,BOT,B,12
18461,82052,NSPA DES COL BODY SPLASH JAS/SAMB 200ml,BOT,B,11
18461,82053,NSPA SHAMP A/STRES JASMIN SAMBAC 300ml,BOT,E,1
18461,82054,NSPA COND A/STRES JASMIN SAMBAC 300ml,BOT,E,2
18461,82059,OUI EDP SCAPIN 245 75ml,BOT,E,0
18461,82065,"INTENSE LAP BAT ROSA 1,2g",BOT,B,1
18461,82112,DEM MEN DES COL ONLY 4ml V2,BOT,E,0
18461,82113,DEM MEN DES COL GALBE 4ml V2,BOT,E,0
18461,82131,"INTENSE BAT LIQ MAKE/HAP LAR ORIG 5,5ml",BOT,E,1
18461,82238,BOTICOLL DES COL THATY 200ml,BOT,B,11
18461,82239,MAKE B BAS LIQ PROT HYAL 70 INVIS 30ml,BOT,E,0
18461,82246,REF CBEM LOC DES HID CPO BOA NOITE 400ml,BOT,E,1
18461,82250,REF NSPA LOC DES CPO A/STR JAS/SAM 400ml,BOT,E,2
18461,82265,NSPA SAB LIQ CPO ESF A/STR JAS/SAM 175ml,BOT,C,0
18461,82448,MAKE B BAT LIQ RETIN H RED VELVET 11ml,BOT,E,0
18461,82449,MAKE B BAT LIQ RETIN H EASY PINK 11ml,BOT,E,0
18461,82450,MAKE B BAT LIQ RETIN H WINE BLOSSOM 11ml,BOT,E,0
18461,82451,MAKE B BAT LIQ RETIN H SALTED CARAM 11ml,BOT,E,0
18461,82452,MAKE B BAT LIQ RETIN H CINNAMON LOV 11ml,BOT,E,0
18461,82464,MAKE B BASE LIQ RETIN H COR 10 26g,BOT,E,0
18461,82476,BOTICOL PORTINARI DES ANT/A 75g/125ml V7,BOT,E,0
18461,82491,"REF MAKE B BAT CR C/AC POL REV RED 3,6g",BOT,E,0
18461,82493,"REF MAKE B BAT GLOSSY C/AC POL WINE 3,6G",BOT,E,0
18461,82494,"REF MAKE B BAT CR C/AC POL SOFT NUD 3,6g",BOT,E,0
18461,82495,REF MAKE B BAT MATE C/AC POL HOT BROW 4g,BOT,E,0
18461,82528,"MAKE B CORRET LIQ FAC EFFECT 10 5,7ml",BOT,E,1
18461,82531,"MAKE B CORRET LIQ FAC EFFECT 25 5,7ml",BOT,E,1
18461,82532,"MAKE B CORRET LIQ FAC EFFECT 30 5,7ml",BOT,E,3
18461,82533,"MAKE B CORRET LIQ FAC EFFECT 40 5,7ml",BOT,E,5
18461,82534,"MAKE B CORRET LIQ FAC EFFECT 50 5,7ml",BOT,E,2
18461,82535,"MAKE B CORRET LIQ FAC EFFECT 60 5,7ml",BOT,E,0
18461,82536,"MAKE B CORRET LIQ FAC EFFECT 70 5,7ml",BOT,E,0
18461,82537,"MAKE B CORRET LIQ FAC EFFECT 80 5,7ml",BOT,E,0
18461,82540,MAKE B BAS LIQ MATE SALICYLIC 110 30g,BOT,E,0
18461,82541,MAKE B BAS LIQ MATE SALICYLIC 130 30g,BOT,E,1
18461,82542,MAKE B BAS LIQ MATE SALICYLIC 140 30g,BOT,E,1
18461,82543,MAKE B BAS LIQ MATE SALICYLIC 160 30g,BOT,E,2
18461,82544,MAKE B BAS LIQ MATE SALICYLIC 170 30g,BOT,E,2
18461,82545,MAKE B BAS LIQ MATE SALICYLIC 210 30g,BOT,C,1
18461,82546,MAKE B BAS LIQ MATE SALICYLIC 230 30g,BOT,C,2
18461,82547,MAKE B BAS LIQ MATE SALICYLIC 240 30g,BOT,C,1
18461,82548,MAKE B BAS LIQ MATE SALICYLIC 250 30g,BOT,E,1
18461,82549,MAKE B BAS LIQ MATE SALICYLIC 260 30g,BOT,C,1
18461,82550,MAKE B BAS LIQ MATE SALICYLIC 270 30g,BOT,C,0
18461,82551,MAKE B BAS LIQ MATE SALICYLIC 280 30g,BOT,E,2
18461,82552,MAKE B BAS LIQ MATE SALICYLIC 300 30g,BOT,E,0
18461,82553,MAKE B BAS LIQ MATE SALICYLIC 310 30g,BOT,E,4
18461,82585,MATCH SHAMP POS QUIMICA 250ml,BOT,E,1
18461,82586,MATCH COND POS QUIMICA 250ml,BOT,E,2
18461,82605,"MAKE B CORRET LIQ FAC FL IL RET H10 2,5g",BOT,E,0
18461,82608,"MAKE B CORRET LIQ FAC FL IL RET H30 2,5g",BOT,E,0
18461,82609,"MAKE B CORRET LIQ FAC FL IL RET H40 2,5g",BOT,E,0
18461,82612,"MAKE B CORR LIQ FLSH IL FAC RET H60 2,5g",BOT,E,0
18461,82613,"MAKE B CORRET LIQ FAC FL IL RET H70 2,5g",BOT,E,2
18461,82685,EGEO DES COL BOMB BLACK C/CAR 90ml,BOT,A,72
18461,82686,EGEO DES COL BLUE C/CAR 90ml,BOT,B,13
18461,82688,EGEO DES COL DOLCE C/CAR 90ml,BOT,A,11
18461,82689,EGEO DES COL CHOC C/CAR 90ml,BOT,A,9
18461,82690,EGEO DES COL RED C/CART 90ml,BOT,B,15
18461,82700,MATCH SHAMP HIDRATACAO ANTIF 300ml,BOT,C,5
18461,82701,MATCH COND HIDRATACAO ANTIF 280ML,BOT,C,6
18461,82704,MATCH SHAMP NUTR PROF 300ml,BOT,E,12
18461,82705,MATCH COND NUTR PROF 280ml,BOT,E,9
18461,82707,MATCH LEAVE IN NUTR PROF 150ml,BOT,E,8
18461,82708,MATCH MASC CAP NUTR PROF 250g,BOT,E,2
18461,82709,MATCH OL CAP NUTR PROF 50ml,BOT,E,0
18461,82788,CBEM SHAMP HIDRATACAO NUVEM 250ml,BOT,E,1
18461,82789,CBEM SHAMP FEIRA BANANA 230ml,BOT,E,8
18461,82794,CBEM COND HIDRATACAO NUVEM 250ml,BOT,E,2
18461,82795,CBEM COND FEIRA PASTA ABACATE 170ml,BOT,E,17
18461,82798,CBEM COND REST BEIJINHO 250ml,BOT,E,2
18461,82803,CBEM CREM PENT FEIRA AMIDO MILHO 200ml,BOT,E,5
18461,82815,MAKE B DEMAQ BIF MICLR 110ML V3,BOT,E,0
18461,82824,MATCH SHAMP MATIZADOR LOIROS 300ml,BOT,E,10
18461,82825,MATCH COND LOIRO REPARADO 280ml,BOT,C,6
18461,82826,MATCH MASC CAP MATIZ LOIRO REPARADO 250g,BOT,E,3
18461,82827,MATCH SHAMP SCIENCE RECONS 250ml,BOT,E,0
18461,82839,MATCH COND SCIENCE RECONS 250ml,BOT,E,1
18461,82844,MATCH SHAMP LISO PROLONGADO 300ml,BOT,B,3
18461,82845,MATCH COND LISO PROLONGADO 280ml,BOT,C,4
18461,82847,MATCH MASC CAP LISO PROLONGADO 250g,BOT,C,4
18461,82873,MATCH COND SCIENCE CRESC 250ml,BOT,E,6
18461,82874,MATCH TON CAP SCIENCE CRESC 65ml,BOT,E,0
18461,82887,MATCH SHAMP HIDRATACAO E BRLH 300ml,BOT,C,7
18461,82888,MATCH COND HIDRATACAO E BRLH 280ml,BOT,E,12
18461,82890,MATCH SPR BRLH HIDRATACAO E BRLH 100ml,BOT,C,2
18461,82899,MATCH LEAVE IN HIDRATACAO E BRLH 150ML,BOT,E,11
18461,82917,EGEO LOC DES CPO DOLCE COLORS 250g,BOT,E,1
18461,82948,MATCH TON CAP ANTI OLEOSIDADE 100ml,BOT,E,0
18461,82959,FLAC OUI EDP SCAPIN 245 3x1ml,BOT,E,0
18461,82964,FLAC OUI EDP ICONIQUE 001 3x1ml,BOT,E,0
18461,82966,MALBEC ESPUM BARB CLUB 200ml,BOT,E,7
18461,82969,MALBEC SHAMP ANTIQUEDA CLUB 250ml,BOT,E,1
18461,83041,QUASAR DES BDY SPR RUSH 100ml,BOT,E,4
18461,83053,CBEM LOC DES HID CPO CER LIVRE 200ml,BOT,E,0
18461,83059,CELEBRE DES COL FOUG AROM FORC 100ml,BOT,A,65
18461,83060,CELEBRE DES COL FLOR FRUT FORC 100ml,BOT,A,63
18461,83061,CELEBRE LOC DES HID CPO FORC 200ml,BOT,B,6
18461,83065,LIZ DES ANTIT AER 75g,BOT,E,8
18461,83068,LILY EDP LUMIER 30ml,BOT,C,1
18461,83072,NSPA SHAMP ROSE 300ml V2,BOT,E,2
18461,83082,CJ FLAC CELEBRE DES COL FL/FR/FORC 5x1ml,BOT,E,0
18461,83086,CJ FLAC CELEBRE DES COL F/AR FORC 5x1ml,BOT,E,0
18461,83124,REF MATCH MASC CAP NUTR/PROF 250ml,BOT,E,11
18461,83140,REF MATCH COND HID/BRLH 250ml,BOT,E,3
18461,83145,REF MATCH COND LISO PROLONGADO 250ml,BOT,E,5
18461,83147,REF MATCH SHAMP NUTR/PROF 250ml,BOT,E,2
18461,83151,REF MATCH SHAMP LISO PROLONGADO 250ml,BOT,C,6
18461,83156,REF MATCH SHAMP HID/BRLH 250ml,BOT,E,3
18461,83188,MALBEC DES COL BLEU 100ml,BOT,E,3
18461,83196,"MAKE B BAT ST/PREN HYAL RED/CLAS 3,4g V2",BOT,E,1
18461,83211,REF CELEBRE DES COL FOUG AROM FORC 100ml,BOT,B,0
18461,83212,REF CELEBRE DES COL FLOR FRUT FORC 100ml,BOT,B,0
18461,83257,"MAKE B BAT ST/PREN HYAL CANDY TOFEE 3,4g",BOT,E,1
18461,83308,NSPA SAB BARRA JASM/SAM 2x90g,BOT,C,0
18461,83356,FLORATTA DES COL SPLSH ROSE 200ml,BOT,B,8
18461,83357,FLORATTA DES COL SPLASH BLUE 200ml,BOT,C,8
18461,83372,GLAMOUR DES COL 30ml,BOT,C,9
18461,83391,ARBO SHW GEL REG 200g,BOT,E,0
18461,83438,ESTJ LILY LUMIERE PRM,BOT,E,0
18461,83443,REF MATCH MASC CAP POS QUIMICA 250ml,BOT,E,1
18461,83457,NSPA GEL DES HID CPO AMEI/NEG 250g,BOT,E,5
18461,83529,THE BLEND EDP CARDAMOM 100ml,BOT,B,5
18461,83550,BOTIK SRUM ALT/POT RETIN PURO 30ml,BOT,B,7
18461,83551,BOTIK GEL CREM REDUT RUG RETIN PURO 30g,BOT,E,8
18461,83607,MAKE B BAS LIQ PROT HYAL 70 COR 80 30ML,BOT,E,1
18461,83618,QDB SAB LIQ CPO LICH 200ml,QDB,E,0
18461,83637,BOTI BABY COND 400ml,BOT,E,1
18461,83650,CBEM ALCOOL GEL S/FRAG 350g,BOT,E,2
18461,83651,CBEM ALCOOL GEL S/FRAG 100g,BOT,E,1
18461,83652,CBEM ALCOOL GEL S/FRAG 30g,BOT,E,1
18461,83657,MALBEC ALCOOL GEL CLUB 30g,BOT,E,1
18461,83658,NSPA GEL ANTISSEPTICO AMEI 30g,BOT,E,1
18461,83668,NSPA CR REPAR FAC CENTELLA ASIATICA 75ml,BOT,E,1
18461,83669,"NSPA BALM REPAR CALM CENT/ASIAT 6,2g",BOT,E,1
18461,83670,NSPA CR FAC MULTIREP INT CENT/ASIAT 30ML,BOT,E,5
18461,83684,DR BOTICA COL POC/AVENTURA 120ml,BOT,B,14
18461,83697,MATCH SHAMP OL CONTROLADA 300ml,BOT,C,4
18461,83699,MATCH COND OL CONTROLADA 280ml,BOT,C,3
18461,83756,COFFEE DES COL WOMAN LUCKY 100ML,BOT,E,2
18461,83757,COFFEE DES COL MAN LUCKY 100ML,BOT,B,0
18461,83766,BOTIK SRUM ALT/POT AC/GLICOL 30ml,BOT,E,3
18461,83768,BOTIK MASC FAC RESET NOT AC/GLICOL 40g,BOT,E,7
18461,83770,BOTIK SOLUC DESINCRUST AC/GLICOL 200ml,BOT,E,3
18461,83859,MAKE B LENC DEMAQ SKIN C/20,BOT,E,0
18461,83894,MAKE B HID FAC ACQUA JELLY 50g,BOT,E,0
18461,83903,MALBEC OLEO P/BARBA CLUB 25ml V2,BOT,E,0
18461,83960,ARBO DES ANTIT AER 75ml V9,BOT,B,2
18461,83961,ARBO DES BDY SPR 100ml V6,BOT,B,28
18461,83968,CBEM AROMAT AMB ALIVIO 200ml,BOT,E,0
18461,83971,LILY DES COL LEAU DE 75ml,BOT,A,9
18461,84043,ESTJ EGEO DOLCE REG/21,BOT,E,0
18461,84047,ESTJ EGEO BLUE REG/21,BOT,E,0
18461,84049,ESTJ CBEM OBRIGADA/22,BOT,C,3
18461,84055,MALBEC DES BDY SPR VERT 100ml,BOT,B,36
18461,84056,FLORATTA DES BDY SPR RED 100ml,BOT,E,17
18461,84057,FLORATTA DES BDY SPR F/SECRET 100ML,BOT,E,10
18461,84097,FLORATTA LOC DES HID CPO RED 75ml,BOT,C,3
18461,84113,ESTJ FLORATTA BLUE JUMBO REG/21,BOT,E,0
18461,84182,LILY DES COL BDY SPLSH 200ml,BOT,B,0
18461,84193,BOTIK CREM MULTIREP CICA PANT/NIAC 30ml,BOT,C,5
18461,84194,CBEM MASC HID P/BUMBUM PESSEGURA 230g,BOT,E,6
18461,84197,MAKE B BAT STCK PREENCH HYAL S/COR 3g,BOT,E,2
18461,84203,CBEM LOC DES HID CPO PESSEGURA 400ml,BOT,E,5
18461,84204,CBEM LOC DES HID CPO PESSEGURA 200ml,BOT,E,0
18461,84206,CBEM CREM ESF CPO PESSEGURA 230g,BOT,E,0
18461,84209,GLAMOUR DES COL GOLD GLAM 75ml,BOT,B,0
18461,84213,EGEO DES COL VAN VIBE 90ml,BOT,B,7
18461,84214,EGEO DES COL SPCY VIBE C/CAR 90ml,BOT,B,197
18461,84223,GLAMOUR DES COL JUST SHINE 75ml V2,BOT,E,7
18461,84224,GLAMOUR DES COL FEVER 75ml V2,BOT,B,0
18461,84225,GLAMOUR DES ANTIT AER SEC BL 75g V6,BOT,E,11
18461,84226,GLAMOUR DES ANTIT AER MYRIAD 75g V3,BOT,E,7
18461,84228,GLAMOUR DES BDY SPR 100ml V6 PCK,BOT,B,17
18461,84229,GLAMOUR OL DES HID CPO SEC BL 150ML V3,BOT,E,2
18461,84230,GLAMOUR LOC DES HID CPO SEC BL 200ml V2,BOT,C,1
18461,84241,REF BOTIK MASC FAC RESET NOT AC/GLIC 40g,BOT,E,5
18461,84243,REF CBEM LOC DES HID CPO PESSEGURA 350ml,BOT,E,5
18461,84255,REF GLAMOUR DES COL 75ml,BOT,E,3
18461,84260,REF GLAMOUR DES COL SEC BL 75ml,BOT,E,2
18461,84266,BOTICOLL CARPE DIEM DES COL WOM 100ml V2,BOT,E,3
18461,84270,REF GLAMOUR DES BDY SPR 100ml V5 PCK,BOT,E,2
18461,84305,NSPA OL DES HID CPO GINS/CAF 200ml,BOT,E,0
18461,84313,CBEM SHAMP FEIRA VINAGRE MACA 230ml,BOT,E,4
18461,84314,CBEM COND FEIRA OL/COCO 170ml,BOT,E,2
18461,84326,CJ FLAC HER CODE EDP 5x1ml,BOT,E,0
18461,84385,MALBEC EDP SIGNATURE V3 90ml,BOT,B,0
18461,84387,MALBEC DES COL V6 100ml,BOT,A,78
18461,84388,MALBEC DES COL NOIR V3 100ml,BOT,B,25
18461,84390,MALBEC DES COL MAGNETIC V3 100ml,BOT,A,8
18461,84391,MALBEC DES COL GOLD V3 100ml,BOT,A,4
18461,84392,MALBEC DES COL BLACK V2 100ml,BOT,A,7
18461,84399,MALBEC DES COL FLAME V2 100ml,BOT,B,12
18461,84400,MALBEC DES COL BLEU V2 100ml,BOT,B,9
18461,84449,MALBEC COND ANTIQUEDA CLUB 50ml PRM,BOT,E,7
18461,84452,BOTIK MASC FAC R/NOT AC/GLICOL 10g PRM,BOT,E,11
18461,84487,LINDA LOC DES HID CPO IRRESISTIVEL 200ml,BOT,C,3
18461,84488,LINDA LOC DES HID CPO REG 200ML V2,BOT,E,1
18461,8458,MATCH SPR CAP MULTIBENEFICIOS 150ml,BOT,E,0
18461,84602,CJ FLAC SOPHIE NEXT COL DIVER2 MEM 5x1ml,BOT,E,0
18461,84654,MALBEC SAB BARRA 4x80g,BOT,C,2
18461,84677,MALBEC SAB BARRA PURE GOLD 2x80g,BOT,E,4
18461,84682,MALBEC SAB BARRA CUIDADOS 2x80g,BOT,C,12
18461,84690,MALBEC CREM PRE/POS BARBA PURE GOLD 200g,BOT,C,0
18461,84705,REF MALBEC DES COL 100ml,BOT,E,4
18461,84739,MATCH SHAMP NUTR PROFUNDA V2 50ml,BOT,C,5
18461,84741,REF MATCH SHAMP NUTR PROFUNDA V2 250ml,BOT,C,2
18461,84743,REF MATCH MASC CAP NUTR/PROF V2 250ml,BOT,C,11
18461,84744,MATCH MASC CAP NUTRICAO PROFUNDA V2 70g,BOT,E,3
18461,84808,"BOTIK REPAR LAB CIC/PANT/CER 7,5ml",BOT,C,6
18461,84878,"EUD MAKE BAT LIQ DUO CLIN CAN/SBLM 3,5g",EUD,E,0
18461,84879,"EUD MAKE BAT LIQ DUO CLIN MAG/ENIG 3,5g",EUD,E,0
18461,84880,"EUD MAKE BAT LIQ DUO CLIN MASCV/IRR 3,5g",EUD,E,0
18461,84881,"EUD MAKE BAT LIQ DUO CLIN ROSAD/ESS 3,5g",EUD,E,0
18461,84882,"EUD MAKE BAT LIQ DUO CLIN VERM/MAGN 3,5g",EUD,E,0
18461,84888,EUD MAKE BAT LIQ S/M K/M VERM/MAGNIF 5ml,EUD,E,0
18461,84889,EUD MAKE BAT LIQ S/M K/M ROS/FABUL 5ml,EUD,E,0
18461,84890,EUD MAKE BAT LIQ S/M K/M MARROM/ATR 5ml,EUD,E,0
18461,84895,MAKE B PRIMER FAC DROPS OF BEAUTY 30ml,BOT,C,1
18461,84907,"EUD MAKE BAT LIQ TINT K/M VERM/HAP 5,5ml",EUD,E,0
18461,84908,"EUD MAKE BAT LIQ TINT K/M ROSAD/EN 5,5ml",EUD,E,0
18461,84915,"EUD MAKE DELIN LIQ TRB PRET ESSENC 2,5ml",EUD,E,0
18461,84921,"EUD MAKE LAP SOBRANC TURBO CLARO 1,1g",EUD,E,0
18461,84922,"EUD MAKE LAP SOBRANC TURBO MEDIO 1,1g",EUD,E,0
18461,84926,"EUD MAKE LAP RETR P/OLH TURBO PRETO 0,3g",EUD,E,0
18461,84928,"EUD MAKE LAPIS RETR OLH TRB MARROM 0,3g",EUD,E,0
18461,84946,EUD MAKE MASC/CILIO TURBO 10g,EUD,E,0
18461,85006,"EUD MAKE GLOS LAB K/M INCOLOR 5,2ml",EUD,E,0
18461,85051,REF NSPA OL GLOR D H CPO AMEIXA 150ml,BOT,E,0
18461,85052,REF NSPA OL GLOR D H CPO AMEIX/NEG 150ml,BOT,E,0
18461,85058,REF NSPA OL GLOR D H CPO AMEN/QUIN 150ml,BOT,E,0
18461,85067,EGEO DES COL COGU MELLOW 90ml,BOT,E,7
18461,85069,EGEO DES COL COGU MELLOW PRM 10ml,BOT,E,15
18461,85096,NSPA OL GLORIOSO DES HID CPO AMEIX 200ml,BOT,E,0
18461,85097,NSPA OL GLOR DES HID CPO AMEIX/NEG 200ml,BOT,E,0
18461,85098,NSPA OL GLOR DES HID CPO ORQ/NOIRE 200ml,BOT,E,0
18461,85099,NSPA OL GLOR DES HID CPO AMEN/QUIN 200ml,BOT,E,0
18461,85120,CBEM SAB BARRA DELEITE V4 2x80g,BOT,C,23
18461,85122,CBEM DES ANTIT ROLL L/MEL V8 55ml,BOT,E,2
18461,85124,CBEM LOC DES HID CPO DELEITE V3 400ml,BOT,B,12
18461,85125,MATCH COND NUTR/PROF V2 280ml,BOT,C,9
18461,85163,NSPA OLEO/CREME CPO AMEIXA 200g,BOT,C,4
18461,85164,"MAKE B BAT CREM CLR U/BALLET LC WIN 3,6g",BOT,C,0
18461,85268,EUD EDP ROSE V2 75ml,EUD,E,0
18461,85285,INSTANCE SAB LIQ ESF CPO F/VER V4 180g,EUD,E,0
18461,85292,ESTJ MALBEC X AMOR/25,BOT,E,0
18461,85293,ESTJ HER CODE AMOR/25,BOT,E,1
18461,85294,ESTJ QUASAR CLASSIC AMOR/25,BOT,E,1
18461,85295,ESTJ CELEBRE AGORA FEMININO AMOR/25,BOT,E,2
18461,85296,ESTJ COFFEE WOMAN SEDUCTION AMOR/25,BOT,E,1
18461,85297,ESTJ CELEBRE AGORA MASCULINO AMOR/25,BOT,E,0
18461,85298,ESTJ LILY LEAU/LILY AMOR/25,BOT,E,8
18461,85299,ESTJ COFFEE MAN DUO AMOR/25,BOT,E,4
18461,85300,ESTJ EGEO DOLCE AMOR/25,BOT,E,4
18461,85301,ESTJ FLORATTA RED AMOR/25,BOT,E,0
18461,85302,ESTJ EGEO ORIGINAL AMOR/25,BOT,E,1
18461,85306,INSTANCE SAB LIQ INT FR/VERM RPCK 180ml,EUD,E,0
18461,85308,INSTANCE SAB BARRA KARITE RPCK 4x80g,EUD,E,0
18461,85311,INSTANC OL BIF D H CPO CER/AM RPCK 200ml,EUD,E,0
18461,85312,INSTANCE SAB BARR CER/AMEND RPCK 4x80g,EUD,E,0
18461,85313,INSTANCE SAB BARR MARACUJA RPCK 4x80g,EUD,E,0
18461,85314,INSTANCE OLEO BIF CPO ROSAS 200ml,EUD,E,0
18461,85315,INSTANCE CR HID MAOS ROSAS 30g,EUD,E,0
18461,85316,INSTANCE CR HID MAOS FR/VERM V2 30g,EUD,E,0
18461,85317,INSTANCE CR HID MAOS KARITE RPCK 30g,EUD,E,0
18461,85318,INSTANCE CR HID MAOS CER/AMEND RPCK 30g,EUD,E,0
18461,85324,CBEM CR HID CPO DEPIL DOC/PESSEGUR 150ml,BOT,C,1
18461,85353,INSTANCE SAB VEGT BARR PERF ROSAS 4x80g,EUD,E,0
18461,85369,INSTANCE SAB BARR FR/VERM RPCK 4x80g,EUD,E,0
18461,85395,INSTANCE SAB BARR AMEIXA/PRALINE 4x80g,EUD,E,0
18461,85396,INSTANCE CR HID MAOS AMEI/PRAL RPCK 30g,EUD,E,0
18461,85440,COFFEE LOC D H CP UNIQ WOM FL/GOUR 200ml,BOT,E,0
18461,85452,NEXT PASTA MODEL CAP 150g,BOT,E,1
18461,85482,FLORATTA DES BDY SPR F/SECRET V2 100ml,BOT,B,10
18461,85483,FLORATTA DES BDY SPRAY RED V2 100ml,BOT,B,17
18461,85491,ESTJ CBEM DELEITE CHOCOLATUDO AMOR/25,BOT,E,3
18461,85493,ESTJ NSPA CEREJA ROUGE AMOR/25,BOT,E,3
18461,85542,REF CBEM LOC DES HID CPO DEL V3 350ml,BOT,B,15
18461,85543,CBEM LOC DES HID CPO DELEITE V3 200ml,BOT,B,5
18461,85547,CBEM SAB BARRA SORTIDO V2 4x80g,BOT,B,32
18461,85548,REF MATCH COND NUTR/PROF V2 250ml,BOT,C,5
18461,85562,ESTJ MALBEC PREMIUM PAIS/25,BOT,E,0
18461,85563,ESTJ THE BLEND PAIS/25,BOT,E,0
18461,85564,CBEM SAB BARRA DELEITE V2 4x80g,BOT,B,34
18461,85566,ESTJ ZAAD PAIS/25,BOT,E,6
18461,85567,ESTJ MALBEC BLACK PAIS/25,BOT,E,6
18461,85568,ESTJ ARBO PAIS/25,BOT,E,0
18461,85569,ESTJ UOMINI PAIS/25,BOT,E,3
18461,85570,ESTJ BOTICOLL PORTINARI PAIS/25,BOT,E,5
18461,85572,ESTJ MALBEC PAIS/25,BOT,E,16
18461,85574,ESTJ CLASH PAIS/25,BOT,E,2
18461,85575,ESTJ QUASAR VISION PAIS/25,BOT,E,0
18461,85576,ESTJ BOTICOLL CONNEXION PAIS/25,BOT,E,2
18461,85577,ESTJ EGEO BOMB BLACK PAIS/25,BOT,E,0
18461,85578,ESTJ CELEBRE FOUG/AROM FORCA PAIS/25,BOT,E,10
18461,85579,ESTJ MALBEC CUIDADOS PAIS/25,BOT,E,12
18461,85584,NSPA OL GLOR DES HID CPO ORQ/LUM 200ml,BOT,E,5
18461,85606,INSENSATEZ DES COL V4 100ml,BOT,B,15
18461,85666,MAKE B PALETTE BLUSH PINK HIT V2 8g,BOT,B,0
18461,85667,MAKE B PALETTE BLUSH CHERRY HIT V2 8g,BOT,C,1
18461,85668,"MAKE B ILUM PO COMP FAC ROSE V2 5,4g",BOT,E,1
18461,85710,ENVELOPE M PAIS 2024,BOT,E,115
18461,85796,ELYSEE CREM DES HID CPO ACET V2 250g,BOT,B,0
18461,85797,REF ELYSEE CR DES HID ACET CPO V2 200g,BOT,B,18
18461,85845,NIINA SKIN GEL LIMPEZA FACIAL V2 300g,EUD,E,0
18461,85846,MAKE B BAS LIQ C/GLYCOL TX 130 V2 30g,BOT,E,2
18461,85847,MAKE B BAS LIQ C/GLYCOL TX 300 V2 30g,BOT,E,1
18461,85848,MAKE B BAS LIQ C/GLYCOL TX 190 V2 30g,BOT,C,2
18461,85849,MAKE B BAS LIQ C/GLYCOL TX 120 V2 30g,BOT,C,0
18461,85850,MAKE B BAS LIQ C/GLYCOL TX 260 V2 30g,BOT,E,2
18461,85851,MAKE B BAS LIQ C/GLYCOL TX 270 V2 30g,BOT,E,4
18461,85852,MAKE B BAS LIQ C/GLYCOL TX 180 V2 30g,BOT,E,1
18461,85853,MAKE B BAS LIQ C/GLYCOL TX 230 V2 30g,BOT,C,3
18461,85854,MAKE B BAS LIQ C/GLYCOL TX 100 V2 30g,BOT,E,3
18461,85855,MAKE B BAS LIQ C/GLYCOL TX 140 V2 30g,BOT,E,4
18461,85856,MAKE B BAS LIQ C/GLYCOL TX 220 V2 30g,BOT,C,2
18461,85857,MAKE B BAS LIQ C/GLYCOL TX 320 V2 30g,BOT,E,2
18461,85858,MAKE B BAS LIQ C/GLYCOL TX 330 V2 30g,BOT,E,0
18461,85864,MAKE B BAS LIQ C/GLYCOL TX 210 V2 30g,BOT,E,5
18461,85915,NIINA SKIN GEL DE LIMPEZA FACIAL V2 100g,EUD,E,0
18461,85916,CBEM LOC DES HID CPO DOC/DELIRIOS 400ml,BOT,E,4
18461,85917,CBEM CR DUO DES HID CP DOC/DELIRIOS 200g,BOT,E,0
18461,85918,CBEM SAB BARR DOCES DELIRIOS 4x80g,BOT,E,1
18461,85919,CBEM MOUS BNH DOC/DELIRIOS 150ml,BOT,E,6
18461,85920,CBEM DES COL BDY SPLSH AMORUDA 200ml,BOT,B,12
18461,85933,MALBEC SPRAY INTIMO PURE GOLD 75ml,BOT,E,8
18461,85935,HER CODE CREM AVELUD DES CPO 250g,BOT,B,2
18461,85936,HER CODE OL MASS CPO TOUCH 150ml,BOT,B,9
18461,85943,"MAKE B BAT SHE MULTIF BTY/NAT CHERR 3,6g",BOT,E,1
18461,85945,"MAKE B BAT SHE MULTIF BTY/NAT GUAVA 3,6g",BOT,E,1
18461,85946,"MAKE B BAT SHE MULTIF BTY/NAT MAUVE 3,6g",BOT,E,1
18461,85947,HER CODE LOC DES HID CPO CLIMAX 200ml,BOT,E,12
18461,85970,PMPCK EGEO DES ANTIT AER BLUE V2,BOT,C,1
18461,86008,CAIXA LACO M NAT/24,BOT,E,83
18461,86010,ENVELOPE P NAT/24,BOT,E,100
18461,86011,ENVELOPE M NAT/24,BOT,E,131
18461,86019,ESTJ ARBO AMOR/25,BOT,E,0
18461,86024,CBEM CREM HID FAC DOCES DELIRIOS 50g,BOT,E,2
18461,86031,INSTANCE DES ANT ROLL FR/VERM V2 55ml,EUD,E,0
18461,86035,INSTANCE DES ANTIT AER F/VER V2 150ml,EUD,E,0
18461,86037,MATCH SHAMP MATIZ LOIROS V2 300ml,BOT,C,10
18461,86038,INSTANCE DES ANTIT CR CHA VDE/ROM V2 80g,EUD,E,0
18461,86041,INSTANCE DES ANT ROLL CHA VD/ROM V2 55ml,EUD,E,0
18461,86042,INSTANCE DES ANTIT CREM KARITE V2 80g,EUD,E,0
18461,86044,ZAAD LOC DES HID CPO INTENSE 200ml,BOT,E,0
18461,86079,BOTICOLL DES COL FELICITA 100ml,BOT,E,4
18461,86081,BOTICOLL PORTINARI D/COL MEMORIAS 100ml,BOT,E,4
18461,86092,CBEM D/COL BDY SPLSH FEIR CACH/UVA 200ml,BOT,C,31
18461,86094,CBEM SPR PERF P/CAB FEIR CACH/UVA 100ml,BOT,E,2
18461,86116,CBEM DES COL BDY SPLSH DOC DELIRIO 200ml,BOT,E,1
18461,86154,ESTJ BOTIK ACIDO HIALURONICO V2,BOT,C,1
18461,86166,MAKE B BALM LAB NIGHT MASK LIP/CHRON 9g,BOT,E,1
18461,86167,ESTJ LILY JUMBO REG/25,BOT,B,0
18461,86169,ESTJ MALBEC JUMBO REG/25,BOT,E,7
18461,86170,ESTJ ZAAD NAT/25,BOT,E,4
18461,86171,ESTJ LILY 02 NAT/25,BOT,E,7
18461,86172,ESTJ MALBEC NAT/25,BOT,E,9
18461,86173,ESTJ BOTICA 214 GOLD/GARD NAT/25,BOT,E,4
18461,86175,ESTJ HER CODE TOUCH NAT/25,BOT,E,0
18461,86176,ESTJ FLORATTA RED PASSION NAT/25,BOT,E,6
18461,86177,ESTJ MALBEC GOLD NAT/25,BOT,E,4
18461,86178,ESTJ COFFEE WOMAN SEDUCTION NAT/25,BOT,E,7
18461,86179,ESTJ ARBO NAT/25,BOT,E,3
18461,86180,ESTJ EGEO DOLCE NAT/25,BOT,E,6
18461,86181,ESTJ LILY LEAU/LILY SOLEIL NAT/25,BOT,E,0
18461,86182,ESTJ LILY ACETINADOS NAT/25,BOT,E,4
18461,86183,ESTJ FLORATTA RED 02 NAT/25,BOT,E,7
18461,86184,ESTJ BOTICOLL PORTINARI NAT/25,BOT,E,5
18461,86188,ESTJ QUASAR DEEP BLUE NAT/25,BOT,E,0
18461,86189,ESTJ LIZ NAT/25,BOT,E,5
18461,86190,ESTJ NSPA AMEIXA NEGRA NAT/25,BOT,E,0
18461,86191,ESTJ EGEO BLUE NAT/25,BOT,E,4
18461,86192,ESTJ EGEO CHOC NAT/25,BOT,E,5
18461,86193,ESTJ INSENSATEZ NAT/25,BOT,E,5
18461,86194,ESTJ CBEM DELEITE NAT/25,BOT,E,0
18461,86195,ESTJ CELEBRE AGORA MASC NAT/25,BOT,E,5
18461,86196,ESTJ CELEBRE AGORA FEM NAT/25,BOT,E,10
18461,86197,ESTJ NSPA CER/ROUGE NAT/25,BOT,E,5
18461,86200,ESTJ CBEM PESSEGURA NAT/25,BOT,E,1
18461,86201,ESTJ MALBEC P1 NAT/25,BOT,E,12
18461,86202,ESTJ LILY NAT/25,BOT,E,0
18461,86203,ESTJ FLORATTA RED NAT/25,BOT,E,4
18461,86204,ESTJ CBEM ROSA/ALGODAO NAT/25,BOT,E,6
18461,86206,ESTJ HER CODE REG/25,BOT,E,1
18461,86295,MATCH MASC CAP SCIENCE RECONS V3 250g,BOT,E,5
18461,86297,ESTJ SOPHIE SPIDER GWEN CRIANC/25,BOT,E,2
18461,86339,"MAKE B BAT CREM U/BALLET LAC/BALLET 3,6g",BOT,E,5
18461,86340,"MAKE B BAT BAL CREM U/B LACE RED 3,6g",BOT,E,2
18461,86369,NSPA DES COL BDY SPLSH ORQ/LUMIERE 200ml,BOT,E,12
18461,86431,ESTJ ZAAD REG/25,BOT,E,3
18461,86432,ESTJ EGEO DOLCE REG/25,BOT,E,5
18461,86465,ESTJ CBEM DELEITE REG/25,BOT,E,0
18461,86538,EUD MAKE MASC/CILIO TURBO VOLUMACO 10g,EUD,E,0
18461,86555,"EUD MAKE GLOS LAB K/M ROS/HOLOFOTE 5,2ml",EUD,E,0
18461,86605,"EUD MAKE BAT LIQ TINT K/M UVA/REL 5,5ml",EUD,E,0
18461,86611,"EUD MAKE GLOS LAB K/M PESS/FLASH 5,2ml",EUD,E,0
18461,86666,MATCH BOOSTER CAP REC CIEN/CURV V2 90ml,BOT,C,4
18461,86667,MATCH LEAV IN CAP LEVE CIEN/CUR V2 250ml,BOT,C,6
18461,86669,REF MATCH CR PENT CRES CIEN/CUR V2 400ml,BOT,E,0
18461,86670,MATCH CR P/PENT CRESP CIEN/CURV V2 450ml,BOT,C,8
18461,86749,EUD CREM DES HID CPO ROUGE V3 250g,EUD,E,0
18461,86750,EUD CREM DES HID CPO GOLDEN V2 250g,EUD,E,0
18461,86751,EUD CREM DES HID CPO ROSE V2 250g,EUD,E,0
18461,86752,MALBEC SHW GEL CPO BLACK V2 200g,BOT,E,2
18461,86754,REF NSPA SAB LIQ PERF ORQ/NOIRE V2 200ml,BOT,B,7
18461,86756,NSPA SAB LIQ PERF QUINOA V2 250ml,BOT,C,8
18461,86758,REF NSPA SAB LIQ CPO AMEI/NEGRA V2 200ml,BOT,B,13
18461,86759,REF NSPA SAB LIQ PERF AMEIXA V2 200ml,BOT,C,6
18461,86765,NSPA LOC DES HID CP FIRM QUINOA V3 400ml,BOT,B,9
18461,86804,NIINA SKIN CREM SORB FACIAL FIRM V2 80g,EUD,E,0
18461,86825,PMPCK MALBEC CLUB/DR JONES BARB S/IRRIT,BOT,E,1
18461,86865,BOTI SUN PROT SOL CPO GEL CR FPS70 120g,BOT,E,3
18461,86866,BOTI SUN PROT SOL CPO GEL CR FPS50 120g,BOT,E,3
18461,86868,CLASH CR PRE E POS BARBA 150g,BOT,C,9
18461,86869,CLASH LOC DES HID CPO 200ml,BOT,B,7
18461,86870,CLASH SAB BARR 2x80g,BOT,B,27
18461,86895,LILY DES COL LEAU/LILY BLANCHE 75ml,BOT,A,14
18461,86897,LILY DES COL LEAU/LILY BLANCHE PRM 10ml,BOT,E,80
18461,86908,CAIXA LACO M NAMORADOS/24,BOT,E,20
18461,86948,NEXT SAB TEIA SPIDER MAN 90g,BOT,E,2
18461,86949,NEXT COL SPIDER MAN 75ml,BOT,E,1
18461,86950,NEXT GEL FIX P/CAB SPIDER MAN 150g,BOT,E,0
18461,86951,SOPHIE COL SPIDER GWEN 100ml,BOT,E,4
18461,86952,SOPHIE JELLY CREAM CPO SPID/GWEN 150g,BOT,E,8
18461,86954,SOPHIE PLT MULTIF HYDR/LIN SPID/GWEN 17g,BOT,E,3
18461,86969,MALBEC DES ANTIT AER PURE GOLD 75g/125ml,BOT,C,1
18461,86982,EGEO DES COL MELANCIA 90ml,BOT,E,0
18461,86983,HER CODE EDP CLIMAX 50ml,BOT,E,3
18461,86985,HER CODE EDP CLIMAX PRM 10ml,BOT,E,102
18461,86987,FLORATTA CR DES HID CPO RED PASSION 250g,BOT,E,0
18461,86988,LIZ CREM DES HID CPO AURA 250g,BOT,B,13
18461,86990,LIZ DES COL AURA 100ml,BOT,A,27
18461,86994,CJ FLAC LIZ DES COL AURA 5x1ml,BOT,E,20
18461,87000,LIZ DES COL AURA PRM 10ml,BOT,E,22
18461,87013,EUD EDP V5 75ml,EUD,E,0
18461,87014,EUD EDP ROUGE V3 75ml,EUD,E,0
