PDV,SKU,DESCRIÇÃO,MARCA,CURVA,ESTOQUE_ATUAL
18461,1004,FLORATTA DES COL MY BLUE 75ml,BOT,E,20
18461,1078,MATCH SRUM CAP POS QUIMICA 50ml,BOT,E,1
18461,11914,MYRIAD SAB LIQ 250ml,BOT,E,1
18461,12084,ESTJ EGEO DOLCE NAM/22,BOT,E,0
18461,1296,PMPCK THE BLEND DES ANTIT AER 2x75g,BOT,B,0
18461,12961,EUD CR DES HID CPO INDUL 250g,EUD,E,0
18461,12965,EUD CR DES HID CPO RGE 250g V2,EUD,E,0
18461,12967,LA VICT CR ACET DES HID CPO 250g V2,EUD,E,0
18461,1302,PMPCK LILY DES ANTIT AER 2X75G,BOT,B,4
18461,1314,PMPCK ZAAD DES ANTIT AER 2X75G,BOT,B,0
18461,1317,PMPCK MALBEC DES ANTIT AER 2x75g,BOT,B,1
18461,1428,NSPA LOC ANTIOX DES HID CPO M/RUBY 400ml,BOT,B,0
18461,1630,NSPA DES COL BDY SPLSH M/RUBY 200ml,BOT,E,14
18461,1634,NSPA GEL ESF CPO MORANGO RUBY 175G,BOT,B,5
18461,1640,NSPA LOC ANTIOX DES HID CPO M/RUBY 200ml,BOT,C,5
18461,1650,REF NSPA LOC ANTIOX D H CPO M/RUBY 350ml,BOT,C,0
18461,1676,NSPA OL MULTIF AMEIXA 85ml,BOT,E,0
18461,1680,NSPA OL MULTIF AMEIXA NEGRA 85ml,BOT,E,3
18461,1685,NSPA OL MULTIF ROSE 85ml,BOT,E,3
18461,1697,NSPA OL MULTIF QUINOA 85ml,BOT,B,0
18461,1786,MAKE B BAS LIQ MATE SALICYLIC 150 30g,BOT,C,1
18461,1787,MAKE B BAS LIQ MATE SALICYLIC 120 30g,BOT,E,2
18461,1788,MAKE B BAS LIQ MATE SALICYLIC 100 30g,BOT,E,2
18461,1789,MAKE B BAS LIQ MATE SALICYLIC 220 30g,BOT,B,0
18461,1790,MAKE B BAS LIQ MATE SALICYLIC 190 30g,BOT,C,0
18461,1806,MAKE B BAS LIQ MATE SALICYLIC 180 30g,BOT,C,0
18461,1808,MAKE B BAS LIQ MATE SALICYLIC 200 30g,BOT,C,1
18461,1861,MAKE B BAS LIQ MATE SALICYLIC 320 30g,BOT,E,1
18461,1862,MAKE B BAS LIQ MATE SALICYLIC 290 30g,BOT,E,0
18461,1863,MAKE B BAS LIQ MATE SALICYLIC 330 30g,BOT,E,1
18461,19685,ELYSEE EDP 50ml,BOT,E,0
18461,19734,THATY DES COL BOTICOLL 100ML,BOT,B,31
18461,19814,EUD CR DES HID CPO DLX 250g V4,EUD,E,0
18461,19815,SOUL MASC CILIO VOL BOMB 10g,EUD,E,0
18461,2094,"INTENSE BAT CREM POP BEGE AMEND 3,6g",BOT,C,10
18461,2100,"INTENSE BAT CREM POP ROSA 3,6g",BOT,B,6
18461,2150,"INTENSE BAT CREM POP MAGENTA 3,6g",BOT,C,8
18461,2186,"INTENSE BAT MATE POP BEGE CAST 4,0g",BOT,C,7
18461,2192,INTENSE BAT MAT INTENSE POP VERM 4g,BOT,C,5
18461,2215,INTENSE BAT MAT INTENSE POP ROS/TELH 4g,BOT,B,8
18461,22248,CECITA DES COL BOTICOLL 100ML,BOT,E,0
18461,22249,FREE DES COL BOTICOLL 100ml V4,BOT,A,15
18461,2239,INTENSE BAS LIQ MATE CAMUFL POP 100 20ml,BOT,E,3
18461,2240,INTENSE BAS LIQ MATE CAMUFL POP 120 20ml,BOT,E,5
18461,2252,INTENSE BAS LIQ MATE CAMUFL POP 140 20ml,BOT,E,5
18461,2256,INTENSE BAS LIQ MATE CAMUFL POP 160 20ml,BOT,E,3
18461,2257,INTENSE BAS LIQ MATE CAMUFL POP 190 20ml,BOT,E,3
18461,2258,INTENSE BAS LIQ MATE CAMUFL POP 210 20ml,BOT,C,3
18461,2259,INTENSE BAS LIQ MATE CAMUFL POP 230 20ml,BOT,E,3
18461,2260,INTENSE BAS LIQ MATE CAMUFL POP 240 20ml,BOT,E,3
18461,2274,INTENSE BAS LIQ MATE CAMUFL POP 260 20ml,BOT,E,0
18461,2276,INTENSE BAS LIQ MATE CAMUFL POP 300 20ml,BOT,E,3
18461,2285,INTENSE BAS LIQ MATE CAMUFL POP 320 20ml,BOT,E,4
18461,2286,INTENSE BAS LIQ MATE CAMUFL POP 330 20ml,BOT,E,4
18461,23743,DEM FLAC ELYSEE EDP 4ml VE,BOT,E,0
18461,2483,"INTENSE LAP P/OLHO POP PRETO 1,1g",BOT,C,1
18461,2501,MALBEC CAR PRES CLUB,BOT,E,0
18461,25424,PORTINARI DESODORANTE B SPR 100ml PK V4,BOT,E,1
18461,25431,AMOST MAKE B BASE LIQ CL AD BG CL 2 C/5,BOT,E,1
18461,25458,FLORATTA DES COL BLUE 75ml,BOT,E,56
18461,25475,FLORATTA DES COL GOLD 75ml,BOT,E,1
18461,25682,MAKE B NUTRIDETOX C NOTURNO SKIN 2x15g,BOT,E,1
18461,25804,INTENSE DES COL GLOSS 50ML,BOT,E,1
18461,26401,MAKE B PRIMER OLH V2,BOT,E,5
18461,27707,BOTICOLL CONNEXION DES COL 100ml V2,BOT,A,46
18461,27858,MAKE B LAP RETR P/OLH PRET PCK,BOT,B,0
18461,27861,MAKE B LAP P/OLH GEL ULTRABLACK,BOT,E,1
18461,27993,MAKE B MASC CILIO VOL EXTREMO,BOT,E,2
18461,28813,ACCORDES DES COL 80ml V4,BOT,E,2
18461,29046,BOTICOLL CONNEX DES BDY SPR 100ml V6 PCK,BOT,C,23
18461,29226,ELYSEE CREM HID DES CPO ACETINADO 250g,BOT,E,0
18461,30192,MALBEC DES COL X 100ml,BOT,E,18
18461,30201,MALBEC DES COL X 10ml PRM,BOT,E,0
18461,30247,EGEO DES COL PINA BLAST 90ml,BOT,C,4
18461,30302,SIAGE COND HIDRATACAO MICELAR V2 200ml,EUD,E,0
18461,30314,ZAAD SHW GEL CAB/CPO 200g,BOT,E,1
18461,30363,EGEO DES COL CHERRY BLAST 90ml,BOT,A,2
18461,33359,SACOLA P INST/21 VERDE STD MOD C/200,BOT,E,3
18461,33363,SACOLA M INST/21 VERDE STD MOD C/200,BOT,E,3
18461,33366,SACOLA G INST/21 VERDE STD MOD C/100,BOT,E,2
18461,33406,KIT CAIXA P INST/21 ROSA C/75,BOT,E,0
18461,33408,KIT CAIXA M INST/21 ROSA C/75,BOT,E,0
18461,33419,PAPEL SEDA INST/21 C/500 GRANEL,BOT,E,1000
18461,33424,ESTJ FLORATTA FLOWERS SORT REG/22,BOT,B,2
18461,33427,LILY GELEIA DES HID CORPORAL GLOW 250g,BOT,B,2
18461,3505,CAIXA P INST 2021 ROSA ECONOMICA,BOT,E,32
18461,3517,CAIXA P INST 2021 VERDE ECONOMICA,BOT,E,137
18461,3529,CAIXA M INST 2021 ROSA ECONOMICA,BOT,E,8
18461,3530,CAIXA M INST 2021 VERDE ECONOMICA,BOT,E,22
18461,3542,CAIXA G INST 2021 ROSA ECONOMICA,BOT,E,73
18461,3554,CAIXA G INST 2021 VERDE ECONOMICA,BOT,E,72
18461,36226,ESTJ GLAMOUR SEC BL REG/22,BOT,E,0
18461,36485,ESTJ COFFEE W/SEDUC REG/22,BOT,E,0
18461,36486,ESTJ FLORATTA BLUE REG/22,BOT,E,0
18461,36487,REF MAKE B PO COMP FAC HYAL 40 8g,BOT,C,1
18461,36488,REF MAKE B PO COMP FAC HYAL 50 8g,BOT,E,1
18461,3655,KIT CAIXA P INST 2021 ROSA VD,BOT,E,0
18461,36637,REF MAKE B PO COMP FAC HYAL 60 8G,BOT,E,2
18461,3670,KIT CAIXA M INST 2021 ROSA VD,BOT,E,0
18461,36826,REF MAKE B PO COMP FAC HYAL 70 8g,BOT,E,0
18461,3700,KIT CAIXA M INST 2021 VERDE VD,BOT,E,0
18461,37159,REF MAKE B PO COMP FAC HYAL 80 8g,BOT,E,0
18461,37693,REF MAKE B PO COMP FAC HYAL 10 8g,BOT,E,1
18461,37694,REF MAKE B PO COMP FAC HYAL 20 8G,BOT,C,2
18461,37695,REF MAKE B PO COMP FAC HYAL 25 8G,BOT,C,2
18461,37696,REF MAKE B PO COMP FAC HYAL 15 8G,BOT,C,2
18461,37699,REF MAKE B PO COMP FAC HYAL 30 8g,BOT,C,1
18461,37875,BOTICARIO APLICADOR DESCART LABIOS C/100,BOT,E,0
18461,37876,BOTICARIO APLICADOR DES DELINEADOR C/100,BOT,E,0
18461,37877,BOTICARIO APLICADOR DESCART SOMBRA C/100,BOT,E,0
18461,37878,BOTICARIO ESPATULA DESCARTAVEL C/100,BOT,E,0
18461,37879,BOTICARIO ESPONJA DESC MAQUIAGEM C/100,BOT,E,0
18461,38479,BOT PINCEL SOMB CONCAVO IND V3,BOT,E,1
18461,38480,BOT PINCEL DELINEAR SOMB BOCA IND V4,BOT,E,1
18461,38481,BOT PINCEL SOMB ESPONJA IND V4,BOT,E,2
18461,38482,BOT PINCEL BOCA RETR IND V3,BOT,E,1
18461,39235,CELEBRE DES BDY SPR FORCA 100ml,BOT,C,123
18461,40001,KIT INTENSE PINCEL CIRCUS MALABARES,BOT,E,1
18461,40085,MAKE B PINCEL BASE PO FIBRAS DUPLAS,BOT,E,2
18461,40087,MAKE B PINCEL CORRETIVO FIBRAS DUPLAS,BOT,E,0
18461,40088,MAKE B PINCEL APLICAR SOMBRA,BOT,E,1
18461,40090,MAKE B PINCEL ESFUMAR SOMBRA,BOT,C,0
18461,40091,MAKE B PINCEL DELINEAR,BOT,E,2
18461,40092,MAKE B PINCEL RETRATIL LABIOS,BOT,E,3
18461,40093,MAKE B ESPNJ MAQ SILIESPONJA PU,BOT,E,1
18461,40121,ESTJ ZAAD REG/22,BOT,E,0
18461,40220,ESTJ CBEM NUVEM REG/22,BOT,E,3
18461,40268,ESTJ NSPA AMEIXA REG/22,BOT,A,1
18461,40387,ESTJ MALBEC CLUB REG/22,BOT,C,0
18461,41143,BOT NECESS PVC BARBIE S/ALCA 16,BOT,E,1
18461,41449,INTENSE PORTA BATOM PINK EM PAPEL,BOT,E,3
18461,41623,MAKE B PINCEL BASE LIQUIDA,BOT,E,5
18461,41624,MAKE B PINCEL CONTORNO FACIAL,BOT,E,2
18461,41625,MAKE B PINCEL DUPLO OLHOS CHANFRADO,BOT,E,5
18461,42112,CAPINHA ABELINHA EM SILICONE,BOT,E,3
18461,42113,CAPINHA NUVEM EM SILICONE,BOT,E,1
18461,43352,INTENSE TOALHA DEMAQ BYE MAKE POLIEST,BOT,E,2
18461,43561,INTENSE CAPINHA BOCA P/ BATOM SILICONE,BOT,E,1
18461,43742,LAMINA OLFATIVA INST C/3000 UN,BOT,E,2
18461,43785,CBEM CAPINHA DELEITE SILICONE,BOT,E,1
18461,43846,CBEM CAPINHA LAVANDINHA SILICONE,BOT,E,1
18461,43909,BOTI BABY MOCHI MAT UNSX POL C/ALC,BOT,E,2
18461,43934,MATCH ESCV P/MODELAR 3D ABS,BOT,E,1
18461,43951,SOPHIE ESCV DESEMBARACO ABS,BOT,E,2
18461,43965,BOTI KIT CUIDADOS PESSOAIS ACO INOX,BOT,E,1
18461,44410,MAKE B PINC LEQUE,BOT,E,1
18461,44411,MAKE B PINC CONTORNO ANGULAR,BOT,E,1
18461,4443,BOTIK ACQ GEL HID ANTIOL AC MAND/SAL 50g,BOT,E,2
18461,4444,BOTIK SRUM ALT/POT ACID MAND/SALIC 30ml,BOT,E,1
18461,44580,MAKE B PINC ESPIRAL P/PELE,BOT,E,4
18461,44581,MAKE B PINCEL P/MARCAR CONCAVO,BOT,E,2
18461,4472,BOTIK GEL SEC P/ACNE ACID MAND/SALIC 15G,BOT,E,3
18461,4473,BOTIK GEL LIMP FAC MCLR AC MAND/SAL 150g,BOT,E,7
18461,44742,FITA DE VEDACAO VOID DEVOLUCAO,BOT,E,0
18461,4480,BOTIK ACQ GEL HID FAC ANTIS AC/POLIG 50g,BOT,E,8
18461,44803,CBEM CESTINHO METAL C/A,BOT,E,4
18461,44805,MAKE B NECESS POMPOM LISTRAS PU S/A,BOT,E,1
18461,44807,MATCH ESTJ PRATICO P/CABELOS,BOT,E,1
18461,4481,BOTIK CREM HID FAC FIRM AC/POLIGL 50g,BOT,C,1
18461,4482,BOTIK LOC HID ANTIOL ACI POL FAC 110ml,BOT,E,16
18461,44865,BOTI BANHEIRINHA TRANSP PS,BOT,E,3
18461,44967,BOTI BABY SABONETEIRA PP,BOT,E,1
18461,44968,SOPHIE SABONETEIRA PP,BOT,E,1
18461,45025,BOTI BABY FRASQ TROCADOR CINZA PES C/A,BOT,E,3
18461,4510,REF BOTIK CR FAC FIRM AC/HIALUR 40g,BOT,E,5
18461,4520,BOTIK GEL CR FAC FIRM AC/HIALUR 40g,BOT,C,6
18461,4522,REF BOTIK GEL CR FAC FIRM AC/HIAL 40g V2,BOT,E,3
18461,4539,BOTIK CR FAC FIRMADOR AC/HIAL 40G V2,BOT,E,5
18461,45557,BOTI APONTADOR CHUMBO,BOT,C,2
18461,45593,BOTI APARELHO LIMP FACIAL,BOT,E,0
18461,45627,INTENSE CJ PINC MINI FAC C/4,BOT,E,0
18461,45629,INTENSE KIT ESPNJ C/2 UND,BOT,C,1
18461,46006,CONJ ME MALBEC NAT/19,BOT,E,0
18461,46047,BOTI NECESS QUADR REC PRM PTA EVA C/A,BOT,E,2
18461,46054,CAIXA PAPELAO TAMPA LIGADA DEVOLUCAO PCK,BOT,E,0
18461,46467,CBEM NECESS BRCA BOA NOITE S/A PES,BOT,E,0
18461,46555,BOTI DIFUSOR ELETRONICO ABS,BOT,E,0
18461,46568,SOPHIE BOLSA NYLON,BOT,E,0
18461,46593,DR BOTICA MOCHI REG NLON,BOT,E,0
18461,46607,CARTAO NATAL 2020,BOT,E,293
18461,46645,ZAAD NECESS PES NAT/21 VDA,BOT,E,1
18461,46752,CAIXA M INST 2021 LACO VERDE UNIT,BOT,E,0
18461,46757,BOTI BOLSA ECOBAG BRCA G PES C/A,BOT,E,1
18461,46893,MATCH NECESSAIRE C/VISOR PES,BOT,E,3
18461,46894,MALBEC NECESSARIES TRIANGULAR PU PRETA,BOT,E,0
18461,46898,ZAAD EDP EXPEDITION 95ml,BOT,B,8
18461,46931,ESTJ BOTICOLL SORTIDO REG/22,BOT,B,6
18461,46948,ARBO SHW GEL CAB/CPO 75G,BOT,E,2
18461,47144,CBEM DES ANTIT AER PROTECT/BTY 90g/150ml,BOT,E,12
18461,47145,CBEM DES ANTIT ROLL PROTECT/BEAUTY 55ml,BOT,C,7
18461,47146,CBEM DES ANTIT AER INV PROTECT 90g/150ml,BOT,C,5
18461,47147,CBEM DES ROLL INV PROTECT 55ml,BOT,E,2
18461,47148,CBEM DES ANT AER CLIN ULT/PROT 90g/150ml,BOT,E,4
18461,47149,MEN DES ANT AER CLIN ULTR/PROT 90G/150ML,BOT,C,5
18461,47150,MEN DES ANTIT AER COOL PROTECT 90g/150ml,BOT,E,8
18461,47151,CBEM DES ANTIT AER S/ALUM 90g/150ml,BOT,E,6
18461,47152,MEN DES ANTIT AER INV PROTECT 90g/150ml,BOT,C,13
18461,47154,CBEM DES ROLL S/ALUM 55ml,BOT,C,3
18461,47165,CBEM DES ANTIT CR CLIN ULTRA PROTECT 50g,BOT,E,5
18461,47166,MEN DES ANTIT CR CLIN ULTRA PROTECT 50g,BOT,E,5
18461,47235,BOTI SUN PROT SOL CPO FPS 30 200g,BOT,E,0
18461,47299,NSPA COND SOLIDO 75G,BOT,E,3
18461,47300,NSPA SHAMP SLD AMEI 90g,BOT,E,3
18461,47303,ZAAD EDP EXPEDITION 10ml PRM,BOT,E,0
18461,47321,BOTIK SRUM ALT/POT ACID MAND/TRANEX 30ML,BOT,E,14
18461,47339,LIZ DES COL SUBLIME 100ml,BOT,B,22
18461,47341,CJ FLAC LIZ DES COL SUBLIME 5x1ml,BOT,E,0
18461,47411,ARBO NECESS LONA,BOT,E,0
18461,47412,INTENSE NECESSAIRE PU S/ALC,BOT,E,0
18461,47550,BOTIK GEL CR UNIFOR OLH AC MAND/TRAN 15g,BOT,E,10
18461,47551,ESTJ BOTIK ACID MAND/SALIC,BOT,E,3
18461,47552,BOTICA 214 EDP FOUG AROM VER/FIRENZ 90ml,BOT,E,8
18461,47553,BOTICA 214 EDP FLOR FRUT VER/FIRENZ 75ml,BOT,C,7
18461,47593,MAKE B NECESS POMPOM PU,BOT,E,2
18461,47594,BOTI SUN PROT CPO FPS 50 200G,BOT,E,0
18461,47596,BOTI SUN GEL POS SOL ACQUA GEL 120G,BOT,C,4
18461,47597,INSTANCE DES ANTIT AER FR/VERM 150ml,EUD,E,0
18461,47598,BOTI SUN PR FAC ANTIOL ACQ FL FPS30 40ml,BOT,E,4
18461,47599,BOTI SUN PROT FAC ANTIOL A/FL FPS70 40ml,BOT,B,1
18461,47600,BOTI SUN PR FAC ANTIS ACQ FLD FPS30 40ml,BOT,C,5
18461,47601,INSTANCE DES ANTIT ROLL FR/VERM 55ml,EUD,E,0
18461,47602,BOTI SUN PR FAC ANTIS ACQ FLD FPS70 40ml,BOT,C,7
18461,47624,MATCH SHAMP PROT DA COR 250ml,BOT,E,6
18461,47629,BOTICA 214 EDP GOLD/GARD 75ml V2,BOT,A,11
18461,47630,BOTICA 214 EDP DARK MINT 90ml V2,BOT,E,0
18461,47635,BOTICA 214 CR AC DES HID CPO V/FIR 200g,BOT,E,0
18461,47637,MATCH SHAMP MATIZ PROT/LOIROS 250ml,BOT,C,3
18461,47638,MATCH COND PROT DA COR 250ml,BOT,E,8
18461,47639,MATCH COND PROT/LOIROS 250ml,BOT,C,2
18461,47640,MATCH MASC CAP PROT/COR 250G,BOT,E,5
18461,47641,MATCH MASC MATIZ PROT/LOIROS 250g,BOT,E,1
18461,47729,BOTIK MASSAG LIMP FAC QUARTZO,BOT,E,11
18461,47754,DEM BOTICA 214 EDP GOLD/GARD 4ml V2,BOT,E,0
18461,47755,DEM BOTICA 214 EDP DARK MINT 4ml V2,BOT,E,0
18461,47777,BOTI BABY SAB LIQ CAB/PES NAN/NEN 200ml,BOT,E,4
18461,47779,BOTI BABY LOC HID CPO NAN/NEN 150ml,BOT,C,6
18461,47782,BOTI BABY COL NAN/NEN 100ml,BOT,E,2
18461,47803,CBEM AROMAT DE AMB NETFLIX 60ml,BOT,E,1
18461,47814,INSTANCE DES ROLL ON CHA VDE/ROMA 55ml,EUD,E,0
18461,47815,INSTANCE DES ANTIT AER CHA VDE/ROM 150ml,EUD,E,0
18461,47816,INSTANCE DES ANTIT CREM CHA VDE/ROMA 80g,EUD,E,0
18461,47817,INSTANCE DES ANTIT CREM S/PERF 80g,EUD,E,0
18461,47818,INSTANCE DES ANTIT AER S/PERF 150ml,EUD,E,0
18461,47842,EUD DES ANTIT AER 90g/150ml V2,EUD,E,0
18461,47843,IMPRESSION DES ANTIT AER 90g/150ml V2,EUD,E,0
18461,47851,ARBO DES COL FOREST 100ml,BOT,B,0
18461,47869,MATCH LEAV CAP SCIENCE RECONS 150ML,BOT,E,4
18461,47881,REF ARBO DES COL FOREST 100ml,BOT,E,0
18461,47901,BOTIK SRUM ALT/POT AC MAND/SALIC 4ml PRM,BOT,E,7
18461,47905,BOTICOLL ACQUA FRESCA DES COL 100ml V2,BOT,B,10
18461,47907,MEN CR POS BARBA AZULEN 40g V10,BOT,E,1
18461,47908,DREAM DES COL SPLSH VIAG/ENC 200ml V2,BOT,E,2
18461,47912,MATCH SHAMP RESP/CACH 250ml V2,BOT,E,1
18461,47914,MATCH CREM MODEL CACH RESP/CACH 290ml V2,BOT,E,1
18461,47916,MATCH CR MODEL ONDUL RESP/CACH 290ml V2,BOT,E,2
18461,47917,MATCH CR MODEL RESP/CACH CRESP 290ml V2,BOT,E,2
18461,47920,MATCH MASC CAP RESP/CACH 250g V3,BOT,E,1
18461,47949,THE BLEND EDP 100ml V2,BOT,A,7
18461,47950,ZAAD EDP 95ml V6,BOT,A,6
18461,47951,ZAAD EDP MONDO 95ML V3,BOT,E,1
18461,47960,BOTI SUN PROT CPO SPR ACQ/FL FPS50 180ml,BOT,E,3
18461,47962,BOTI SUN PROT SOL FAC ULT FLD FPS70 40ml,BOT,C,3
18461,47963,BOTI SUN PROT SOL CPO GEL CR FPS50 200g,BOT,E,3
18461,47968,MATCH LEAVE IN 150ml,BOT,C,3
18461,47969,INTENSE SAB LIQ DEMAQ 85ml V2,BOT,E,0
18461,47974,CBEM SAB LIQ INT NUVEM 200ml,BOT,E,1
18461,48015,MAKE B PRIMER FAC HYAL 16ml,BOT,E,2
18461,48020,NSPA OLEO ACUC ESF CPO AMEI 200g V3,BOT,E,0
18461,48058,LILY CR HID DES ACET CPO LOVE 250G V3,BOT,E,6
18461,48059,REF LILY CR H DES ACET CPO LOVE 250g V2,BOT,C,3
18461,48060,LILY CREM DES HID ACET CPO 250g V8,BOT,A,0
18461,48062,REF LILY CR ACET DES HID CPO 250g V2,BOT,A,39
18461,48100,CBEM COND FEIRA BANANA 170ml,BOT,E,1
18461,48130,MALBEC DES COL 100ml V5,BOT,E,0
18461,48133,MALBEC DES COL VERT 100ml V2,BOT,B,4
18461,48136,FLORATTA DES COL F/SECRET 75ml V2,BOT,E,142
18461,48139,COFFEE DES COL WOMAN SEDUC 100ml V5,BOT,E,0
18461,48141,ACCORDES DES COL 80ml V5,BOT,A,22
18461,48142,FLORATTA DES COL CER/FLOR 75ml V4,BOT,A,12
18461,48143,ELYSEE EDP BLANC 50ml V2,BOT,A,4
18461,48144,INSENSATEZ DES COL 100ml V3,BOT,E,11
18461,48145,BOTICOLL ANNI DES COL 100ml V2,BOT,A,25
18461,48146,ELYSEE EDP NUIT 50ml V2,BOT,B,2
18461,48151,MATCH AMP CAP SCIENCE RECONS 15ML,BOT,E,1
18461,48181,LILY OL PERF DES CPO 150ml V11,BOT,B,5
18461,48200,MALBEC CR P/BARB SENSIT CLUB 100G,BOT,E,1
18461,48253,REF NSPA LOC DES HID CPO F/AMEI 400ml V2,BOT,E,5
18461,48269,INTENSE BASE LIQ SUPFIX 60 25ml V3,BOT,E,2
18461,48271,INTENSE BASE LIQ SUPFIX 20 25ml V3,BOT,E,0
18461,48278,INTENSE BASE LIQ SUPFIX 25 25ml V3,BOT,E,2
18461,48280,NSPA DES COL BDY SPLSH AMEI/NEG 200ml V2,BOT,A,8
18461,48281,NSPA LOC DES HID CPO AMEI/NEG 400ml V3,BOT,A,2
18461,48282,NSPA LOC DES HID CPO AMEI 400ml V6,BOT,A,6
18461,48285,NSPA SAB LIQ CPO AMEI 200ml V3,BOT,C,6
18461,48286,NSPA SAB LIQ MAO AMEI 400ml V2,BOT,E,0
18461,48287,NSPA CR ANTIS MAO FPS 15 QUINOA 75g V2,BOT,E,0
18461,48288,NSPA SHAMP AMEI 300ml V2,BOT,E,4
18461,48290,NSPA DES COL BDY SPLSH AMEI 200ml V2,BOT,B,21
18461,48292,NSPA CR HID MAO F/AMEI 75G V2,BOT,E,2
18461,48296,FLORATTA DES COL ROSE BOUQUET 75ml,BOT,E,38
18461,48298,FLORATTA DES COL ROSE BOUQUET PRM 10ml,BOT,E,20
18461,48303,FLORATTA DES COL RED V2 75ml,BOT,A,49
18461,48307,FLORATTA DES COL F/SECRET V3 75ml,BOT,B,142
18461,48310,FLORATTA DES COL BLUE V2 75ml,BOT,A,56
18461,48313,FLORATTA DES COL ROSE V4 75ml,BOT,B,7
18461,48315,FLORATTA DES COL GOLD V3 75ml,BOT,B,7
18461,48344,DEM DREAM DES COL SPLSH VIAG/ENC 4ml V2,BOT,E,0
18461,48345,DEM FLORATTA DES COL L AMORE 4ml V2,BOT,E,0
18461,48347,DEM ELYSEE EDP BLANC 4ml V2,BOT,E,0
18461,48349,DEM INSENSATEZ DES COL 4ml V2,BOT,E,0
18461,48351,DEM FLORATTA DES COL F/SECRET 4ml V2,BOT,E,0
18461,48352,BOTICOLL ACQUA FRESCA DES COL 200ml V2,BOT,B,23
18461,48354,DEM THE BLEND EDP 4ml V2,BOT,E,0
18461,48355,DEM QUASAR DES COL EVLT 4ml V3,BOT,E,0
18461,48357,DEM QUASAR DES COL 4ml V2,BOT,E,0
18461,48359,ZAAD EDP 50ml V2,BOT,B,4
18461,48361,BOTICOLL ANNI DES COL 200ml V2,BOT,A,1
18461,48362,MALBEC DES COL 50ml V4,BOT,E,0
18461,48364,DEM MALBEC DES COL VERT 4ml V2,BOT,E,0
18461,48365,COFFEE DES COL MAN SEDUC 100ml V4,BOT,B,10
18461,48366,QUASAR DES ANTIT AER 75g V9,BOT,E,3
18461,48367,ZAAD DES ANTIT AER MONDO 75g V3,BOT,E,8
18461,48368,ZAAD ESPUM P/ BARB 200ML V4,BOT,E,1
18461,48369,QUASAR DES BODY SPR 100ml V9,BOT,E,12
18461,48375,ELYSEE CR DES HID ACET CPO BLANC 250g V2,BOT,B,2
18461,48381,MALBEC DES ANTIT ROLL 55ml V9,BOT,B,24
18461,48485,NSPA CACHEPO VERMELHO PU/PES,BOT,E,1
18461,48508,LILY OL PRODIG ACET MULTIF 50ml,BOT,E,6
18461,48510,LILY CR HID MAO 50g,BOT,B,5
18461,48511,LILY SHAMP ACET 250ml,BOT,C,0
18461,48513,LILY SAB LIQ CPO 250ML,BOT,B,2
18461,48514,LILY COND ACET 250ml,BOT,B,1
18461,48523,ESTJ MALBEC CLUB TRATAMENTO,BOT,E,1
18461,48535,DEM LILY EDP 4ml VDA,BOT,E,0
18461,48545,CBEM LOC DES HID CPO NUVEM 200ml V2,BOT,E,0
18461,48555,OUI SAB BARR CPO JARDIN DE GRASSE 90G,BOT,E,0
18461,48560,FLORATTA DES BDY SPR MY BLUE 100ml,BOT,E,38
18461,48562,NSPA CR HID MAO AMEI/NEG 75g V2,BOT,E,3
18461,48573,EGEO DES COL DOLCE COLORS 90ML V2,BOT,E,6
18461,48614,CBEM CREM HID MAO DELEITE 50g V2,BOT,E,8
18461,48619,REF CBEM LOC HID DES CPO NUVEM 400ml V2,BOT,E,3
18461,48621,FLORATTA EDP FLEUR D ECLIPSE 75ml,BOT,E,4
18461,48622,FLORATTA EDP FLEUR D ECLIPSE 10ml PRM,BOT,E,5
18461,48625,FLORATTA LOC DES HID CPO FL/D ECLIP 200g,BOT,C,4
18461,48628,CBEM LOC DES HID CPO NUVEM 400ml V2,BOT,E,0
18461,48632,DREAM DES COL SPLSH AMOR NO AR 350ml V2,BOT,E,0
18461,48634,DREAM DES COL SPLSH AMOR NO AR 200ml V2,BOT,E,0
18461,48635,FLORATTA DES COL ROSE 75ml V3,BOT,E,7
18461,48636,DEM FLORATTA DES COL ROSE 4ml V2,BOT,E,0
18461,48645,ELYSEE CR HID DES CPO NUIT 250g V2,BOT,B,1
18461,48646,FLORATTA CR DES HID CPO ROSE 200ml V5,BOT,B,3
18461,48653,ELYSEE DES ANTIT AEROSSOL 75g V3,BOT,C,2
18461,48657,EGEO DES ANTIT AEROSSOL DOLCE 75g V9,BOT,C,3
18461,48663,BOTICOLL ANNI DES COL SWEETY 100ml V2,BOT,E,5
18461,48664,BOTICOLL PORTINARI DES COL 100ml V5,BOT,A,0
18461,48669,BOTICOLL CECITA DES COL BLOSSOM 100ml V2,BOT,E,4
18461,48672,NSPA LOC DES HID CPO AMEI/NEG 200ml V4,BOT,B,21
18461,48673,NSPA LOC DES HID CPO AMEI 200ml V5,BOT,C,13
18461,48675,REF NSPA LOC DES H CPO AMEI/NEG 400ml V2,BOT,E,0
18461,48676,REF NSPA LOC DES HID CPO AMEI 400ml V2,BOT,E,0
18461,48679,NSPA LOC DES HID CPO AMEI 400ml V6 PRM,BOT,E,15
18461,48680,REF NSPA LOC FIRM D H CPO QUIN 400ml V2,BOT,C,3
18461,48683,MALBEC LOC DES HID CPO VERT 200ml V2,BOT,E,0
18461,48685,COFFEE LOC HID DES CPO W/SEDUC 200ml V2,BOT,C,3
18461,48696,LILY DES ANTIT AEROSSOL 75g V9,BOT,B,5
18461,48701,EGEO DES COL BEAT 90ml V2,BOT,E,14
18461,48731,REF CBEM LOC HID DES CPO R/ALG 400ml V2,BOT,E,1
18461,48734,LILY PARFUM LE 30ML,BOT,E,3
18461,48735,REF MALBEC CLUB CARG GILLETE MACH 3 C/2,BOT,E,0
18461,48736,CBEM CR HID MAO NUVEM 50g V3,BOT,E,4
18461,48740,REF CBEM LOC HID DESC CPO L/MEL 400ml V5,BOT,E,1
18461,48742,CBEM DES ANT AER R/ALG 75g/125ml V2,BOT,E,8
18461,48744,DR BOTICA COND POC BRILHO 200ml V2,BOT,E,5
18461,48745,DR BOTICA CREM PENT POC TIRA NO150g V2,BOT,B,2
18461,48761,EGEO DES ANTIT AER RED 75g V3,BOT,C,5
18461,48768,NSPA CR HID MAO AMEI 75g V5,BOT,C,5
18461,48770,NSPA COND AMEI 300ml V2,BOT,E,0
18461,48771,NSPA LOC HID CPO QUINOA 200ml V2,BOT,E,4
18461,48773,NSPA SHAMP QUINOA 300ml V3,BOT,E,2
18461,48774,NSPA DES ANTIT AEROSOL AMEI 75g V2,BOT,C,5
18461,48775,NSPA DES COL BDY SPLSH L/PATCH 200ml V2,BOT,E,15
18461,48776,QUASAR GEL POS BARBA 110g V7,BOT,E,2
18461,48777,THE BLEND SHW GEL 2/1 CAB/CPO 250g V2,BOT,E,3
18461,48779,BOTICOLL PORTINARI DES BDY SPR 100ml V7,BOT,C,25
18461,48780,COFFEE DES ANTIT AER WOMAN SEDUC 75g V4,BOT,E,14
18461,48782,MEN ESPUM P/ BARB 190g V5,BOT,E,1
18461,48784,ZAAD DES ANTIT AER 75g V7,BOT,C,6
18461,48785,MALBEC DES BDY SPR 100ml V4 PCK,BOT,A,2
18461,48787,MALBEC DES COL SPRT 100ml V3,BOT,E,7
18461,48788,REF BOTICOLL PORTINARI DES B/SP 100ml V6,BOT,E,5
18461,48789,THE BLEND DES ANTIT AER 75g/125ml V3,BOT,C,8
18461,48790,REFIL MALBEC DES BDY SPR REG 100ml PK V5,BOT,B,3
18461,48963,CBEM COND LISO PERF 250ml V3,BOT,E,3
18461,48966,CBEM COND CACH EXUB 250ml V3,BOT,E,1
18461,48967,CBEM CREM PENT CACH 200g V3,BOT,E,3
18461,48972,INTENSE BAS LIQ CORRET REB HD C35 24g V2,BOT,E,1
18461,48973,INTENSE BAS LIQ CORRET REB HD C50 24g V2,BOT,E,1
18461,48974,INTENSE BAS LIQ CORRET REB HD C60 24g V2,BOT,E,0
18461,48975,INTENSE BAS LIQ CORRET REB HD C15 24g V2,BOT,E,2
18461,48976,INTENSE BAS LIQ CORRET REB HD C3 24g V2,BOT,C,2
18461,48977,INTENSE BAS LIQ CORRET REB HD C37 24g V2,BOT,E,1
18461,48978,INTENSE BAS LIQ CORRET REB HD C75 24g V2,BOT,E,0
18461,48979,INTENSE BAS LIQ CORRET REB HD C80 24g V2,BOT,E,0
18461,48980,INTENSE BAS LIQ CORRET REB HD C10 24g V2,BOT,E,0
18461,48981,INTENSE BAS LIQ CORRET REB HD C20 24g V2,BOT,C,1
18461,48982,INTENSE BAS LIQ CORRET REB HD C30 24g V2,BOT,C,0
18461,48983,INTENSE BAS LIQ CORRET REB HD C53 24g V2,BOT,E,0
18461,48984,INTENSE BAS LIQ CORRET REB HD C25 24g V2,BOT,C,0
18461,48985,INTENSE BAS LIQ CORRET REB HD C40 24g V2,BOT,C,0
18461,48986,INTENSE BAS LIQ CORRET REB HD C77 24g V2,BOT,E,0
18461,48987,INTENSE BAS LIQ CORRET REB HD C85 24g V2,BOT,E,0
18461,48988,INTENSE BAS LIQ CORRET REB HD C13 24g V2,BOT,E,2
18461,48990,INTENSE DES COL GLOS 50ML V2,BOT,E,3
18461,48992,INTENSE LOC DES HID CPO GLOS 200ml V2,BOT,E,3
18461,48994,NSPA MASC CAP QUINOA 200g V3,BOT,E,1
18461,48995,NSPA COND QUINOA 300ml V2,BOT,E,1
18461,48997,NSPA OL DES HID CPO AMEI 200ml V3,BOT,B,9
18461,48999,NSPA OL DES HID CPO AMEI/NEG 200ml V3,BOT,B,0
18461,49014,ACCORDES CREM DES HID CPO 200ml V2,BOT,E,3
18461,49016,ACCORDES DES BDY SPR 100ml V6,BOT,B,1
18461,49023,DREAM LOC DES HID CPO CEU/BAUN 200ml V2,BOT,E,2
18461,49025,FLORATTA DES BDY SPR ROSE 100ml V8,BOT,B,32
18461,49031,MALBEC DES COL CLUB 100ml V3,BOT,E,4
18461,49033,MALBEC DES COL PLAY 50ml V3,BOT,E,4
18461,49034,MEN DES COL CLASSIC 100ml V3,BOT,E,1
18461,49038,ZAAD BALM POS BARB 110g V4,BOT,E,0
18461,49039,ZAAD DES COL BDY SPLSH 200ml,BOT,B,6
18461,49048,CBEM CREM HID P/MAOS NUVEM V4 45g,BOT,C,13
18461,49051,CBEM CR HID MAO R/ALG 50g V4,BOT,E,0
18461,49053,REF CBEM CREM HID MAOS NUVEM 40g,BOT,E,1
18461,49054,REF CBEM CREM HID MAOS BEIJINHO 40g,BOT,E,2
18461,49055,REF CBEM CREM HID MAOS DELEITE 40g,BOT,E,1
18461,49056,REF CBEM CREM HID MAOS ROSA/ALGODAO 40g,BOT,E,1
18461,49089,MATCH SHAMP NUTR REGENERADORA 300ml,BOT,E,6
18461,49090,MATCH COND NUTR REGENERADORA 280ml,BOT,E,6
18461,49091,MATCH MASC CAP NUTR REGENERADORA 250g,BOT,B,7
18461,49092,MATCH OL BIF NUTR REGENERADORA 90ml,BOT,E,5
18461,49093,MATCH AMP CAP PREENCHEDORA 9ml,BOT,E,8
18461,49102,MATCH MASC CAP NUTR REGEN PRM 50ml,BOT,E,2
18461,49139,MATCH LEAVE IN HIDRATACAO ANTIF 150ml,BOT,C,5
18461,49144,MATCH LEAVE IN LISO PROLONGADO 150ml,BOT,E,7
18461,49150,MATCH SPR CAP MULTIBENEFICIOS V2 150ml,BOT,E,9
18461,49154,COFFEE DES COL UNIQ WOM FL/GOURM 100ml,BOT,E,26
18461,49163,BOTI CARTUCHO PAIS/22,BOT,E,0
18461,49188,DEM BOTICA 214 EDP PEON/APRCT 4ml V2,BOT,E,0
18461,49193,COFFEE DES COL UNIQ MAN FOUG/OR 100ml,BOT,E,29
18461,49196,BOTI CARTCH COMB LGBT NAM/22,BOT,E,0
18461,49215,CBEM NECESS REG PES,BOT,E,3
18461,49217,NSPA SAB LIQ CPO MORANGO RUBY 200ml,BOT,C,13
18461,49218,MAKE B ESTJ PO COMP HYALURONIC,BOT,C,1
18461,49225,COFFEE D/COL UNIQ WOM FL/GOURM PRM 10ml,BOT,E,2
18461,49228,COFFEE DES COL MAN FOUG/ORIENT PRM 10ml,BOT,E,12
18461,49242,COFFEE DES ANTIT AER WOM/SEDUC V5 75g,BOT,E,14
18461,49244,COFFEE D/COL MAN ORIENT/AMB V4 100ml,BOT,B,0
18461,49252,COFFEE D/C SEDUC/WOM/FLORIEN/FR V6 100ml,BOT,A,0
18461,49263,ESTJ SOPHIE MINI V2,BOT,E,3
18461,49264,SOPHIE COND 200ml V2,BOT,C,12
18461,49265,SOPHIE SHAMP 200ml V2,BOT,B,11
18461,49286,ZAAD BALM POS BARBA 40G V3,BOT,C,0
18461,49288,ESTJ ARBO REG/22,BOT,A,8
18461,49291,ESTJ MALBEC REG/22,BOT,E,3
18461,49353,BOTICA 214 EDP PEON/APRCT 75ml V2,BOT,B,5
18461,49362,MALBEC DES ANTIT AER 75g/125ml V10,BOT,B,38
18461,49378,MATCH FLD SELAD CAP PROT/LOIROS 100ml,BOT,C,0
18461,49379,MATCH ACIDIFICANTE 100ml,BOT,E,5
18461,49388,MALBEC SHAMP ESF ANTICASPA CLUB 150m,BOT,E,1
18461,49389,MALBEC POMAD MODEL CAP ANTICASP CLUB 85g,BOT,E,0
18461,49399,DEM FLORATTA DES COL AMOR/LAVAN 4ml V2,BOT,E,0
18461,49401,CASA 214 SAB LIQ MULTIF VAN/SUBLIM 400ml,BOT,E,2
18461,49402,MATCH MASC CAP SCIENCE RECONS 250g,BOT,E,6
18461,49403,BOTIK SRUM ALT/POT RETINOL PURO 15ml,BOT,E,4
18461,49418,NSPA OL DES HID CPO QUIN/AMEN 200ml V3,BOT,C,2
18461,49485,AURIEN LOC ILUM DES CPO GOLD 200ml V2,EUD,E,0
18461,49487,AURIEN LOC HID DES CPO RUBRA 200ml V3,EUD,E,0
18461,49490,GLAMOUR NECESS REG PU,BOT,C,0
18461,49496,AURIEN DES COL RUBRA 100ml V3,EUD,E,0
18461,49498,DEM AURIEN DES COL RUBRA 4ml V3,EUD,E,0
18461,49500,AURIEN DES COL TURQ 100ml V2,EUD,E,0
18461,49503,DEM AURIEN DES COL TURQ 4ml V2,EUD,E,0
18461,49510,DEM IMENSI DES COL 4ml V2 VDA,EUD,E,0
18461,49511,EUD EDP ROUGE 75ml V2,EUD,E,0
18461,49521,DEM EUD EDP ROUGE 4ml V2,EUD,E,0
18461,49539,DEM EUD EDP 4ml V2,EUD,E,0
18461,49540,EUD EDP 75ml V4,EUD,E,0
18461,49543,LA VICTORIE EDP 75ml V2,EUD,E,0
18461,49549,BOTICA 214 EDP FEM VER/FIRENZ 10ml PRM,BOT,E,0
18461,49550,BOTICA 214 EDP MASC VER/FIRENZ 10ml PRM,BOT,E,0
