PDV,SKU,SKU_PARA,DESCRIÇÃO,ESTOQUE ATUAL,FASES DO PRODUTO,MARCA
12586,75641,-,"INTENSE MONOSOMBRA COMP AC MARSALA 1,5g",1,Descontinuado,BOT
12586,75653,-,INTENSE MASC P/SOBRANC 1 3g,1,Descontinuado,BOT
12586,75654,-,INTENSE MASC P/SOBRANC 2 3g,2,Descontinuado,BOT
12586,75664,-,NSPA SHAMP KARITE 300ml V2,5,Descontinuado,BOT
12586,75748,87041,MAKE B BAS LIQ PROT HYAL 70 COR 15 30ml,1,Descontinuado,BOT
12586,75750,87043,MAKE B BAS LIQ PROT HYAL 70 COR 25 30ml,0,Descontinuado,BOT
12586,75751,87044,MAKE B BAS LIQ PROT HYAL 70 COR 30 30ml,0,Descontinuado,BOT
12586,75772,58392,BOTI CJ DEM FLACON DES COL FEM VD 4ML V3,0,Descontinuado,BOT
12586,75775,-,KIT DEM BOTI PREMIUM VE C/4 V7,0,Descontinuado,BOT
12586,75792,48303,FLORATTA DES COL RED 75ml,116,Descontinuado,BOT
12586,75808,-,COFFEE DES ANTIT AER MAN 75G/125ML V7,2,Descontinuado,BOT
12586,75829,53927,MALBEC DES ANT AER MAGNETIC 75g/125ml V2,0,Descontinuado,BOT
12586,75921,-,"SOPHIE BATOM ROSA PINK 3,3g",1,Descontinuado,BOT
12586,76539,-,MATCH SHAMP FONT/NUTR 250ml,0,Descontinuado,BOT
12586,76664,-,MEN DES COL NEW 100ml,8,Descontinuado,BOT
12586,77483,49765,UOMINI DES COL 100ml V5,0,Descontinuado,BOT
12586,77534,82890,MATCH SPRAY CAPILAR FIN BRLH 100ml,0,Descontinuado,BOT
12586,77690,49825,CBEM LOC DES HID CPO BEIJINHO 400ml,0,Descontinuado,BOT
12586,77694,87373,CBEM SAB BARRA BEIJINHO 2x80g,0,Descontinuado,BOT
12586,77707,-,MAKE B ELIX FAC DROPS BEAUTY SKIN 30ml,1,Descontinuado,BOT
12586,77773,-,QUASAR NEXT COL 50ml,0,Descontinuado,BOT
12586,77814,55230,"QDB LAP OLH PRETUCO 1,2G V3",0,Descontinuado,QDB
12586,77815,55237,"QDB LAP OLH MARRONLITO 1,2g V3",0,Descontinuado,QDB
12586,77816,55239,"QDB LAP OLH BEGETE 1,2g V3",0,Descontinuado,QDB
12586,77818,55232,"QDB LAP OLH BRANCOLITO 1,2g V2",0,Descontinuado,QDB
12586,77819,55231,"QDB LAP OLH VERDEZULEX 1,2g V2",0,Descontinuado,QDB
12586,77821,55235,"QDB LAP OLH ZUZULINO 1,2g V2",0,Descontinuado,QDB
12586,77826,55236,"QDB LAP OLH ROSATON 1,2G V2",0,Descontinuado,QDB
12586,79565,-,BOTICOLL HORIZONTE DES ANTIT AER 75G,1,Descontinuado,BOT
12586,79648,-,MATCH COND ANTI IDADE DESMRL 250ml,0,Descontinuado,BOT
12586,80361,-,DR BOTICA GEL FIX CAP 80g,1,Descontinuado,BOT
12586,80698,59493,MALBEC SHAMP GREY CLUB 250ml V2,0,Descontinuado,BOT
12586,80729,85668,"MAKE B PO COMP FAC ILUM ROSE 5,4g",8,Descontinuado,BOT
12586,80761,84399,MALBEC DES COL FLAME 100ml,12,Descontinuado,BOT
12586,80773,49035,MEN GEL FAC SECTVO ESPNH 15g,1,Descontinuado,BOT
12586,80889,-,REF UOMINI DES BDY SPR INFINIT 100ML PCK,3,Descontinuado,BOT
12586,81178,-,MAKE B EDP GOLD 75ml,1,Descontinuado,BOT
12586,81181,-,MATCH MASC CAP FORCA 250g,4,Descontinuado,BOT
12586,81334,-,"INTENSE PALETTE BRONZE MULTIF 2 13,2g",0,Descontinuado,BOT
12586,81508,87203,KIT BOTIK COMPLETO,0,Descontinuado,BOT
12586,81568,56025,MEN SHW GEL CAB/CPO/BARB 205g V4,0,Descontinuado,BOT
12586,81652,-,MATCH COND EQLB OL 250ml,3,Descontinuado,BOT
12586,81654,-,MATCH SHAMP A SECO OL 150ml,2,Descontinuado,BOT
12586,82037,51123,CBEM DES COL BDY SPLASH BOA NOITE 200ml,0,Descontinuado,BOT
12586,82085,-,FLAC OUI EDP JARDIN DE GRASSE 2ml,0,Descontinuado,BOT
12586,82169,-,ESTJ MAKE B BATONS MINI HITS,1,Descontinuado,BOT
12586,82239,87039,MAKE B BAS LIQ PROT HYAL 70 INVIS 30ml,1,Descontinuado,BOT
12586,82476,53934,BOTICOL PORTINARI DES ANT/A 75g/125ml V7,0,Descontinuado,BOT
12586,82528,58566,"MAKE B CORRET LIQ FAC EFFECT 10 5,7ml",1,Descontinuado,BOT
12586,82530,58624,"MAKE B CORRET LIQ FAC EFFECT 20 5,7ml",7,Descontinuado,BOT
12586,82531,58626,"MAKE B CORRET LIQ FAC EFFECT 25 5,7ml",7,Descontinuado,BOT
12586,82532,58627,"MAKE B CORRET LIQ FAC EFFECT 30 5,7ml",1,Descontinuado,BOT
12586,82533,58628,"MAKE B CORRET LIQ FAC EFFECT 40 5,7ml",4,Descontinuado,BOT
12586,82534,58629,"MAKE B CORRET LIQ FAC EFFECT 50 5,7ml",3,Descontinuado,BOT
12586,82535,58630,"MAKE B CORRET LIQ FAC EFFECT 60 5,7ml",2,Descontinuado,BOT
12586,82536,58631,"MAKE B CORRET LIQ FAC EFFECT 70 5,7ml",1,Descontinuado,BOT
12586,82537,58632,"MAKE B CORRET LIQ FAC EFFECT 80 5,7ml",3,Descontinuado,BOT
12586,82613,-,"MAKE B CORRET LIQ FAC FL IL RET H70 2,5g",1,Descontinuado,BOT
12586,82704,59579,MATCH SHAMP NUTR PROF 300ml,9,Descontinuado,BOT
12586,82708,59577,MATCH MASC CAP NUTR PROF 250g,0,Descontinuado,BOT
12586,82709,59574,MATCH OL CAP NUTR PROF 50ml,8,Descontinuado,BOT
12586,82789,59188,CBEM SHAMP FEIRA BANANA 230ml,3,Descontinuado,BOT
12586,82795,59197,CBEM COND FEIRA PASTA ABACATE 170ml,7,Descontinuado,BOT
12586,82798,-,CBEM COND REST BEIJINHO 250ml,2,Descontinuado,BOT
12586,82803,-,CBEM CREM PENT FEIRA AMIDO MILHO 200ml,1,Descontinuado,BOT
12586,82824,86037,MATCH SHAMP MATIZADOR LOIROS 300ml,9,Descontinuado,BOT
12586,82827,-,MATCH SHAMP SCIENCE RECONS 250ml,0,Descontinuado,BOT
12586,82874,56812,MATCH TON CAP SCIENCE CRESC 65ml,0,Descontinuado,BOT
12586,82969,58968,MALBEC SHAMP ANTIQUEDA CLUB 250ml,0,Descontinuado,BOT
12586,83041,51324,QUASAR DES BDY SPR RUSH 100ml,16,Descontinuado,BOT
12586,83053,49898,CBEM LOC DES HID CPO CER LIVRE 200ml,0,Descontinuado,BOT
12586,83068,-,LILY EDP LUMIER 30ml,0,Descontinuado,BOT
12586,83073,48773,NSPA SHAMP QUINOA 300ml V2,2,Descontinuado,BOT
12586,83124,84743,REF MATCH MASC CAP NUTR/PROF 250ml,11,Descontinuado,BOT
12586,83147,84741,REF MATCH SHAMP NUTR/PROF 250ml,2,Descontinuado,BOT
12586,83167,85548,REF MATCH COND NUTR/PROF 250ml,2,Descontinuado,BOT
12586,83188,84400,MALBEC DES COL BLEU 100ml,6,Descontinuado,BOT
12586,83445,-,CBEM LOC DES HID CPO BUBBALOO 200ml,5,Descontinuado,BOT
12586,83453,-,NSPA GEL DES HID CPO AMEI 250G,1,Descontinuado,BOT
12586,83454,-,NSPA GEL DES HID CPO QUINOA 250g,2,Descontinuado,BOT
12586,83458,-,NSPA GEL DES HID CPO ACAI 250g,2,Descontinuado,BOT
12586,83519,-,NSPA GEL DES HID CPO ALOE VERA 250g,5,Descontinuado,BOT
12586,83552,-,BOTIK CR PREN RUG N/LAB RET/P LINEF 15ml,1,Descontinuado,BOT
12586,83606,87040,MAKE B BAS LIQ PROT HYAL 70 COR 10 30ml,1,Descontinuado,BOT
12586,83607,87049,MAKE B BAS LIQ PROT HYAL 70 COR 80 30ML,2,Descontinuado,BOT
12586,83668,-,NSPA CR REPAR FAC CENTELLA ASIATICA 75ml,1,Descontinuado,BOT
12586,83670,-,NSPA CR FAC MULTIREP INT CENT/ASIAT 30ML,2,Descontinuado,BOT
12586,83903,59030,MALBEC OLEO P/BARBA CLUB 25ml V2,0,Descontinuado,BOT
12586,83968,-,CBEM AROMAT AMB ALIVIO 200ml,0,Descontinuado,BOT
12586,84056,85483,FLORATTA DES BDY SPR RED 100ml,2,Descontinuado,BOT
12586,84057,85482,FLORATTA DES BDY SPR F/SECRET 100ML,0,Descontinuado,BOT
12586,84107,-,GLAMOUR DES ANTIT AER GOLD GLAM 75G,1,Descontinuado,BOT
12586,84117,51148,CBEM ALCOOL GEL NUVEM 30g V3,0,Descontinuado,BOT
12586,84126,-,"INTENSE LAP MULTIF BEGE KARITE 1,1g",2,Descontinuado,BOT
12586,84197,56051,MAKE B BAT STCK PREENCH HYAL S/COR 3g,2,Descontinuado,BOT
12586,84203,49943,CBEM LOC DES HID CPO PESSEGURA 400ml,0,Descontinuado,BOT
12586,84204,49903,CBEM LOC DES HID CPO PESSEGURA 200ml,0,Descontinuado,BOT
12586,84206,51237,CBEM CREM ESF CPO PESSEGURA 230g,0,Descontinuado,BOT
12586,84223,-,GLAMOUR DES COL JUST SHINE 75ml V2,16,Descontinuado,BOT
12586,84243,49944,REF CBEM LOC DES HID CPO PESSEGURA 350ml,0,Descontinuado,BOT
12586,84304,-,NSPA DES COL BDY SPLSH GINS/CAF 200ml,1,Descontinuado,BOT
12586,84307,-,"MAKE B CORR LIQ FAC FL IL RET H INV 2,5g",1,Descontinuado,BOT
12586,84488,-,LINDA LOC DES HID CPO REG 200ML V2,1,Descontinuado,BOT
12586,8458,49150,MATCH SPR CAP MULTIBENEFICIOS 150ml,0,Descontinuado,BOT
12586,84604,-,FLORATTA NECESS PU MAES/25 ESTJ,0,Descontinuado,BOT
12586,84606,-,LINDA NECESSAIRE PU MAES/25 ESTJ,0,Descontinuado,BOT
12586,84624,-,NSPA ESPONJA BANHO PU MAES/25 ESTJ,0,Descontinuado,BOT
12586,84677,-,MALBEC SAB BARRA PURE GOLD 2x80g,1,Descontinuado,BOT
12586,85104,-,COFFEE SAB LIQ CPO WOMAN SEDUCTION 150ml,0,Descontinuado,BOT
12586,85105,-,LIZ CREM DES HID CPO SUBLIME 100ml,0,Descontinuado,BOT
12586,85259,-,BOTICOLL PORTINARI NECESS PU PAIS/25,0,Descontinuado,BOT
12586,85292,-,ESTJ MALBEC X AMOR/25,0,Descontinuado,BOT
12586,85293,-,ESTJ HER CODE AMOR/25,0,Descontinuado,BOT
12586,85294,-,ESTJ QUASAR CLASSIC AMOR/25,0,Descontinuado,BOT
12586,85295,-,ESTJ CELEBRE AGORA FEMININO AMOR/25,0,Descontinuado,BOT
12586,85296,-,ESTJ COFFEE WOMAN SEDUCTION AMOR/25,0,Descontinuado,BOT
12586,85297,-,ESTJ CELEBRE AGORA MASCULINO AMOR/25,0,Descontinuado,BOT
12586,85298,-,ESTJ LILY LEAU/LILY AMOR/25,0,Descontinuado,BOT
12586,85299,-,ESTJ COFFEE MAN DUO AMOR/25,0,Descontinuado,BOT
12586,85300,-,ESTJ EGEO DOLCE AMOR/25,0,Descontinuado,BOT
12586,85301,-,ESTJ FLORATTA RED AMOR/25,0,Descontinuado,BOT
12586,85302,-,ESTJ EGEO ORIGINAL AMOR/25,0,Descontinuado,BOT
12586,85491,-,ESTJ CBEM DELEITE CHOCOLATUDO AMOR/25,0,Descontinuado,BOT
12586,85493,-,ESTJ NSPA CEREJA ROUGE AMOR/25,0,Descontinuado,BOT
12586,85562,-,ESTJ MALBEC PREMIUM PAIS/25,1,Descontinuado,BOT
12586,85563,-,ESTJ THE BLEND PAIS/25,0,Descontinuado,BOT
12586,85566,-,ESTJ ZAAD PAIS/25,4,Descontinuado,BOT
12586,85567,-,ESTJ MALBEC BLACK PAIS/25,0,Descontinuado,BOT
12586,85568,-,ESTJ ARBO PAIS/25,0,Descontinuado,BOT
12586,85569,-,ESTJ UOMINI PAIS/25,2,Descontinuado,BOT
12586,85570,-,ESTJ BOTICOLL PORTINARI PAIS/25,4,Descontinuado,BOT
12586,85572,-,ESTJ MALBEC PAIS/25,0,Descontinuado,BOT
12586,85574,-,ESTJ CLASH PAIS/25,0,Descontinuado,BOT
12586,85575,-,ESTJ QUASAR VISION PAIS/25,5,Descontinuado,BOT
12586,85576,-,ESTJ BOTICOLL CONNEXION PAIS/25,0,Descontinuado,BOT
12586,85577,-,ESTJ EGEO BOMB BLACK PAIS/25,0,Descontinuado,BOT
12586,85578,-,ESTJ CELEBRE FOUG/AROM FORCA PAIS/25,1,Descontinuado,BOT
12586,85579,-,ESTJ MALBEC CUIDADOS PAIS/25,15,Descontinuado,BOT
12586,85733,-,LILY LOC DES HID CPO LEAU LILY 200ml,0,Descontinuado,BOT
12586,86019,-,ESTJ ARBO AMOR/25,0,Descontinuado,BOT
12586,86094,-,CBEM SPR PERF P/CAB FEIR CACH/UVA 100ml,2,Descontinuado,BOT
12586,86116,-,CBEM DES COL BDY SPLSH DOC DELIRIO 200ml,1,Descontinuado,BOT
12586,86336,-,MALBEC SHW GEL CAB/CPO 200g,0,Descontinuado,BOT
12586,86339,-,"MAKE B BAT CREM U/BALLET LAC/BALLET 3,6g",5,Descontinuado,BOT
12586,86340,-,"MAKE B BAT BAL CREM U/B LACE RED 3,6g",4,Descontinuado,BOT
12586,86429,-,NEXT PASTA MODEL CAP PRM 30g,22,Descontinuado,BOT
12586,86505,-,REF CASA 214 AROMAT VAR VAN/SUBLIM 250ml,0,Descontinuado,BOT
12586,86825,-,PMPCK MALBEC CLUB/DR JONES BARB S/IRRIT,0,Descontinuado,BOT
12586,86982,-,EGEO DES COL MELANCIA 90ml,0,Descontinuado,BOT
12586,87070,-,CJ SCH CBEM FEIR CACH/UVA SH/CON/M 3x7ml,0,Descontinuado,BOT
12586,87271,-,"MAKE B BAT CREM U/BALLET LACE ROSE 3,6g",1,Descontinuado,BOT
12586,87408,-,ESTJ LILY MAES/25,0,Descontinuado,BOT
12586,87409,-,ESTJ ELYSEE MAES/25,0,Descontinuado,BOT
12586,87410,-,ESTJ FLORATTA RED MAES/25,0,Descontinuado,BOT
12586,87411,-,ESTJ COFFEE WOMAN SEDUCTION MAES/25,0,Descontinuado,BOT
12586,87412,-,ESTJ LILY LEAU DE MAES/25,0,Descontinuado,BOT
12586,87413,-,ESTJ LIZ MAES/25,0,Descontinuado,BOT
12586,87414,-,ESTJ GLAMOUR SECRETS BLACK MAES/25,0,Descontinuado,BOT
12586,87415,-,ESTJ LINDA MAES/25,0,Descontinuado,BOT
12586,87416,-,ESTJ EGEO CHOC MAES/25,0,Descontinuado,BOT
12586,87418,-,ESTJ LILY CUIDADOS MAES/25,0,Descontinuado,BOT
12586,87419,-,ESTJ EGEO DOLCE MAES/25,0,Descontinuado,BOT
12586,87420,-,ESTJ LIZ SUBLIME MAES/25,0,Descontinuado,BOT
12586,87421,-,ESTJ NSPA AMEIXA MAES/25,0,Descontinuado,BOT
12586,87422,-,ESTJ CELEBRE FEM MAES/25,0,Descontinuado,BOT
12586,87423,-,ESTJ CBEM PESSEGURA MAES/25,0,Descontinuado,BOT
12586,87424,-,ESTJ CBEM DELEITE MAES/25,0,Descontinuado,BOT
12586,88646,-,CBEM DES COL BDY SPLSH M/LEIT V2 200ml,1,Descontinuado,BOT
12586,9403,-,QDB SRUM FAC TRIP COMB SKIN Q 30ml,0,Descontinuado,QDB
