PDV,SKU,SKU_PARA,DESCRIÇÃO,ESTOQUE ATUAL,FASES DO PRODUTO,MARCA
12586,1004,52493,FLORATTA DES COL MY BLUE 75ml,14,Descontinuado,BOT
12586,12084,-,ESTJ EGEO DOLCE NAM/22,0,Descontinuado,BOT
12586,1657,57737,DEM NSPA DES COL BDY SPLSH M/RUBY 4ml,0,Descontinuado,BOT
12586,1676,87051,NSPA OL MULTIF AMEIXA 85ml,3,Descontinuado,BOT
12586,1680,87050,NSPA OL MULTIF AMEIXA NEGRA 85ml,1,Descontinuado,BOT
12586,1685,-,NSPA OL MULTIF ROSE 85ml,3,Descontinuado,BOT
12586,19685,53518,ELYSEE EDP 50ml,0,Descontinuado,BOT
12586,23743,88212,DEM FLAC ELYSEE EDP 4ml VE,0,Descontinuado,BOT
12586,25458,48310,FLORATTA DES COL BLUE 75ml,93,Descontinuado,BOT
12586,27861,55505,MAKE B LAP P/OLH GEL ULTRABLACK,0,Descontinuado,BOT
12586,29226,85796,ELYSEE CREM HID DES CPO ACETINADO 250g,3,Descontinuado,BOT
12586,29807,-,MAKE B SPR FIX MAQ ROSTO 75ml/40g,1,Descontinuado,BOT
12586,30192,54101,MALBEC DES COL X 100ml,3,Descontinuado,BOT
12586,3220,-,OUI EDP FLEURS ETERN LA JONQUILLE 75ML,0,Descontinuado,BOT
12586,36486,58528,ESTJ FLORATTA BLUE REG/22,0,Descontinuado,BOT
12586,38479,-,BOT PINCEL SOMB CONCAVO IND V3,1,Descontinuado,BOT
12586,38481,-,BOT PINCEL SOMB ESPONJA IND V4,1,Descontinuado,BOT
12586,40058,-,REF CELEBRE DES BDY SPR FORCA 100ml,12,Descontinuado,BOT
12586,41449,-,INTENSE PORTA BATOM PINK EM PAPEL,1,Descontinuado,BOT
12586,41625,-,MAKE B PINCEL DUPLO OLHOS CHANFRADO,3,Descontinuado,BOT
12586,42512,-,MAKE B PORTA PINCEIS METALIZADO PU,1,Descontinuado,BOT
12586,43566,-,MAKE B PINC ESCOVA BASE,6,Descontinuado,BOT
12586,43939,-,MATCH ESCV PARA DESEMBARACAR ABS,1,Descontinuado,BOT
12586,44410,-,MAKE B PINC LEQUE,1,Descontinuado,BOT
12586,4443,-,BOTIK ACQ GEL HID ANTIOL AC MAND/SAL 50g,1,Descontinuado,BOT
12586,4473,87491,BOTIK GEL LIMP FAC MCLR AC MAND/SAL 150g,8,Descontinuado,BOT
12586,4480,87484,BOTIK ACQ GEL HID FAC ANTIS AC/POLIG 50g,6,Descontinuado,BOT
12586,44807,-,MATCH ESTJ PRATICO P/CABELOS,2,Descontinuado,BOT
12586,44865,56841,BOTI BANHEIRINHA TRANSP PS,0,Descontinuado,BOT
12586,4510,87483,REF BOTIK CR FAC FIRM AC/HIALUR 40g,1,Descontinuado,BOT
12586,4539,87482,BOTIK CR FAC FIRMADOR AC/HIAL 40G V2,0,Descontinuado,BOT
12586,46467,-,CBEM NECESS BRCA BOA NOITE S/A PES,0,Descontinuado,BOT
12586,46895,-,BOTI MASSAG CPO PP,15,Descontinuado,BOT
12586,46948,-,ARBO SHW GEL CAB/CPO 75G,5,Descontinuado,BOT
12586,47235,50395,BOTI SUN PROT SOL CPO FPS 30 200g,2,Descontinuado,BOT
12586,47412,-,INTENSE NECESSAIRE PU S/ALC,1,Descontinuado,BOT
12586,47552,88022,BOTICA 214 EDP FOUG AROM VER/FIRENZ 90ml,12,Descontinuado,BOT
12586,47594,47963,BOTI SUN PROT CPO FPS 50 200G,0,Descontinuado,BOT
12586,47630,88019,BOTICA 214 EDP DARK MINT 90ml V2,1,Descontinuado,BOT
12586,47635,-,BOTICA 214 CR AC DES HID CPO V/FIR 200g,0,Descontinuado,BOT
12586,47810,-,CBEM LOC DES HID CPO NETFLIX 200ml,1,Descontinuado,BOT
12586,47901,-,BOTIK SRUM ALT/POT AC MAND/SALIC 4ml PRM,1,Descontinuado,BOT
12586,47911,51244,QUASAR DES COL 100ml V3,1,Descontinuado,BOT
12586,47951,58348,ZAAD EDP MONDO 95ML V3,2,Descontinuado,BOT
12586,47960,57731,BOTI SUN PROT CPO SPR ACQ/FL FPS50 180ml,87,Descontinuado,BOT
12586,47974,52757,CBEM SAB LIQ INT NUVEM 200ml,1,Descontinuado,BOT
12586,48020,57675,NSPA OLEO ACUC ESF CPO AMEI 200g V3,0,Descontinuado,BOT
12586,48100,59193,CBEM COND FEIRA BANANA 170ml,3,Descontinuado,BOT
12586,48130,84387,MALBEC DES COL 100ml V5,0,Descontinuado,BOT
12586,48136,48307,FLORATTA DES COL F/SECRET 75ml V2,145,Descontinuado,BOT
12586,48139,49252,COFFEE DES COL WOMAN SEDUC 100ml V5,35,Descontinuado,BOT
12586,48144,85606,INSENSATEZ DES COL 100ml V3,30,Descontinuado,BOT
12586,48200,59029,MALBEC CR P/BARB SENSIT CLUB 100G,0,Descontinuado,BOT
12586,48255,-,NSPA LOC DES HID CPO F/AMEI 200ml V5,5,Descontinuado,BOT
12586,48278,-,INTENSE BASE LIQ SUPFIX 25 25ml V3,2,Descontinuado,BOT
12586,48285,-,NSPA SAB LIQ CPO AMEI 200ml V3,6,Descontinuado,BOT
12586,48347,59494,DEM ELYSEE EDP BLANC 4ml V2,0,Descontinuado,BOT
12586,48350,56922,DEM ELYSEE EDP NUIT 4ml V2,0,Descontinuado,BOT
12586,48362,-,MALBEC DES COL 50ml V4,0,Descontinuado,BOT
12586,48363,59585,MALBEC DES COL 100ml PRM V4,0,Descontinuado,BOT
12586,48367,-,ZAAD DES ANTIT AER MONDO 75g V3,1,Descontinuado,BOT
12586,48485,-,NSPA CACHEPO VERMELHO PU/PES,1,Descontinuado,BOT
12586,48545,49890,CBEM LOC DES HID CPO NUVEM 200ml V2,1,Descontinuado,BOT
12586,48547,49884,CBEM LOC DES HID CPO L/MEL 400ml V7,4,Descontinuado,BOT
12586,48552,85122,CBEM DES ROLL ON L/MEL 55ml V6,19,Descontinuado,BOT
12586,48573,-,EGEO DES COL DOLCE COLORS 90ML V2,10,Descontinuado,BOT
12586,48614,55427,CBEM CREM HID MAO DELEITE 50g V2,0,Descontinuado,BOT
12586,48615,-,CBEM LOC DES HID CPO L/MEL 200ml V2,4,Descontinuado,BOT
12586,48619,49887,REF CBEM LOC HID DES CPO NUVEM 400ml V2,0,Descontinuado,BOT
12586,48621,52507,FLORATTA EDP FLEUR D ECLIPSE 75ml,10,Descontinuado,BOT
12586,48628,49888,CBEM LOC DES HID CPO NUVEM 400ml V2,0,Descontinuado,BOT
12586,48632,-,DREAM DES COL SPLSH AMOR NO AR 350ml V2,0,Descontinuado,BOT
12586,48635,48313,FLORATTA DES COL ROSE 75ml V3,5,Descontinuado,BOT
12586,48654,-,FLORATTA DES ANTIT AER BLUE 75g V10,1,Descontinuado,BOT
12586,48669,-,BOTICOLL CECITA DES COL BLOSSOM 100ml V2,2,Descontinuado,BOT
12586,48675,59516,REF NSPA LOC DES H CPO AMEI/NEG 400ml V2,0,Descontinuado,BOT
12586,48676,59517,REF NSPA LOC DES HID CPO AMEI 400ml V2,23,Descontinuado,BOT
12586,48677,-,REF NSPA SAB LIQ MAO AMEI 400ml V2,3,Descontinuado,BOT
12586,48687,-,MEN PROT FAC FPS 30 48ml V4,1,Descontinuado,BOT
12586,48700,-,EGEO DES COL HIT 90ml V2,23,Descontinuado,BOT
12586,48701,-,EGEO DES COL BEAT 90ml V2,19,Descontinuado,BOT
12586,48736,49048,CBEM CR HID MAO NUVEM 50g V3,0,Descontinuado,BOT
12586,48742,51161,CBEM DES ANT AER R/ALG 75g/125ml V2,7,Descontinuado,BOT
12586,48743,57079,DR BOTICA SHAMP POC ESPUMA 200ml V2,0,Descontinuado,BOT
12586,48744,-,DR BOTICA COND POC BRILHO 200ml V2,1,Descontinuado,BOT
12586,48773,-,NSPA SHAMP QUINOA 300ml V3,4,Descontinuado,BOT
12586,48776,51217,QUASAR GEL POS BARBA 110g V7,2,Descontinuado,BOT
12586,48780,49242,COFFEE DES ANTIT AER WOMAN SEDUC 75g V4,4,Descontinuado,BOT
12586,48990,-,INTENSE DES COL GLOS 50ML V2,23,Descontinuado,BOT
12586,49012,-,FLORATTA CR DES HID CPO F/SECR 200ml V3,1,Descontinuado,BOT
12586,49014,-,ACCORDES CREM DES HID CPO 200ml V2,1,Descontinuado,BOT
12586,49022,-,EGEO DES ANTIT AER CHOC 75G V3,3,Descontinuado,BOT
12586,49023,-,DREAM LOC DES HID CPO CEU/BAUN 200ml V2,0,Descontinuado,BOT
12586,49049,-,CBEM CREM HID P/MAOS BEIJINHO V2 45g,2,Descontinuado,BOT
12586,49051,55426,CBEM CR HID MAO R/ALG 50g V4,0,Descontinuado,BOT
12586,49089,59583,MATCH SHAMP NUTR REGENERADORA 300ml,9,Descontinuado,BOT
12586,49090,59582,MATCH COND NUTR REGENERADORA 280ml,1,Descontinuado,BOT
12586,49092,59580,MATCH OL BIF NUTR REGENERADORA 90ml,1,Descontinuado,BOT
12586,49144,-,MATCH LEAVE IN LISO PROLONGADO 150ml,5,Descontinuado,BOT
12586,49389,50213,MALBEC POMAD MODEL CAP ANTICASP CLUB 85g,1,Descontinuado,BOT
12586,49390,59034,MALBEC COND TRAT ANTICASPA CLUB 250ml,1,Descontinuado,BOT
12586,49402,56804,MATCH MASC CAP SCIENCE RECONS 250g,0,Descontinuado,BOT
12586,49881,85124,CBEM LOC DES HID CPO DELEITE V2 400ml,0,Descontinuado,BOT
12586,49882,85543,CBEM LOC DES HID CPO DELEITE V2 200ml,0,Descontinuado,BOT
12586,49883,85542,REF CBEM LOC DES HID CP DELEITE V2 350ml,0,Descontinuado,BOT
12586,49884,-,CBEM LOC DES HID CPO L/MEL V8 400ml,7,Descontinuado,BOT
12586,49886,-,REF CBEM LOC DES HID CPO L/MEL V6 350ml,4,Descontinuado,BOT
12586,49919,-,BOTI GARRAFA AGUA RPET,0,Descontinuado,BOT
12586,49946,-,CBEM LOC DES HID CPO DELEITE PRM 100ml,1,Descontinuado,BOT
12586,49954,86765,NSPA LOC DES HID FIRM QUINOA 400ml V2,5,Descontinuado,BOT
12586,49965,-,NSPA LOC DES HID CPO ORQ NOIRE 50ml PRM,10,Descontinuado,BOT
12586,49973,58373,FLORATTA DES COL RED BLOSSOM 75ml,7,Descontinuado,BOT
12586,49992,58521,CBEM MASC CAP HIDRATACAO NUVEM 250ml,1,Descontinuado,BOT
12586,50119,54231,MALBEC DES COL ULT BLEU 100ml,25,Descontinuado,BOT
12586,50169,48510,LILY CR HID MAO 50g V3,0,Descontinuado,BOT
12586,50187,-,CBEM SAB LIQ CPO BORB SHOW/BNH 150ml,1,Descontinuado,BOT
12586,50193,58968,MALBEC SHAMP ANTIQUEDA CLUB V2 250ml,0,Descontinuado,BOT
12586,50207,59036,MALBEC TON CAP 2/1 CLUB V2 100ml,0,Descontinuado,BOT
12586,50208,59037,MALBEC COND ANTIQUEDA CLUB 250ML V2,1,Descontinuado,BOT
12586,50211,59033,MALBEC SHAMP ESF ANTICASPA CLUB V2 150ml,0,Descontinuado,BOT
12586,50212,59034,MALBEC COND TRAT ANTIC CLUB 250ML V2,0,Descontinuado,BOT
12586,50220,59019,MALBEC LOC DES HID CPO CLUB V2 200ml,1,Descontinuado,BOT
12586,50224,59029,MALBEC CR P/ BARB SENSIT CLUB 100G V2,0,Descontinuado,BOT
12586,50225,59024,MALBEC BALM POS BARB SENSIT CLUB V2 100g,0,Descontinuado,BOT
12586,50230,59031,MALBEC SHAMP CABELOS OL CLUB 250ML,3,Descontinuado,BOT
12586,50379,-,"INTENSE BAT GLOSS STICK NUD/ROSD 3,2g",1,Descontinuado,BOT
12586,50456,-,EGEO DES COL SEX EDUCATION 90ml,2,Descontinuado,BOT
12586,50644,-,CBEM LOC DES HID CPO BUBBALOO UVA 200ml,8,Descontinuado,BOT
12586,50645,-,CBEM LOC DES HID CPO BUBBALOO MOR 200ml,0,Descontinuado,BOT
12586,50659,-,UOMINI DES ANTIT AER SPIRIT 75g,6,Descontinuado,BOT
12586,50680,88009,MAKE B BAT LIQ MAT C/AC POLIG BROWN 5ML,1,Descontinuado,BOT
12586,50820,87773,QUASAR DES COL RUSH V2 100ml,22,Descontinuado,BOT
12586,50862,-,REF QUASAR DES COL CLASSIC 100ml,8,Descontinuado,BOT
12586,50930,-,UOMINI DES COL SPIRIT PRM 10ml,3,Descontinuado,BOT
12586,50937,-,NSPA LOC DES HID CPO AMEI/NEG 75ml,0,Descontinuado,BOT
12586,51144,85122,CBEM DES ANTIT ROL L/MEL V7 55ml,0,Descontinuado,BOT
12586,51172,88010,MAKE B BAT LIQ MAT C/AC POLIG D/ROUG 5ML,2,Descontinuado,BOT
12586,51174,88018,MAKE B BAT LIQ MAT C/AC POLIG W/CASH 5ml,12,Descontinuado,BOT
12586,51175,88011,MAKE B BAT LIQ MAT C/AC POLIG EX/ROS 5ml,4,Descontinuado,BOT
12586,51177,88012,MAKE B BAT LIQ MAT C/AC POLIG G/BERR 5ml,0,Descontinuado,BOT
12586,51178,88015,MAKE B BAT LIQ MAT C/AC POLIG DP/ROS 5ml,0,Descontinuado,BOT
12586,51181,88016,MAKE B BAT LIQ MAT C/AC POLIG BR/WIN 5ml,0,Descontinuado,BOT
12586,51182,88017,MAKE B BAT LIQ MAT C/AC POLIG RED/BO 5ml,5,Descontinuado,BOT
12586,51215,-,QUASAR DES ANTIT AER BRAVE V3 75g,12,Descontinuado,BOT
12586,51230,85547,CBEM SAB BARRA SORT 4x80g,30,Descontinuado,BOT
12586,51268,85846,MAKE B BAS LIQ C/ GLYC TX 130 30g,3,Descontinuado,BOT
12586,51269,85864,MAKE B BAS LIQ C/ GLYC TX 210 30g,3,Descontinuado,BOT
12586,51270,85847,MAKE B BAS LIQ C/ GLYCOLIC TX 300 30g,1,Descontinuado,BOT
12586,51271,85848,MAKE B BAS LIQ C/ GLYC TX  190 30g,0,Descontinuado,BOT
12586,51272,85849,MAKE B BAS LIQ C/ GLYCOLIC TX 120 30g,4,Descontinuado,BOT
12586,51273,85850,MAKE B BAS LIQ C/ GLYC TX 260 30g,0,Descontinuado,BOT
12586,51274,85851,MAKE B BAS LIQ C/ GLYC TX 270 30g,0,Descontinuado,BOT
12586,51275,85852,MAKE B BAS LIQ C/ GLYC TX 180 30g,0,Descontinuado,BOT
12586,51276,85853,MAKE B BAS LIQ C/ GLYC TX  230 30g,0,Descontinuado,BOT
12586,51278,85854,MAKE B BAS LIQ C/ GLYC TX 100 30g,1,Descontinuado,BOT
12586,51279,85855,MAKE B BAS LIQ C/ GLYC TX 140 30g,3,Descontinuado,BOT
12586,51280,85856,MAKE B BAS LIQ C/ GLYC TX 220 30G,1,Descontinuado,BOT
12586,51281,85857,MAKE B BAS LIQ C/ GLYCOLIC TX 320 30g,13,Descontinuado,BOT
12586,51282,85858,MAKE B BAS LIQ C/ GLYC TX  330 30G,2,Descontinuado,BOT
12586,51422,88361,NSPA SAB BARR CPO AMEI 2x90g V2,0,Descontinuado,BOT
12586,51423,88365,NSPA SAB BARR CPO AMEI 3x90g V4,14,Descontinuado,BOT
12586,51448,48315,FLORATTA DES COL GOLD 75ml V2,13,Descontinuado,BOT
12586,51470,87478,BOTIK GEL LIMP FAC VITAM C 200g,5,Descontinuado,BOT
12586,51473,59564,ESTJ BOTIK VITAMINA C,0,Descontinuado,BOT
12586,51525,51131,CBEM DES ANTIT ROLL ON BEIJINHO 55ml V2,0,Descontinuado,BOT
12586,51757,-,CBEM SAB BARR CPO SHOW BNH 100G,36,Descontinuado,BOT
12586,52011,-,NSPA LOC RAD D H CPO AMEI DOUR PRM 100ml,54,Descontinuado,BOT
12586,52041,-,LILY DES ANTIT AER LUMIER V2 75g,4,Descontinuado,BOT
12586,52050,-,CELEBRE LOC DES HID CPO AGORA 200ml,1,Descontinuado,BOT
12586,52058,-,MALBEC DES COL ELEGANT 100ml,0,Descontinuado,BOT
12586,52077,86670,MATCH CR P/PENT CRESPOS CIEN/CURV 450ml,3,Descontinuado,BOT
12586,52081,86667,MATCH LEAV CAP LEVE CIEN/CURV 250ml,0,Descontinuado,BOT
12586,52083,86666,MATCH BOOSTER RECONS CAP CIEN/CURV 90ml,4,Descontinuado,BOT
12586,52162,-,"INTENSE BAT CREM 580 V3 3,8g",6,Descontinuado,BOT
12586,52193,87927,"INTENSE BAT MATE POP 235 V2 3,8g",7,Descontinuado,BOT
12586,52194,87926,"INTENSE BAT MATE POP 360 V3 3,8g",5,Descontinuado,BOT
12586,52197,87960,"INTENSE BAT MATE POP 130 V3 3,8g",6,Descontinuado,BOT
12586,52198,87925,"INTENSE BAT MATE POP 330 V7 3,8g",9,Descontinuado,BOT
12586,52199,87959,"INTENSE BAT MATE POP 520 V2 3,8g",5,Descontinuado,BOT
12586,52200,-,INTENSE BAT LIQ MATE 230 V2 5ML,4,Descontinuado,BOT
12586,52202,87924,"INTENSE BAT MATE POP 430 V3 3,8g",11,Descontinuado,BOT
12586,52225,88468,NSPA SAB BARR CPO AMEI 90g V6,5,Descontinuado,BOT
12586,52259,-,"INTENSE BAT SUP/FRESH NUDE V3 3,4g",1,Descontinuado,BOT
12586,52540,59126,ESTJ MALBEC CLUB TRATAMENTO V2,2,Descontinuado,BOT
12586,52591,85797,REF ELYSEE CR DES HID ACET CPO 200g,0,Descontinuado,BOT
12586,52636,-,NSPA LOC DES HID CPO LICHIA 250ML,3,Descontinuado,BOT
12586,52668,-,LILY CR DES HID CPO 75g,0,Descontinuado,BOT
12586,52723,-,LIZ CR DES HID CPO 100ml,8,Descontinuado,BOT
12586,52740,86669,REF MATCH CR PENT CRESP CIEN/CURV 400ml,2,Descontinuado,BOT
12586,52792,-,ESTJ NSPA SORTIDO PRESENTEAVEL,0,Descontinuado,BOT
12586,52796,-,MAKE B LIP/CHEEK TINT S/HIT RED SUNS 7ml,0,Descontinuado,BOT
12586,52852,-,MA CHERIE DES COL JEANS 100ml,1,Descontinuado,BOT
12586,52853,-,MA CHERIE DES COL AMIE 100ml,5,Descontinuado,BOT
12586,52865,-,FLORATTA CR DES HID CPO RED 200ml,0,Descontinuado,BOT
12586,52892,-,ARBO DES BDY SPR VERDE 100ml,4,Descontinuado,BOT
12586,53069,-,ESTJ MALBEC PAIS/23,0,Descontinuado,BOT
12586,53342,-,"MAKE B PLT MAQ MULTIF R EAL HYPE 38,4g",1,Descontinuado,BOT
12586,53350,-,NSPA OLEO CREM CPO LILAC 175g,2,Descontinuado,BOT
12586,53365,-,NSPA SAB BARRA CPO FLORES 3x90g,0,Descontinuado,BOT
12586,53374,-,NSPA MASC CAP COND AMEI DOUR 200ml,1,Descontinuado,BOT
12586,53391,86756,NSPA SAB LIQ PERF QUINOA 250ml,9,Descontinuado,BOT
12586,53409,86759,REF NSPA SAB LIQ CPO PERF AMEIXA 200ml,3,Descontinuado,BOT
12586,53410,86758,REF NSPA SAB LIQ CPO PERF AMEI/NEG 200ml,15,Descontinuado,BOT
12586,53411,86754,REF NSPA SAB LIQ CP PERF ORQ/NOIRE 200ml,2,Descontinuado,BOT
12586,53483,-,SOPHIE PLT MULTIF DISNEY WISH,1,Descontinuado,BOT
12586,53486,-,SOPHIE GEL CAP GLIT DISNEY100 120g,1,Descontinuado,BOT
12586,53686,-,CBEM LOC DES HID CPO FEIRA BANANA 400ml,0,Descontinuado,BOT
12586,53729,-,MAKE B ESPONJA MAQ PU,10,Descontinuado,BOT
12586,53775,59493,MALBEC SHAMP GRISALHOS CLUB V3 250ml,2,Descontinuado,BOT
12586,53793,-,CBEM SAB BARRA FEIRA MARACUJA 2x80g,2,Descontinuado,BOT
12586,53844,-,MAKE B PINCEL ILUMINADOR ABS,0,Descontinuado,BOT
12586,53846,-,MAKE B PINCEL P/ESFUM SOMB ABS,0,Descontinuado,BOT
12586,53849,-,"INTENSE BAT ARRASO VERM POR DO SOL 3,6g",7,Descontinuado,BOT
12586,53850,-,"INTENSE BAT ARRASO ROSA SOU MAIS EU 3,6g",9,Descontinuado,BOT
12586,53967,59196,CBEM MASC CAP SCH FEIRA BANANA 30ML,3,Descontinuado,BOT
12586,53971,59198,CBEM MASC CAP SCH FEIRA PASTA ABAC 30ml,4,Descontinuado,BOT
12586,53997,-,COMB FLORATTA MY BLUE,0,Descontinuado,BOT
12586,54017,-,ESTJ LILY L EAU DE NAT/23,0,Descontinuado,BOT
12586,54152,-,MALBEC DES COL ICON PRM 10ml,1,Descontinuado,BOT
12586,54184,55195,REF CBEM LOC DES HID CPO CER LIVRE 350ml,0,Descontinuado,BOT
12586,54197,86154,ESTJ BOTIK ACIDO HIALURONICO,1,Descontinuado,BOT
12586,54461,-,ZAAD EDP VENTURE PRM 10ml,14,Descontinuado,BOT
12586,54496,-,NSPA SHAMP AMEI/NEG 300ml,4,Descontinuado,BOT
12586,54652,-,"MAKE B PLT SOMBRA NATURAL AND MORE 14,4g",4,Descontinuado,BOT
12586,54678,-,"INTENSE BAT CREM BY AMOR COR AMOR 3,8g",4,Descontinuado,BOT
12586,55170,-,CBEM LOC DES HID CP FEIR BANANA PRM 50ml,5,Descontinuado,BOT
12586,55364,-,LILY EDP GARDENIA PRM 10ml,3,Descontinuado,BOT
12586,55408,-,BOTIK CR N FIR ROST/PESC RES/SIL PRM 10g,138,Descontinuado,BOT
12586,55490,-,MAKE B BAT BALA GLOSS BLACKBERRY,3,Descontinuado,BOT
12586,55609,-,CASA 214 SPR AROMAT GARD/IMPER PRM 10ml,9,Descontinuado,BOT
12586,55640,-,"NSPA BALM HID LAB LILAC 7,5ml",2,Descontinuado,BOT
12586,55648,-,MEN DES COL NBA 100ml,1,Descontinuado,BOT
12586,55658,-,FLORATTA DES COL ROMANC/VERAO PRM 10ml,31,Descontinuado,BOT
12586,55659,58372,FLORATTA DES COL ROMANC/VERAO 75ml,0,Descontinuado,BOT
12586,56136,-,ESTJ EGEO DOLCE MAES/24,0,Descontinuado,BOT
12586,56137,-,ESTJ LINDA MAES/24,0,Descontinuado,BOT
12586,56139,-,ESTJ LIZ MAES/24,0,Descontinuado,BOT
12586,56140,-,ESTJ FLORATTA BLUE MAES/24,0,Descontinuado,BOT
12586,56141,-,ESTJ LILY LEAU DE MAES/24,0,Descontinuado,BOT
12586,56142,-,ESTJ LILY MAES/24,0,Descontinuado,BOT
12586,56143,-,ESTJ EGEO CHOC MAES/24,0,Descontinuado,BOT
12586,56153,-,CELEBRE CREM HID MAOS FEM MAES/24 50g,0,Descontinuado,BOT
12586,56186,84739,MATCH SHAMP NUTRICAO PROFUNDA 50ml,6,Descontinuado,BOT
12586,56188,84744,MATCH MASC CAP NUTRICAO PROFUNDA 70g,5,Descontinuado,BOT
12586,56257,-,"INTENSE GLOS LAB DEL/CHOCOLAT ROSA 5,5ml",9,Descontinuado,BOT
12586,56276,52155,"INTENSE BAT CREM 120 PRM 3,8g",0,Descontinuado,BOT
12586,56385,81384,COFFEE DES COL WOMAN ADDICTIVE 100ml,4,Descontinuado,BOT
12586,56402,81330,COFFEE DES COL MAN ADDICTIVE 100ml,3,Descontinuado,BOT
12586,56404,-,COFFEE LOC DES HID CPO WOM ADDICT 200ml,2,Descontinuado,BOT
12586,56407,-,COFFEE DES COL MAN ADDICTIVE PRM 10ml,1,Descontinuado,BOT
12586,56487,-,OUI SHW GEL CAB/CPO LE FLANEUR 020 200g,0,Descontinuado,BOT
12586,56541,-,PRIV EDP LA COLL AUX LEG PETIT POIS 75ml,0,Descontinuado,BOT
12586,56542,-,PRIV EDP LA COLL AUX LEG CAROTTE 75ml,0,Descontinuado,BOT
12586,56554,-,OUI EDP LOR DE LA MEDITERRANEE MASC 75ml,0,Descontinuado,BOT
12586,56557,-,OUI EDP LOR DE LA MEDITERRANEE FEM 75ml,0,Descontinuado,BOT
12586,56577,-,QDB KIT PINCEIS SUPER COLOR,0,Descontinuado,QDB
12586,56754,48285,NSPA SAB LIQ CPO AMEI V4 200ml,6,Descontinuado,BOT
12586,56810,88007,MATCH COND SCIENCE CRESCIMENTO V2 280ml,1,Descontinuado,BOT
12586,56936,-,GLAMOUR DES COL SCRT BLACK MAES/24 30ml,0,Descontinuado,BOT
12586,56956,87477,QDB BAT LIQ CR DOS SONHOS VERMELITE 4ml,0,Descontinuado,QDB
12586,56957,87605,QDB BAT LIQ CREM DOS SONHOS ROSITE 4ml,0,Descontinuado,QDB
12586,56958,87606,QDB BAT LIQ CREM DOS SONHOS ROXITE 4ml,0,Descontinuado,QDB
12586,56959,87476,QDB BAT LIQ CREM DOS SONHOS MARRONZ 4ml,0,Descontinuado,QDB
12586,56991,-,CBEM COND MANGA FEIRA BRASIL 170ml,1,Descontinuado,BOT
12586,57044,-,CBEM SRUM CPO UNIF PESSEGUR/DEPIL 30ml,3,Descontinuado,BOT
12586,57219,49217,NSPA SAB LIQ CPO MORANGO RUBY V2 200ml,3,Descontinuado,BOT
12586,57360,-,MATCH MASC C SCIEN PRE/POS QUIM PRM 50ml,13,Descontinuado,BOT
12586,57369,-,SOPHIE NEXT SAB LIQ DIVERT2 MEM 200ml,4,Descontinuado,BOT
12586,57444,-,MAKE B BAT LIQ VELV/SBLM ONE DEEP/CAR 2g,2,Descontinuado,BOT
12586,57473,-,"MAKE B ILUM FAC STCK SUN HIT ROSE 6,5g",2,Descontinuado,BOT
12586,57495,-,CJ SCH CBEM FEIRA BRASIL SH/COND 2x7ml,0,Descontinuado,BOT
12586,57504,-,"MAKE B PLT MULTIF CER/ROUGE NAT/24 73,8g",5,Descontinuado,BOT
12586,57505,-,MAKE B PLT SOMBRAS ONE 24g,7,Descontinuado,BOT
12586,57521,-,ESTJ LILY AMOR/24,0,Descontinuado,BOT
12586,57530,-,ESTJ EGEO CHOC AMOR/24,0,Descontinuado,BOT
12586,57531,-,ESTJ EGEO BLUE AMOR/24,0,Descontinuado,BOT
12586,57534,-,ESTJ CELEBRE AGORA FEM AMOR/24,0,Descontinuado,BOT
12586,57537,-,LILY GELEIA ILUM DES HID CPO 75g,0,Descontinuado,BOT
12586,57546,-,COFFEE SHW GEL CAB/CPO MAN V2 200g,0,Descontinuado,BOT
12586,57556,-,EGEO DES COL CHOC BERRY 50ml,0,Descontinuado,BOT
12586,57743,-,CJ SCH BOT SUN A/F PR FAC C1/C2/C3 3x5ml,0,Descontinuado,BOT
12586,57744,-,CJ SCH BOT SUN A/F PR FAC C3/C4/C5 3x5ml,0,Descontinuado,BOT
12586,57766,-,"INTENSE BAT CREM POP ROSA MALVA 3,6g",15,Descontinuado,BOT
12586,57767,-,"INTENSE BAT CREM POP VERMELHO 3,6g",15,Descontinuado,BOT
12586,57801,-,SOPHIE NEXT AROMAT DIVERT2 MEM 100ml,5,Descontinuado,BOT
12586,57835,-,NSPA CR FIRM COLO 5/1 CER/ROUGE 200g,0,Descontinuado,BOT
12586,57837,-,NSPA LOC DES AVEL CPO CER/ROUGE PRM 50ml,95,Descontinuado,BOT
12586,57871,88911,LILY SAB BARRA DECORADO 2x90g,16,Descontinuado,BOT
12586,58123,-,BOTICARIO NECESSAIRE NYLON,1,Descontinuado,BOT
12586,58133,-,DEM CBEM D/COL BDY SPLSH DEL/CHOCOL 4ml,0,Descontinuado,BOT
12586,58219,-,NSPA CREM ANT/RESSEC MAOS CER/ROUGE 50g,1,Descontinuado,BOT
12586,58238,-,CBEM SAB LIQ CPO NUV/ALEGRIA 150ml,4,Descontinuado,BOT
12586,58244,-,LINDA CREM DES HID CPO MAES/24 75ml,0,Descontinuado,BOT
12586,58315,-,BOTICA 214 LOC D H CP AFR/SU FL/FR 200g,2,Descontinuado,BOT
12586,58383,-,NSPA OL MULTIF GLORIOSO CER/ROUGE 85ml,2,Descontinuado,BOT
12586,58386,-,CJ SCH QDB GEL CPO PRAZER BERE 2x3g,0,Descontinuado,QDB
12586,58444,-,ESTJ COFFEE WOMAN SEDUCTION NAT/24,0,Descontinuado,BOT
12586,58445,-,ESTJ LILY ACETINADOS NAT/24,0,Descontinuado,BOT
12586,58446,-,ESTJ HER CODE NAT/24,0,Descontinuado,BOT
12586,58449,-,ESTJ GLAMOUR SEC/BL NAT/24,0,Descontinuado,BOT
12586,58453,-,ESTJ QUASAR VISION NAT/24,0,Descontinuado,BOT
12586,58454,-,ESTJ EGEO CHOC NAT/24,0,Descontinuado,BOT
12586,58456,-,ESTJ BOTICOLL PORTINARI NAT/24,0,Descontinuado,BOT
12586,58457,-,ESTJ EGEO DOLCE NAT/24,0,Descontinuado,BOT
12586,58458,-,ESTJ LINDA IRRESISTIVEL NAT/24,0,Descontinuado,BOT
12586,58460,-,ESTJ LIZ NAT/24,1,Descontinuado,BOT
12586,58461,-,ESTJ NSPA AMEI NAT/24,0,Descontinuado,BOT
12586,58462,-,ESTJ CBEM BOA NOITE NAT/24,0,Descontinuado,BOT
12586,58463,-,ESTJ NSPA AMEIXA DOURADA NAT/24,15,Descontinuado,BOT
12586,58465,-,ESTJ EGEO BOMB BLACK NAT/24,0,Descontinuado,BOT
12586,58466,-,ESTJ CELEBRE AGORA MASC NAT/24,0,Descontinuado,BOT
12586,58467,-,ESTJ CELEBRE AGORA FEM NAT/24,0,Descontinuado,BOT
12586,58471,-,ESTJ CBEM FEIRA NAT/24,0,Descontinuado,BOT
12586,58480,-,ESTJ ZAAD NAT/24,0,Descontinuado,BOT
12586,58493,-,COFFEE LOC DES HID CPO MAN AMERIC 200ml,0,Descontinuado,BOT
12586,58511,-,DR BOTICA BONECO PELUCIA PES V2,0,Descontinuado,BOT
12586,58527,-,QUASAR DES BDY SPR DEEP BLUE 100ml,0,Descontinuado,BOT
12586,58533,-,QUASAR DES COL DEEP BLUE PRM 10ml,1,Descontinuado,BOT
12586,58590,-,BOTICA 214 SHW GEL CAB/CP/ROS V/FIR 100g,0,Descontinuado,BOT
12586,58594,-,EGEO SHW GEL CAB/CPO BOMB BLACK 100g,0,Descontinuado,BOT
12586,58596,-,NSPA CREM HID MAO AMEI DOUR 30g,0,Descontinuado,BOT
12586,58682,-,DEM OUI EDP LOR/LA MEDIT FEM 5ml,0,Descontinuado,BOT
12586,58717,-,CJ FLAC OUI EDP LE CHARMEUR 250 3x1ml,0,Descontinuado,BOT
12586,58770,-,ESTJ CASA 214 VANILLA SUBLIME NAT/24,4,Descontinuado,BOT
12586,58772,-,ESTJ MALBEC X NAT/24,0,Descontinuado,BOT
12586,58774,-,MALBEC DES BDY SPR GOLD 100ml,0,Descontinuado,BOT
12586,58788,-,BOTI MASC P/DORMIR CETIM NAT/24,0,Descontinuado,BOT
12586,58865,-,BOTI NECESS PREM FEM BRANCA PU NAT/24,0,Descontinuado,BOT
12586,58869,-,BOTI NECESS MASC AZUL LONA NAT/24,0,Descontinuado,BOT
12586,58919,-,EGEO DES COL BANANA 90ml,8,Descontinuado,BOT
12586,58924,-,EGEO DES COL BANANA PRM 10ml,34,Descontinuado,BOT
12586,58928,-,ESTJ DR BOTICA POCAO CORACAO CRIANCAS/24,0,Descontinuado,BOT
12586,58929,-,ESTJ DR BOTICA POCAO CORAGEM CRIANCAS/24,0,Descontinuado,BOT
12586,58930,-,ESTJ MA CHERIE 24,5,Descontinuado,BOT
12586,59051,-,MAKE B BAT LIQ RETIN 3 H RED VELVET 6ml,1,Descontinuado,BOT
12586,59052,-,MAKE B BAT LIQ RETIN 3 H PINK/HIBISC 6ml,1,Descontinuado,BOT
12586,59059,-,EGEO DES COL MELANCIA PRM 10ml,1,Descontinuado,BOT
12586,59183,-,GLAMOUR CR DES H CP SCRT/BL INTENS 200ml,1,Descontinuado,BOT
12586,59268,-,NSPA OLEO ACUCAR ESF CPO PITAYA 200g,2,Descontinuado,BOT
12586,59306,87896,FLORATTA EDP RED PASSION 75ml,14,Descontinuado,BOT
12586,59406,-,"INTENSE GLOSS LAB ED LTDA BANANA 5,2ml",0,Descontinuado,BOT
12586,59877,-,BOTIK CR MULTR FAC CIC/PANT/CER PRM 10g,74,Descontinuado,BOT
12586,70112,-,BOTICA 214 LC D/HD SEV/DOR AMOR/25 200ml,0,Descontinuado,BOT
12586,70672,53921,DR BOTICA COL INF POC/CORAC 120ml,0,Descontinuado,BOT
12586,71780,57299,DEM EGEO DES COL RED 4ml,0,Descontinuado,BOT
12586,71792,57303,DEM EGEO DES COL BLUE 4ml,0,Descontinuado,BOT
12586,72483,53935,FLORATTA DES ANTIT ROLL BLUE 55ML V6,1,Descontinuado,BOT
12586,73381,-,BOTICOLL STYLET DES BDY SPR 100ml V7 PCK,4,Descontinuado,BOT
12586,73608,84388,MALBEC DES COL NOIR 100ml V2,22,Descontinuado,BOT
12586,73794,50214,MALBEC POS BARB CLUB 100g,0,Descontinuado,BOT
12586,73811,56027,MEN SAB BARRA 2X90g V3,0,Descontinuado,BOT
12586,73831,-,EGEO CREM DES HID CPO DOLCE 100ml,0,Descontinuado,BOT
12586,73832,-,EGEO CREM DES HID MAOS DOLCE 50g,0,Descontinuado,BOT
12586,73849,84391,MALBEC DES COL GOLD 100ML V2,0,Descontinuado,BOT
12586,74029,49244,COFFEE DES COL MAN 100ml V3,10,Descontinuado,BOT
12586,74222,53931,MEN DES ANTIT AER 75G V4,0,Descontinuado,BOT
12586,74325,-,NSPA CREM HID DES MAOS KARITE 75g,2,Descontinuado,BOT
12586,74440,-,ARBO DES COL LIBERTE 100ml V2,13,Descontinuado,BOT
12586,74723,84392,MALBEC DES COL BLACK 100ml,0,Descontinuado,BOT
12586,74906,86752,MALBEC SHW GEL CPO BLACK 200G,0,Descontinuado,BOT
12586,75082,-,FLORATTA CREM DES HID CPO BLUE 75g,35,Descontinuado,BOT
12586,75149,54169,SOPHIE SHAMP CACH 200ml,1,Descontinuado,BOT
12586,75152,85543,CBEM LOC HID DES CPO DELEITE 200ml,0,Descontinuado,BOT
12586,75163,59169,SOPHIE COND CACH 200ML,15,Descontinuado,BOT
12586,75164,59170,SOPHIE CREM PENT CACH 200ML,5,Descontinuado,BOT
12586,75381,59138,QDB PO ILUM COMP ROSELUZ 5g V2,0,Descontinuado,QDB
12586,75395,56806,"QDB PO COMP FAC TRANSL INSTMAT 5,5g RPCK",0,Descontinuado,QDB
12586,75478,56932,DEM LILY EDP LOVE 4ml,0,Descontinuado,BOT
12586,75493,59134,"MAKE B PO COMP FAC ILUM GOLD 5,4g",8,Descontinuado,BOT
12586,75495,85666,MAKE B PLT BLUSH PINK HIT 8g,0,Descontinuado,BOT
12586,75552,87925,"INTENSE BATOM MATE 330 3,8g V6",6,Descontinuado,BOT
12586,75609,-,INTENSE DES COL BOOM 50ML,6,Descontinuado,BOT
12586,75624,52200,INTENSE BAT LIQUIDO MATE 230 5ml,1,Descontinuado,BOT
12586,75639,-,"INTENSE MONOSOMBRA COMP AC BRONZE 1,5g",2,Descontinuado,BOT
